,branch,congressID,ideology_score,page,part,speaker,speech,year
194,Senate,101,0.1,896,7,Mr. COHEN.," Mr. President, I want  to call my colleagues' attention to a  matter which I believe is of great importance. That has to do with some  key Judgments that have been recently filed with the Senate Intelligence  Committee as a result of an investigation conducted by the Defense Intelligence Agency. Last year, during the  markup of the intelligence authorization portion of the Defense bill, I included an amendment which required  DIA to conduct an analysis of the security programs that are currently in  place for several of our DOD research,  development,  testing, and evaluation  centers in this country.  The DIA has done an outstanding  Job, and I want to take this opportuniRECORD.  There being no objection, the Key  Judgments from the report were or dered to be printed in the RECORD, as  follows:  KEY JUDGMENTS  <U> The following conclusions are based  on a survey of the test sites at Vandenberg  Air Force Base, California, Cape Canaveral  Air Force Station, Florida, and White Sands  Missile Range, New Mexico, and discussions  ",1990
195,Senate,101,0.078,948,7,Mr. HEI.,"Ms,  the  names of the Senator from Iowa CMr.  GRAssLEYl,  the Senator  from Con necticut CMr. LIEBERMAN], the Senator  from Minnesota CMr. BoscHWITZ], the  Senator from Alabama CMr. SHELBY],  the  Senator  from  Alabama  [Mr.  HEFLIN], the Senator from Utah [Mr.  HATCH],  the Senator  from  Indiana  CMr. COATS], the Senator from Illinois  [Mr. DIXON], and the Senator from  Pennsylvania  CMr.  SPECTER]  were  added as cosponsors of S. 1587, a bill  to amend the Internal Revenue Code  of 1986 to provide for the designation  on income tax forms of overpayments  of tax and contributions to reward the  return of a Vietnam POW /MIA.  s. 1880  At the request of Mr. BOREN,  the  names of  the Senator  from Hawaii  CMr.  INOUYE] and the Senator from  Minnesota  added as cosponsors of S. 1860, a bill  [Mr. DURENBERGER] were  ",1990
196,,101,-0.291,974,7,Mr. DONNELLY.," Mr. Speaker, the Subcom mittee on Select Revenue Measures of  the  Committee on Ways and Means is currently in  the process of considering modifications  to  the tax treatment of life insurance companies.  At issue is a true measure of a life insurance  company's  income  for purposes of imposing  the Federal income tax.  As a member of that Subcommittee, I have  been closely  involved  in  this process, and  I  have been paying close attention to potential ly disturbing trends in the industry. Clearly, our  Subcommittee has two obligations during our  deliberations: the first is to enact sound, legiti mate  income  tax policy. The  second  is  to  insure that life insurance company policyhold ers are protected.  To that end,  I would like to have printed in  the RECORD an article from the July 10, 1989  issue of Forbes magazine entitled  ""You Bet  Your Life."" The article points out that all may  not be well in the life insurance industry, and  highlights some disturbing trends that all of us  should be aware of during  this debate. We  should be cautioned by  the debacle  in  the  savings and  loan  industry and  further cau tioned by  the  fact  that  the Federal Govern ment has no protection available to life insur ance company policyholders who lose their in vestment if the company through which  they  own their policy goes bankrupt.  Perhaps the time has come for greater Fed eral regulation of the insurance industry gen erally. Certainly,  the Federal  tax  laws are an  appropriate place to start. Nonetheless, I think  that the Forbes article bears close attention,  and I urge my colleagues to study it carefully.  [From Forbes Magazine, July 10, 1989]  You BET YOUR LIFE  <By Gretchen Morgenson>  Of the 155 million Americans who own  some form of life insurance, few are fully  aware of  the  industry's eroding  financial  base and its rising rate of failures. This ig norance  is not bliss. Unlike customers at  banks and  savings and  loan  institutions,  people who trust their money to life insur ance companies are not protected by a fed eral bailout mechanism.  No, we're not predicting massive failures  among  life companies, as happened with  savings and loans and,  to a  lesser extent,  commercial  banks. But only  an  ostrich  would ignore signs of a seriously deteriorat ing situation.  ""The freewheeling approach of some  in  the insurance industry may put these com panies on a crash course similar to the route  taken by many of our nation's S&L's,"" says  Thomas Wheeler, chief executive of Massa chusetts Mutual Life Insurance Co., the nation's 11th-largest life insurer. Mass Mutual  is widely  regarded as one of  the sounder  companies, and Wheeler is referring to life  companies that have been taking excessive  risks in their investment portfolios.  Life insurance isn't supposed to be a risky  business. But since 1987 some two dozen life  insurance companies have defaulted. This  marks a sharp departure from the previous  two decades, when the failure rate was run ning at about one life insurer per year.  So far, the failed companies have been rel atively small. The annual bailout costs have  jumped from less than $9 milion in 1982 to  about $70 million on average in the past two  years. Most of the losses  to policyholders  have been made good by healthy insurance  outfits under various state guaranty fund  systems. But if the failures mount, this pro  bono publico policy will give way to simple  self-preservation.  If the problems were  limited  to a  few  highfliers, they could be fairly easily con tained. Unfortunately,  they are not. The  same high-risk strategies and  investments  that forced some small insurers into insol vency are now nagging some of  the big name life companies like Equitable Life As surance Society, Travelers  Insurance and  I.C.H. Corp. Across  the  industry, balance  sheets have weakened dramatically. Five  years ago all the life insurance companies  followed by the rating agencies were rated  Aaa; today only 40% have that top rating,  according to Moody's Investors Service.  What are the trouble signs? Perhaps the  most alarming is shrinking capital and sur plus accounts, which are meant to cushion  against unforeseen risk. One key measure  compares capital with portfolio risk. Using  100 as an adequate level of capital needed to  compensate for portfolio risk, an index com piled by Moody's shows a steady decline,  from 110  four years ago  to 96  today see  chart, opposite).  Another dicey development  is  the  fact  that more and more mutual life insurers are  being  forced  to  reduce dividends paid  to  their policy holders-a clear indication of a  profit squeeze. Last year Mutual of New  York, with $24 billion in assets, reduced its  dividend by 3.5%. Manufacturers Life Insur ance Co., with $19.9 billion in assets has cuts  its rates 4.3% over the past two years.  It is hardly reassuring to note that many  insurance companies are starting to employ  questionable accounting  techniques to  im prove the look of their net capital positions.  Late last year, for example, two large life in surers  entered  into unusual  transactions  with Citibank. General American Life Insur ance Co. of St. Louis ($5.1 billion, assets)  and Washington National Insurance of Ev anston,  Ill.  ($1.9 billion, assets> sold Citi bank future premiums worth $75 million  and $30 million,  respectively. These sales  had the effect of boosting both companies'  net capital positions because  the  insurers  immediately booked as assets the $75 mil lion and $30 million they received from Citi bank. But what  the bookkeeping entries  didn't show was  that both  insurers had  mortgaged some of their future cash flow.  Indeed, a few months ago the New York  State  superintendent of  insurance  ruled  Forum  Insurance  that the sale of future premiums is really a  loan, and so an amount equal to the premi um sale should appear as a liability on the  insurer's balance sheet. The superintendent  found the Citibank deals ""inconsistent with  statutory accounting principles."" But  the  sales have not been officially disallowed, nor  have the insurers restated their financials.  These transactions are nothing more than  an effort to mask capital depletions. With out them, Washington National would have  shown a $13 million statutory loss in capital  for 1988, and General American would have  had a $4 million decrease.  The stakes are mounting. The amount of  money that changed hands in these transac tions was relatively small. But word has it  that similar premium sales are being consid ered by two industry giants. Equitable Life  Assurance Society and  the Massachusetts  Indemnity & Life Insurance Co., a subsidi ary of A.L. Williams. Warns Joseph Belth,  editor  of  newsletter,  ""When these guys begin to play games like  this, you may be getting closer to a disas ter.""  What's behind the balance sheet deterio ration? A classic profit squeeze. Life insur ance marketing and sales expenses have  continued to rise over the past few years,  but the nation's increasingly sophisticated  consumers are demanding products such as  universal life policies and annuities, leaving  insurers with slim profits, at best. Gone are  the days when simple whole  life policies  made up the bulk of an insurer's business.  Life  insurers, pitted against mutual funds  and brokerage firms for America's invest ment dollar, have in some cases resorted to  wildly aggressive tactics.  A case in point is Equitable, the giant in surer that got into big trouble with guaran teed investment contracts. Back in the late  1970s and early 1980s premium inflow from  consumers was slowing down, so Equitable  took  in money , to manage  from pension  funds at huge companies like General Dy namics and General Electric. To attract the  business, Equitable-and others-promised  higher long-term rates of returns than their  investment managers  could  realistically  hope to generate.  Other examples are I.C.H., a publicly held  Louisville, KY company that's big in univer sal life policies, and Integon, a sizable annu ity seller that troubled Southmark agreed  to sell in May. Both have seen the quality of  their  capital  bases  decline  significantly.  Knickerbocker Life Insurance, a 70-year-old  company out of El Paso, failed in May. The  company, which came up $22 million short  in receivership, was a big seller of annuities  with overly optimistic payout rates.  Low-profit and no-profit products-com bined with cutthroat competition-have hit  life  insurers hard. Nationwide,  the  indus try's returns on  surplus capital-roughly  equivalent to returns on equity for nonin surance companies-have steadily declined  from 15% in 1984 to 9.5% today.  Balance  sheets  have  deteriorated,  too.  During the 1980s, life insurers invested bil lions of dollars in junk bonds. Many compa nies were virtually forced to go for the high est yields because of the guaranteed invest  This ""bullet"" symbol identifies statements or insertions which are not spoken by a Member of the Senate on the floor.  Matter set in this typeface  indicates words inserted or appended, rather than spoken, by a Member of the House on the floor.  ",1990
197,,101,0.423,987,7,Mr. BAKER.," Mr. Speaker,  I would  like  to  to commend William J.  take  this opportunity  Brady, general manager of Halko  Industries,  Inc.,  in DeQuincy, LA, who has been named  the 1990 Small Business Winner From  the  State of Louisiana, and to commend all those  who have  formed  small  business ventures  throughout Louisiana and the Nation.  Mr. Brady formed Halko Industries, Inc., ap proximately 4 years ago. His company engi neers, designs, and manufactures cargo nets  and other aircraft materials used  in  cargo  planes.  The week of May 6-12, 1990 was designat ed as Small Business Week, and Mr. Brady  along with other States winners were honored  in a 3-day event  in Washington DC. Small  Business Week allows us  the opportunity  to  focus  our  attention  on  the  outstanding  achievements of  individuals  like Mr. Brady  who make vital contributes  to  improve our  economy.  Small  firms employ 6 of every 10 people,  provide the majority of new jobs in the Nation,  and are more flexible than big business in reEXTENSIONS OF REMARKS  sponding  to shifting markets. Clearly, small  firms are able  to bring new products  to  the  market faster than large businesses, and pro vide two of every three workers with their first  jobs. Of equal  importance  is  the  fact  that  small businesses are  responsible  for more  than half of all  the  innovations developed  during the 20th century.  Clearly, Mr. Brady along with millions of  other small business entrepreneurs should re ceive  our  utmost  support,  encouragement,  and respect.  THE NATIONAL SUMMIT  CONFERENCE ON EDUCATION  HON. PAT WILLIAMS  OF MONTANA  IN THE HOUSE OF REPRESENTATIVES  Thursday, May 10, 1990  ",1990
198,,101,-0.315,987,7,Mr. WILLIAMS.," Mr. Speaker, today, I am in troducing, with my colleague from Pennsylva nia Mr. GOODLING,  the National Summit Con ference on Education Amendments of 1990.  Congress  enacted  the original  education  summit conference  legislation  in 1984. The  purpose of that legislation was to have an in clusive, organized discussion about proposals  for education  reform and about how  those  proposals could be implemented. That discus sion was to involve concerned individuals rep resenting all areas of education, business,  labor, and  the public.  It was be an  inclusive  approach, recognizing  that if we as a nation  are going to solve the problems facing educa tion, we must involve as many people as pos sible in the consideration of how those prob lems can be solved.  Since  the  initial enactment of  the summit  legislation in 1984, a number of events have  occurred. Congress has taken the necessary  steps to implement the summit. It has appoint ed  its Members  to  the summit's executive  committee.  The  Congress  appropriated  $500,000  to carry out  the activities of  the  summit. But  to date the all-inclusive summit  envisioned by Public Law 98-524 has yet to  come about.  The amendments we  offer  today  to  the  1984 law will conclude as Congress intended.  This  legislation changes  the composition of  the original executive committee. And, given  the action  to date by  the President and  the  Governors, it amends the summit's agenda to  include a consideration of  the now existing  goals and recommendations. Finally the legis lation encourages the critical determination as  to how  these goals might be  implemented,  and what levels of government have responsi bilities to bear in that implementation.  Mr. Speaker,  if we are to be successful in  reforming education in this Nation, we need to  involve the people who are to carry out those  reforms. The  legislation Mr. GOODLING and  I  introduce today is the final  legislative step in  that direction.  RUTHLESS ASSASSINATION OF  DR. KAZEM RAJAVI  10117  HON. JIM BATES  OF CALIFORNIA  IN THE HOUSE OF REPRESENTATIVES  Thursday, May 10, 1990  ",1990
199,,101,-0.279,987,7,Mr. BATES.," Mr. Speaker, I am certain many  of you, with great sadness, have  learned of  the  ruthless  assassination  of  a prominent  human  rights activist, Dr. Kazem Rajavi, by  the  Iranian  regime's mercenaries  in  recent  weeks. Dr. Rajavi, an outstanding international  representative of the  Iranian people's resist ance for peace and freedom, was the brother  of Mr. Massoud Rajavi,  the president of the  National Council of Resistance of  Iran, who  has perspicaciously  led a popular resistance  against the Tehran clerical tyranny for almost  a decade.  Dr. Rajavi devoted the last 19 years of his  life to unrelented activities against the dicta torships of the Shah and Khomeini. He often  attended  various  international  conferences  and forums to expose the unabated violations  of human rights in Iran and to defend the very  rights  that the  Iranian people had  fought  for  and sacrificed so many  lives  for under  the  Shah's tyranny.  After  the  fall of the Shah, Dr. Rajavi was  Iran's first Ambassador to the U.N. headquar ters in Geneva. However, shortly after his ap pointment, he resigned his post in protest to  the repressive policies and  terrorist activities  of the ruling clerics in Iran. He then intensified  his campaign against mass executions, arbi trary arrests, and the medieval tortures exer cised by the clerics in Tehran. Since the for mation of the National Council of Resistance  in 1981, Dr. Rajavi had been representing the  Iranian Resistance  in many  international as semblies, and every year headed  the  resist ance delegation to the U.N. General Assembly  in New York and  the Commission of Human  rights  in Geneva. His constant and effective  efforts, prompting international attention to the  horrible situation in  Iran, resulted  in condem nation of the Iranian clerical despotism by the  United Nations and a variety of other human  rights organizations in the past few years.  Dr. Rajavi was a resident of France  from  1957  to 1968, and subsequently  resided  in  Switzerland, where  he was  given  political  asylum. He received six doctorate degrees in  the fields of law, political science and sociolo gy from the universities of Paris and Geneva,  where he held professorship's post in the last  10 years.  Due to his active and effective role in con demning  the medieval autocracy  ruling  Iran,  the  regime's authorities despised him  and  plotted his murder. On many occasions, he  was reportedly threatened with death by the  Khomeini regime's terrorist-diplomats and per sonal envoys of Rafsanjani, the Iranian Presi dent,  to Europe. Nonetheless, he constantly  and bravely confronted Khomeini's agents in  the various organs of the United Nations, en gaging  in a  full-fledged struggle  for human  rights and for helping to establish a democrat ically  elected government by  the National  Council of Resistance of Iran.  ",1990
200,Senate,101,-0.309,1013,7,Mr. BYRD., Will the Senator yield?  ,1990
201,House,101,-0.186,1091,7,Mr. MAZZOLI.," Mr. Speaker, I ask  unanimous consent that the Commit tee on the Judiciary may have until 5  p.m. today to file reports on H.R. 4612  and H.R. 29.  The SPEAKER. Is  there objection  to the request of the gentleman from  Kentucky?  There was no objection.  PERMISSION  FOR  COMMITTEE  ON  PUBLIC  WORKS  AND  TRANSPORTATION  TO  FILE  REPORT ON H.R. 2273, AMERI CANS WITH DISABILITIES ACT  ",1990
202,House,101,-0.097,1091,7,Mr. LAUGHLIN.," Mr. Speaker, I ask  unanimous consent that the Commit tee on Public Works and Transporta tion may have until midnight tonight,  May 14, 1990, to file a report on H.R.  2273, the Americans with Disabilities  Act.  I would advise, Mr. Speaker, this has  been cleared with the minority.  The SPEAKER. Is  there objection  to the request of the gentleman from  Texas?  There was no objection.  DESECRATION OF JEWISH  CEMETERIES IN FRANCE  <Mrs. SCHROEDER asked and was  given permission to address the House  for 1 minute and to revise and extend  her remarks, and  to  include  therein  extraneous material.)  ",1990
203,House,101,-0.225,1091,7,Mrs. SCHROEDER.," Mr. Speaker,  this weekend's revelations of graves  being desecrated in Jewish cemeteries  sickens any civilized person. In 1790  the Hebrew congregation in Newport,  RI, was  so  fearful  of  persecution,  there was an escape door and tunnel  put in the middle of the temple. Our  first President, George Washington,  took up his pen and wrote to this har assed  congregation. His words  and  vision  give  me  goosebumps,  they  convey the very essence of America's  foundation being grounded in religious  tolerance. I include the text of George  Washington's letter:  To  the Hebrew Congregation  RI.  Gentlemen, while I receive with much sat isfaction your address replete with expresAUGUST 17, 1790.  in Newport,  sions of affection and esteem, I  rejoice in  the opportunity of assuring you that I shall  always  retain a grateful  remembrance of  the cordial welcome  I experienced  in my  visit to Newport from all classes of Citizens.  The reflection on the days of difficulty  and danger which are past is rendered the  more sweet from a consciousness that they  are succeeded by days of uncommon pros perity and security. If we have the wisdom  to make the best use of the advantages with  which we are now favored, we cannot fail,  under the just administration of a good gov ernment  to  become  a  great  and happy  people.  The Citizens  of  the United States of  America have a right to applaud themselves  for having given to Mankind examples of an  enlarged and liberal policy, a policy worthy  of imitation. All possess alike liberty of con science and immunities of citizenship. It is  now no more that toleration is spoken of, as  if it was by the indulgence of one class of  people, that another enjoyed the exercise of  their inherent natural rights. For happily  the Government  of  the United  States,  which gives to bigotry no sanction, to perse cution no assistance, requires only that they  who live under its protection should demean  themselves as good citizens, in giving it on  all occasions their effectual support.  It would be inconsistent with the frank ness of my character not to avow that I am  pleased with your favorable opinion of my  administration, and fervent wishes for my  felicity.  May the children of the Stock of Abra ham, who dwell  in this land, continue  to  merit and enjoy the good will of the other  inhabitants, while  every one  shall sit  in  safety under his own vine and fig tree, and  there shall be none to make him afraid.  May the Father of all mercies scatter light  and not darkness in our paths, and make us  all in ouT several vocations useful here, and  in his own due time and way everlastingly  happy.  G. WASHINGTON.  SUPPORT AMERICANS WITH  DISABILITIES ACT  <Mr. MAZZOLI asked and was given  permission to address the House for 1  minute and to revise and extend his  remarks.)  ",1990
204,House,101,-0.359,1091,7,Mrs. BOGGS.," Mr. Speaker, it is with  a great deal of sadness that I note the  departure of Dr. William Narva as the  attending physician of the House of  Representatives of  the Capitol. We  have enjoyed his services for many,  many years, for 20 years as a consult ant to the attending physician, and for  the past 4 years as the attending phy sician of  the Congress. He has  ren dered such good and efficient service  with such a personal attitude of inter est and compassion. We will certainly  miss his services very much.  Dr. Narva  is also  retiring after 35  years of distinguished service  to  the  U.S. Navy, and we salute him for his  service in that regard. The whole city  of Washington will miss Bill N arva  and his remarkable wife Rose Narva.  She has in this city brought back the  Carlton Hotel and the Jefferson Hotel.  She has helped to rejuvenate the kind  of gracious ho{)pitality for which this  city was previously known. We will  miss her  touch on  the Washington  scene as well.  Mr. Speaker, I wish them, of course,  godspeed in their retirement to Cali fornia, where they will be joining their  son David, and I know that they will  have many years of happiness there.  TAX REFORM: CHANGING THE  MIX, NOT RAISING THE ANTE  The SPEAKER pro  tempore <Mrs.  SCHROEDER). Under a previous order of  the House, the gentleman from Iowa  [Mr. LEACH]  is recognized for 5 min utes.  ",1990
205,House,101,0.141,1091,7,Mr. LEACH of Iowa.," Madam Speak er, as  this body understands, deficit  predictions  are  worsening  to  the  extent that Congress and the execu tive branch have little choice but to  enter negotiations to develop a biparti san, bi-institutional approach to stem ming the red ink.  ",1990
206,House,101,-0.07,1104,7,Mr. JACOBS.,"  H.R. 4494: Mr. BLILEY, Mr. HOUGHTON, Mr.  RICHARDSON, Mr. OBEY, Mr. MAVROULES, Mr.  BUNNING, Mr. Goss, Mr.  PASHAYAN, Mr.  COOPER, Mr. PICKETT, Mr. HUBBARD, Mr.  MATSUI, Mr. FORD of Tennessee, Mr. BAKER,  ",1990
207,House,101,0.278,1104,7,Mr. YOUNG of Alaska., and ,1990
208,House,101,0.703,1104,7,Mr. STUMP.,"  H.R. 4520: Mr. MCMILLEN of Maryland,  Mr. BRUCE, Mr. SIKORSKI, Mr. Russo. Mr.  LANCASTER, and Mr. J ONTZ.  H.R. 4590: Mr. TOWNS, Mr. STOKES, Mr.  CROCKETT, Mr. FAUNTROY, Mr. SCHEUER, Mr.  FRANK, Mr. WALGREN, and ",1990
209,House,101,-0.429,1104,7,Mr. DEFAZIO.,"  H.J. Res. 554: Mr. McGRATH, Mr. MACHT LEY, Mr. GUARINI, Mr. BLAZ, Mr. TOWNS, and  ",1990
210,House,101,0.472,1104,7,Mr. PAXON.,  H. Res. 78: ,1990
