,branch,congressID,ideology_score,page,part,speaker,speech,year
305,,112,-0.339,177,2012-03-29,Ms. RICHARDSON.," Mr. Chair, I rise today  in strong support of the Congressional Black  Caucus Alternative Budget  for Fiscal Year  2013. The budget plan outlined by the CBC  takes a direct and balanced approach to restoring America’s promise, achieves fiscal responsibility and sets a priority to invest in our  future.  The CBC Alternative Budget protects Social  Security, Medicare, Medicaid, SNAP, TANF,  Unemployment Insurance and other programs  that are vital  to  the most vulnerable populations, which are in districts throughout this  country.  Although our nation’s economy is showing  positive signs of growth, this Congress must  continue to make critical investments in communities  to accelerate—not stagger—our recovery.  To  that end,  the CBC Alternative Budget  makes smart investments in education, workforce  training, and  transportation and  infrastructure projects. These investments are necessary to ensure that America has a skilled  and educated workforce  that  is prepared  to  tackle the challenges of the 2ist Century and  compete with attempts to take American jobs  overseas.  Specifically, the CBC Budget will:  invest an additional $25 billion above  President’s  budget  in Education  and  Training in FY 2013 alone;  provide an additional $5 billion above  the  President’s Budget  request  for housing programs, foreclosure assistance, and other important programs for community development;  invest an additional $50 billion  in  job creating transportation and infrastructure projects  in FY 2013 alone and provide $155 billion  above  the President’s budget over  the next  decade; and  increase the maximum Pell Grant award by  nearly $1,000 over the President’s Fiscal Year  2013 budget request.  The CBC Budget acknowledges the deficit  and pays  for domestic priorities by enacting  the  Job  tax reform measures to raise nearly $4 trillion  in new revenue over the next decade through  the Buffet Rule to ensure that millionaires and  billionaires pay their fair share in taxes, and  closes  corporate  tax  loopholes  and  preferences  for corporations  that ship American  jobs overseas.  The $4 trillion in revenue raised from millionaires paying their fair share will allow us to  pay for an extension of tax cuts for hard working, middle class Americans—providing them  with more money  to  feed  their  families, pay  their bills, send their kids to school and fill up  their gas tanks.  The budget would open an enormous hole  in our country’s social safety net by  largely  shifting healthcare costs to seniors on Medicare, while at the same time giving millionaires  and billionaires a free pass by giving the rich  an average tax cut of $150,000.  In California alone, 5,252,371 seniors would  be forced onto vouchers when they retire—a  system  that has been shown  to be a sub-  standard version of Medicare.  The GOP budget will force seniors to pay  higher premiums in order to access the same  benefits they would receive under the current  system. For a typical 67 year-old senior, the  Ryan  budget  could  increase  out-of-pocket  health care costs by $5,900.  The GOP budget would decimate our primary assistance to the poor by cutting $3.3  trillion  from needed programs  like Medicaid  and Supplemental Nutrition Assistance Program.  In fact, a report conducted by the Center on  Budget and Policy Priorities found that 62 percent of proposed cuts in the Ryan budget plan  come  from programs  that assist  low-income  individuals. This  is  the Republican vision:  to  balance the budget on the backs of the seniors and the poor.  The Ryan budget once again fails the test of  balance, fairness, and shared responsibility. It  takes a slash and burn approach to the budget, rather than going line by line to carefully  examine where cuts and new sources of revenue should be implemented.  The Ryan budget plan would weaken  job  growth. The Economic Policy  Institute  found  that if we were to follow Chairman RYAN’s proposal, 1.3 million jobs would be lost in 2013  and 2.8 million jobs would be lost in 2014.  Mr. Chair, the CBC Alternative Budget has  a better way. We understand that our current  economic situation calls for a balanced and responsible approach that protects our fragile recovery and invests in our future.  For these reasons, Mr. Chair, I urge my colleagues to join me in voting for the CBC Alternative Budget.  f  IN TRIBUTE TO ROBERT A.  BRINER  HON. ELTON GALLEGLY  OFCALIFORNIA  INTHEHOUSEOFREPRESENTATIVES  Thursday, March 29, 2012  ",2012
306,,112,0.339,184,2012-03-29,Mr. WALDEN.," Mr. Speaker, I rise today to  pay  tribute  to Max McIntosh,  the director of  the VA’s Southern Oregon Rehabilitation Center and Clinics (SORCC)  in White City, Oregon, who will retire tomorrow, March 30, after  39 years of service to the VA.  Since 2003, Max has  run  the SORCC,  transitioning it from a domiciliary into a world  class  rehabilitation center and a system of  clinics  for veterans  in southern Oregon. He  came to the clinic two years earlier as Chief  Operating Officer.  When he arrived, the SORCC served 7,000  outpatients  in  the  region—no  small  feat.  Today, through the good work of Max and his  staff of over 500 employees and another 500  volunteers, the SORCC cares for 450 residential patients and 18,000 outpatients in Southern Oregon. These are men and women who  have worn the nation’s uniform to defend our  freedom and cherished way of life, and they  deserve the highest levels of care. Max made  sure that they received it.  In his years as director of the SORCC, Max  and the facility have adapted to serve our nation’s  heroes—from  those who  served  in  World War II to Iraq and Afghanistan. Vocational rehabilitation and employment services  place veterans with community employers and  partners. They have programs  focused on  post-traumatic stress disorder and suicide prevention, and clinics on chronic pain and diabetes. They  recently  instituted  a  system  of  home-based primary care, caring for veterans  in their homes.  Perhaps the greatest challenge he faced in  his tenure was among the first, when a proposal was floated to close or reduce services  at the SORCC. Max stood arm-in-arm with me  and the rest of the community as a fierce advocate for the facility. Today it stands as a nationally known veteran rehabilitation center, in  no small part because of Max’s leadership.  When I spent Veterans Day with Max and  the  veterans  of  southern Oregon  at  the  SORCC this past November, I noted that ‘‘A  nation is judged by the way it takes care of  the people who protect its freedom.’’ In his 39  years of service to our country, Max has made  us  proud.  I  understand  that  he’s  already  signed up to do volunteer work at the SORCC.  Mr. Speaker, on behalf of a grateful community, state, and nation,  I  thank Max  for his  service to this country’s heroes, and wish him  well as he moves on.  CONGRATULATING  SHANA  CHANDLER AND BRANDON WEST ON  THE BIRTH OF HUDSON SCOTT  WEST  HON ADAM SMITH  OFWASHINGTON  INTHEHOUSEOFREPRESENTATIVES  Thursday, March 29, 2012  ",2012
307,,112,0.744,184,2012-03-29,Mr. HUELSKAMP.," Mr. Speaker, I rise today  to join my colleagues in expressing my frustration with ABC News’ muckraking ‘‘journalism’’  that has forced the closure of a plant employing more than 200 people in my district.  What we have before us is a perfect example of mainstream media completely disconnected from reality. In a quest for accolades  and attention,  reporters,  talking heads, and  morning talk show hosts at ABC have made it  their  intention  to drive Beef Products,  Inc.  (BPI) out of business. And they may have succeeded. Despite developing a process  that  adds approximately $15 of value to each head  of  cattle  processed,  and  providing  safe,  healthy, lean meat for more than 300 billion  meals, BPI is being forced to close the doors  of its plant in Finney County, Kansas.  But while the reporters, producers, and executives at ABC move on to their next ‘‘public  interest’’ story as questions of finely textured  lean beef fade into the background, the same  cannot be said of employees at BPI. It is ironic  that a perfectly good ‘‘public interest’’ story for  them to cover is the loss of hundreds of jobs  for people  in my district and  from  the  three  other BPI plants across the country. But doing  so would bring too much attention to ABC’s  role in causing these people to lose their jobs.  Make no mistake, Mr. Speaker—finely textured lean beef is just that: beef. In terms of  meat content, it is no different from the steak  being served at Charlie Palmer’s, or the hamburger at Five Guys. It’s not scrap, filler, or  substitute. It’s beef.  And it’s safe to eat. While much has been  made of the use of ammonia to treat the meat  once  it  is processed,  it has not been, and  should not be a safety concern. This process  has been approved by the USDA on a whole  host  of  food  products,  including  meat,  cheeses, chocolate, pudding, condiments, and  beverages  to prevent  food-borne diseases.  VerDate Mar 15 2010  02:58 Dec 18, 2012 Jkt 079060 PO 00000 Frm 00019 Fmt 0626 Sfmt 9920 E:\RECORD12\RECFILES\E29MR2.REC E29MR2 h t i w D O R P 1 P 8 X W T 2 K S D n o l a e n b j         ",2012
308,,112,-0.484,191,2012-03-29,Mr. BRADY of Pennsylvania.," Mr. Speaker, I  rise to honor the life of Mrs. Christine Jackson  Washington, who died last week. She was the  wife of the deceased Father Paul Washington,  the long time, much revered rector of the Episcopal Church of the Advocate, and an internationally recognized peace and rights activist.  But, Mrs. Washington was also a community  change agent. She founded the non-profit Advocate Community Development Corporation,  a  neighborhood-based  community  development  corporation  that  provided  affordable  housing and social services to the residents of  North Philadelphia. The bedrock of her family,  Mrs. Washington sang on  the choir,  taught  Sunday school, and helped out at the church’s  food kitchen that fed more for more than 350  people daily.  However, beyond all of these responsibilities  and accomplishments Mrs. Washington is remembered for his kindness, gentleness, and  graciousness. We were all blessed  to have  known her and we cherish her memory.  f  HONORING UTE AND PATRICK  GOGGINS  HON. LYNN C. WOOLSEY  OFCALIFORNIA  INTHEHOUSEOFREPRESENTATIVES  Thursday, March 29, 2012  ",2012
309,,112,0.202,191,2012-03-29,Mr. FITZPATRICK.," Mr. Speaker, I rise today  in honor of Francine Block, who is receiving  the Bucks County Women’s History Month  Award today. Since 1982, the award has been  presented every year to a woman in the county who  ‘‘has made  the biggest difference.’’  Candidates are active volunteers, role models  and social advocates.  For 25 years Francine has worked eagerly  in the fields of education and college admissions. Currently, she is the President of the  American College Admissions Consultants.  Formerly, Francine served as President of the  Pennsylvania Association  for College Admissions Counseling. Previously a high school  English teacher in the United States and the  United Kingdom, Francine has gone on  to  work with college applicants from all over the  world. She has contributed to numerous books  and has been  interviewed by CNN, CNBC,  NBC, the Wall Street Journal and Time Magazine.  Francine Block has also held many other  critical posts in the field of education throughout her lifetime. She is the National Assembly  Delegate to the National Association for College Admission Counseling, and previously  was a member of  the Admissions Advisory  Board of Penn State University. Locally, she  serves on the Board of Directors of the United  Way of Bucks County and the Lower Bucks  County Chamber of Commerce.  I had  the  honor  to serve as Francine’s Solicitor while  she served as Chairman of the Board of the  Lower Bucks County Chamber of Commerce.  Francine Block has devoted her life to promoting higher education and making certain  that parents and students have the best available resources to apply to colleges and universities. She is an inspiration to all of us, and  it is my pleasure to honor her today on the  floor of the U.S. House of Representatives.  f  THE DISABLED MILITARY CHILD  PROTECTION ACT OF 2012  HON. JAMES P. MORAN  OFVIRGINIA  INTHEHOUSEOFREPRESENTATIVES  Thursday, March 29, 2012  ",2012
310,House,112,-0.413,5,2012-04-16,Mr. MEEKS., I yield 1 minute to the  gentleman  from Florida  (Mr. HASTINGS).  HAYWORTH ,2012
311,House,112,0.585,5,2012-04-16,Mr. BURTON of Indiana.," I want to  thank NANand my good friend, GREG  MEEKS, for introducing this bill. GREG  and I recently were in Budapest, and  we were there for a celebration at the  statue of Raoul Wallenberg; and it is  something that I’ll never forget. It was  a good time and a very important time.  What do you say about somebody  like Raoul Wallenberg or Schindler?  These people risked their lives to save  people who were going to be killed,  going to be put in gas chambers, never  to be heard from again. And 6 million  people died because there weren’t more  people  like Raoul Wallenberg  and  Schindler.  So, I just want to say I’ve heard from  my colleagues today the things that I  would like to have said, and they said  it very well; but I just say, in closing,  thank God that there are people who  are willing to risk their lives to help  their  fellow man. There  just aren’t  enough of them. When I look around  the world and see the horrible tragedies that are taking place in Africa and  elsewhere,  it makes you wonder  if  we’re ever going to see people like that  again, but thank God we have somebody like Raoul Wallenberg.  ",2012
312,Senate,112,0.529,47,2012-04-16,Mr. BARRASSO.," Mr. President,  I  have risen many times over the past 3  years to talk about the bad policy  choices of the Obama administration  and the harmful effects of these policies on our economy and on the American people.  In many ways, the President’s decisions have made things worse in our  country. The bill before us today would  impose what is being called the Buffett  tax. It is just one more example of a  policy that will hurt our economy, not  help it. This tax will take money from  the pockets of small businesses that  they would use to create jobs. More  than one-third of all business income  reported on individual returns would be  hit by this tax increase.  Back in September President Obama  said this tax hike on American families  would raise enough money not only to  pay for his increased spending but it  would ‘‘stabilize our debt and deficits  for the next decade.’’ Back then he  said:  ‘‘This  is not politics;  this  is  math.’’  Of course, we now know the Buffett  tax is only about one thing: politics.  The  increased  tax  revenue  would  amount to about $5 billion this year,  which  is about the same amount of  money Washington will borrow over  the next day and a half. The President  would have  to collect his  so-called  Buffett tax for more than 200 years just  to cover the Obama deficit from last  year alone. That is not just my math;  that is the math from the Joint Committee on Taxation.  The Buffett tax will not fix Washington’s debt because Washington doesn’t  have a revenue problem; it has a spending problem. Even one of President  Obama’s top economic advisers finally  admits the Buffett tax will not ‘‘bring  the deficit down and the debt under  control.’’ Based on his record,  it  is  clear the President would not put a  single dollar raised by his new tax toward the debt. He will just spend it.  So the President has now changed his  story once again. Now he says this is  no longer a way to pay down the deficit. Now he says it is just a matter of  fairness.  President Obama has been using the  word ‘‘fair’’ in quite a few of his campaign speeches lately. It is a word of  great appeal to most people. Just like  ‘‘hope’’ and ‘‘change’’—the buzz words  of the 2008 Presidential campaign—people can interpret it to fit their own  meaning. President Obama’s  idea of  fairness doesn’t match up with  the  American people’s idea of fairness.  Senator MCCONNELLearlier made reference to an editorial I wrote in Investors Business Daily. President Obama  thinks it is fair that our children and  grandchildren will be burdened with  debt because of Washington’s reckless  spending, such as borrowing 42 cents of  every $1 it spent so far this year. President Obama thinks it was fair to pile  another  $40,000  of  debt  onto  every  household in the United States over  the last 3 years.  President Obama thinks it is fair to  use college students as props for his  campaign-style rallies without explaining how his bad policies will  leave  them in debt. President Obama thinks  it is fair to force hard-working taxpayers to subsidize a wealthy person’s  purchase of a hybrid  luxury car because it fits into his idea for American  energy.  President Obama thinks it is fair to  hand out hundreds of millions of taxpayer dollars to politically connected  solar energy companies that then go  bankrupt. President Obama thinks it is  fair to tell thousands of workers they  will not have  jobs because he has  blocked  the Keystone XL Pipeline.  Why? To solidify his support with a few  far-left environmentalists.  President Obama thinks  it  is  fair  that more than half of his biggest fundraisers won jobs in his administration.  That is right, more than half, which  has been reported in the Washington  Post. President Obama thinks it is fair  to give important jobs to people who  fail to pay their own taxes, such as his  own Treasury Secretary.  Apparently, President Obama thinks  it is fair that 3 years of the Obama  economy have left us with more people  on food stamps, more people in poverty,  lower home values, higher gas  prices, and higher unemployment.  There are many ways in which the  American  people’s  understanding  of  ‘‘fairness’’ differs from the way President Obama has been using the word.  To the vast majority of Americans,  ‘‘fair’’ means an equal opportunity to  succeed. To President Obama,  ‘‘fair’’  requires nothing less than a total equal  outcome regardless of effort.  To most Americans, fairness allows  for the pursuit of their own dreams. It  also recognizes that no man and no  government can provide a guarantee of  success.  The waves of immigrants who have  come to our shores over generations  did so for freedom and for a chance to  succeed. They did not come to be taken  care of and  to have every decision  made  for  them by  the government.  That is what many of them were leaving behind.  When President Obama pushes  for  equal outcomes instead of equal opportunity, he is trying to pit one American against another. He is telling people it is not fair that someone else has  something they don’t have. That may  be a clever campaign tactic, but it is  not true, and it is bad for our country.  One person getting more does not mean  someone else has to get less. In America, it is possible for all of us to prosper. That is what made America different  from the very beginning—the  prospect that all of us can do better—  not at the expense of our neighbors but  by our own effort.  There is something that threatens to  keep all of us from success. It is the  thing that threatens to keep us all  from passing on to our children the  hope for their own prosperity. It is the  crushing debt, the debt this administration has been forcing onto the backs  of American workers. It is the mountain of bureaucracy that stifles American opportunity.  The old maxim says that a rising tide  lifts all boats. President Obama seems  to think it is better to put holes in all  of the boats as long as that means they  are all equal in the end. That is what  he seemed to be saying in 2008 during  one of the Democratic Presidential debates.  Moderator  Charles  Gibson  asked  then-Senator Obama why he  favored  raising taxes on capital gains. Our history clearly showed that when the tax  rate has gone up, government revenues  actually went down. Senator Obama  said he wanted to raise taxes anyway  ‘‘for purposes of fairness.’’  In the name of achieving what he  considers to be fair, the President was  willing to hurt millions of hard-working families who already paid taxes on  their  income—families who  invested  some of that income and now would  have to pay higher taxes again when  they decide to sell some of those investments. The President didn’t even  care if Washington ended up with less  money as a result of his efforts to punish success. The only important thing  was that he thought it would be more  fair.  That is a pretty extreme definition of  what ‘‘fair’’ means, and it is not one  the American people share. In any fair  society, doing better should be a consequence of one’s efforts. To President  Obama, fairness means getting something for nothing.  VerDate Mar 15 2010  05:01 Apr 17, 2012 Jkt 019060 PO 00000 Frm 00011 Fmt 4624 Sfmt 0634 E:\CR\FM\A16AP6.004 S16APPT1 E T A N E S h t i w D O R P 1 N V T P S 6 K S D n o s e m a j t         ",2012
313,,112,0.367,96,2012-04-16,Mr. AUSTRIA.," Mr. Speaker, I rise today in  honor of four Great Oaks Vocational School  students:  Iayie Viassy, Wade Aills, Brandon  North, and Austin Salisbury. I am proud to recognize these four young men for their brave  heroics in helping 53 Miami Trace elementary  school  children off an overturned bus on  March 12, 2012.  At 4:16 p.m. on March 12, a school bus  transporting children home from school veered  off the road and rolled onto its right side into  a ditch. With  the passenger door pinned  against the ground, Wade Aills made the decision  to kick open  the emergency rear door.  The four boys then proceeded to aid the elementary children in exiting the bus and keeping everyone calm until emergency personnel  could arrive. When EMS units arrived on the  scene, all of the children had been evacuated  safely, with only a few children that suffered  minor injuries.  Recently,  these young men were honored  and  recognized  by  the  Fayette  County  Sherriff’s Office and the Miami Trace elementary school for their actions.  Thus, today I ask my colleagues to join me  and the constituents of Ohio ’s Seventh Congressional District in recognizing four true heroes: Iayie Viassy, Wade Aills, Brandon North,  and Austin Salisbury.  HON. THEODORE E. DEUTCH  OFFLORIDA  INTHEHOUSEOFREPRESENTATIVES  Monday, April 16, 2012  ",2012
314,,112,-0.403,96,2012-04-16,Mr. DEUTCH.," Mr. Speaker, I rise today in  celebration of Mike Jones’ years of dedicated  service  to  the Economic Council of Palm  Beach County. Mike  leaves behind a strong  f  LARRY DECKER TRIBUTE  HON. SCOTT R. TIPTON  OFCOLORADO  INTHEHOUSEOFREPRESENTATIVES  Monday, April 16, 2012  ",2012
315,,112,0.455,96,2012-04-16,Mr. TIPTON.," Mr. Speaker,  I rise  today  honor of Larry Decker of Pueblo, Colorado.  in  After earning his education and serving in  the U.S. Navy Mr. Decker moved to Pueblo.  Always a strong leader in the community, Mr.  Decker was  frequently  involved  in Veterans  activities and organizations. He was a proud  member of American Legion Post 207 and  served a leadership role among his peers. As  the senior vice commander of Post 207, Mr.  Decker was highly respected not only in the  American Legion but also in the Pueblo community.  As enthusiastic as he was with helping others in the community, his real passion was his  family. He leaves behind his wife Joan who  has been by his side since 1964. Together  they raised a loving family that includes two  daughters and  three grandchildren. On April  5th, the city of Pueblo and the State of Colorado lost a great man.  Mr. Speaker,  it  is an honor  to  recognize  Larry Decker. I rise today to thank him for his  work on behalf of the citizens of Pueblo, and  for his service to our nation. May he rest in  peace.  f  CONGRATULATING  THE  UNIVERSITY OF KENTUCKY WILDCATS  MEN’S BASKETBALL TEAM FOR  WINNING THE  2012 NCAA DIVISION I MEN’S CHAMPIONSHIP  HON. HAROLD ROGERS  OFKENTUCKY  INTHEHOUSEOFREPRESENTATIVES  Monday, April 16, 2012  ",2012
