,branch,congressID,ideology_score,page,part,speaker,speech,year
311,Senate,100,-0.303,545,13,Mr. DASCHLE.," Mr. President, I rise  in support of S. 490,  the Omnibus  Trade Act of 1987. This legislation rep resents  the culmination of  literally  hundreds of hours of work on the part  of the Committee on Finance. It repre sents the best possible consensus legis lation between two  legitimate points  of view on trade law: those who believe  in free trade and those who believe  our trade laws should be stricter, to  force our Government to retaliate in  unfair trading situations.  Because of the manner in which he  shepharded  this complex  legislation  through  committee,  our  chairman,  Senator LLOYD BENTSEN, has earned  my utmost respect. He managed the  committee's consideration of this legis lation both with fairness and resolve.  Like many of us  in  this Chamber,  Chairman BENTSEN  feels  the time  is  long overdue for substantive, reasona ble changes in our trade law.  There are those in this country who  look at our existing trade law and say,  ""that is how it should be."" The Presi dent should have total discretion  to  determine when, how,  and perhaps  most  importantly,  if  trade sanctions  will be invoked. Those who believe in  so-called free trade maintain that few  restrictions should be placed on Presi dential authority.  Except during the past 20 months,  that clearly was  the position of the  Reagan administration. It has been  said  that  trade was  the administra tion's policy outcast. It was a policy  area which rarely received attention  and  frequently  seemed  incoherent.  Rarely was  trade mentioned  and  seldom did we see Presidential author ity used to address the trade imbal ance  and  barrier  situations  facing  American exports.  Suddenly, some 20 months ago,  it  was as if the Reagan administration  became born again on trade. the tough  trade rhetoric began to flow. We heard  the President and top administration  policymakers begin to take our trade  situation seriously. Like a  tidal wave,  unfair trade practice complaints came  from the White House. All of these ac tions carried the same message: ""We  can get tough when we want to."" Some  of the cynics looked at this new found  trade religion and decided it had more  to do with eminent congressional pas sage of tough trade legislation than  the realization that the United States  was taking a beating in the interna tional trading arena.  Through the pa.st 6 years of  the  Reagan administration, we have seen  both sides of this trade debate demon strated. In the initial years, the ad.min8  istration took the hands off approach  to trade and our trade laws. In the last  year and a half, by nearly all accounts,  this administration has more aggres sively pursued our  trading  interests  and has exercised much of the Presi dential discretionary authority we will  hear discussed during this debate.  Despite the administration realizing  its new-found trade religion, it should  be in the interest of the Senate to ex amine our trade and financial position  has deteriorated over the past 6 years.  The U.S. trade deficit increased nearly  times, from $20 billion in 1980  to  $160 billion in 1986. During this time  period, exports have  remained  rela tively constant.  Imports, however, have increased by  nearly 40 percent in value. This oc cured during a timeframe when world  growth was at extremely low levels.  Since 1985, the United States has re ceived the dubious distinction of being  a debtor nation for the first time in  history. In 1986, U.S. foreign debt hit  a record $264 billion. This means that  U.S. assets abroad were $264 billion  less  than foreign  investment in U.S.  assets, such as corporate stocks and  bonds and U.S. bonds. United States  foreign debt is  twice the size of the  largest  international  Third World  debtor, Brazil.  With these disasterous statistics in  mind we must consider this trade legis lation. Administration  policymakers  tell us that this tough trade legisla tion, as currently written, stands a 5050 chance of being vetoed. We have  just received 31 pages of administra tion objections. This is the same ad ministration that has taken the posi tion that ""the trade deficit should not  cause undue alarm."" I have the utmost  respect for Ambassador Yeutter, the  President's Special Trade Representa tive and the author of this statement.  However, regardless of whatever silver  lining I  look for in our record trade  deficits of the past 6 years, I come up  empty handed.  I could not disagree  more with my good friend, Ambassa dor Yeutter. There is no silver lining  whatsoever in the trade deficit.  I am alarmed when I hear adminis tration policymakers make such state ments. I am alarmed at the tidal wave  of depressing statistics. I am alarmed  when I read list upon list of foreign  trade barriers which seem to go un checked.  I  am alarmed  that absent  this legislation we are without the as surance we need that the next Presi dent will view trade seriously and con sistently and not in the lackadaisical  manner we have seen during the past  5 years.  That is why we are here today. The  legislation before the Senate seeks to  reach a middle ground between protec tionist  trade  law and  totally discre tionary and potentially useless trade  sanctions. It will establish trade law  which ensures that the next adminsitration takes trade as seriously on in auguration day as it does on its third,  fourth, or fifth year.  This  proposal makes  substantive  changes in section 301, the trade law  section used to fight unfair trade bar riers and practices. Even though elimi nation of these trade barriers does not  represent a total solution to the trade  deficit, they are a serious problem for  American trade. Let me share with my  colleagues just a  few of the barriers  our agricultural products encounter in  the international arena:  The European Community inspects  400 United States meat packing plants  and prohibits any of these plants from  shipping meat and pork products to  Europe. The claim: They do not meet  the European inspection requirements.  The result: One South Dakota packing  plant was cited for having a hand op erated drinking fountain and another  chastised for not having a ""fully paved  parking  lot.""  Both  lose  valuable  export markets when they are prohib ited from exporting to the EEC.  American rice farmers are effective ly barred from shipping United States  rice to Japan. In 1985, Japan allowed  only 20,000 tons of rice to be imported.  This represents  less than two-tenths  of 1 percent of its domestic consump tion. These Japanese restrictions are  estimated to cost United States rice  farmers as much as $1.7 billion per  year.  Massive duties levied on agricultural  commodities entering Japan have re sulted in a price differential which has  forced  our  products  out  of  that  market. A New York prime steak cost ing $5.29 per pound  in Washington  costs $30 per pound in Tokyo after all  governmental duties are assessed.  This bill requires the President to  use all available trade powers against  these unfair foreign  trade practices.  Except in cases where a greater na tional interest overrides, it mandates  the President  take action  to break  down unfair foreign trade barriers.  The  administration must  identify  unfair trade barriers and initiate ac tions which  seek  to  eliminate  all  unfair trade barriers. In some cases,  the President  is  required  to  initiate  trade remedies rather than waiting for  a request from the effected industry.  Strict time limits are placed on Presi dential action.  This legislation also makes substan tive changes in the treatment of exces sive but fairly-traded imports. In cases  where fairly traded imports are flood ing the U.S. market, causing harm to a  domestic industry, the President is re quired to provide import relief in cer tain  circumstances. The  action  re quired in this change is  intended to  position the industry to compete with  imports on an even basis after the  import relief is terminated.  9Hl59 0-89-18 (Pt. 13)  ",1987
312,,100,-0.202,636,13,Mr. HATCHER.," Mr. Speaker,  I have  intro duced H.R. 2569, the Pesticide Price Competi tion Act, which will establish generic pesticide  registration, stimulate increased competition in  the pesticide industry, and tower the price of  pesticides  for  farmers,  ranchers, users, and  consumers across  this country. This  legisla tion is identical to S. 7 46, a companion bill in troduced  in  the Senate by Senators NANCY  KASSEBAUM and AL GORE.  The purpose of this legislation is twofold: to  lower the  farmer's cost of production by re ducing the cost of pesticides, and to reduce  the cost of nonagricultural products that con sumers buy. This measure could save farmers  from $400 million to $500 million per year for  at least the next 5 years on agricultural pesti cides alone. Consumers could save additional  millions on nonagricultural products.  As we look across our land, we discover an  agricultural and rural economy suffering from  problems-increasing  costs  of  production,  growing debts, obtaining adequate credit, de clining prices  for crops-and we  need  to  move forward to address these concerns. One  way  to help  the  farmer meet  the  increasing  costs of production is to amend the pesticide  legislation,  the Federal  Insecticide, Fungicide  and Rodenticide Act [FIFRA]. This would help  the farmer immeasurably, without any cost to  the Government.  According to recent figures in the Economic  Indicators of the Farm Sector, Cost of Produc tion, 1985, prepared by the U.S. Department  of Agriculture [USDA], pesticides average be tween 1 O and 35 percent of  farmers' cash  variable expenses-seed, fertilizer, chemicals,  hired labor, and so forth. Farmers across this  country apply agricultural pesticides  to  their  crops, and these costs clearly comprise a sig nificant percentage of their annual expenses.  In the southeastern United States, farmers  face a tremendous challenge. Cotton farmers  across the Nation spend an average of $45  per acre for chemicals, while these farmers in  the Southeast use $96 of pesticides per acre.  Peanut  farmers average $80 per acre  for  chemicals, but Southeastern peanut  farmers  average close to $95 per acre, and Virginia  and North Carolina farmers average $89 per  acre. Like  the Hawaiian sugarcane growers  and Texan sugar beet producers, Southeast ern  farmers pay a disproportionate share of  their cost of production on agricultural chemi cals.  However, we can  lower the price of pesti cides,  thereby reducing  the  farmer's cost of  production, if we encourage the development  of generic pesticides. In fact, it may be possi ble to reduce the price of pesticides by 1 O to  20 percent or more. One way to reduce these  prices is to eliminate the data compensation  provision of FIFRA. When generic pesticide  producers enter the market following the expi ration of a patent, they generally capture only  1 O to 20 percent of the existing market. Yet,  ",1987
313,,100,-0.023,649,13,Mr. CONTE.," Mr. Speaker,  I  recently  re ceived the results of the annual questionnaire  that is mailed to the people of the First District  of Massachusetts, and thought my colleages  might want to review the information returned  to my office.  Nearly 10,000 people  responded  to  the  questionnaire, providing  the  results  that are  listed below. As you can see, the majority of  the people in the First District believe the way  to reduce  the national deficit is  through de creased military spending and not  reduced  Government and  social  services. An over whelming majority of those responding to the  questionnaire, 86.9 percent, also said  they  support a mutual, simultaneous and verifiable  ",1987
314,,100,-0.49,662,13,Mr. CLAY.," Mr. Speaker,  I am happy  to  share the news about Christ Pilgrim Rest Mis sionary Baptist Church's Silver Anniversary  and Homecoming celebration.  Christ  Pilgrim  Rest  Missionary  Baptist  Church of St. Louis has grown from 30 mem bers to over 1,300 in 25 years. Sunday, July 5,  will mark another milestone for the members  of Pilgrim Rest Missionary Baptist Church  when they move into their new quarters locat ed at 1341 North Kingshighway. The congre gation will be led by their pastor, the Rever end Earl R. Williams, in a 250-car motorcade  starting at 10:30 a.m. from their old location,  Glasgow and Gamble.  June 25, 1987  The church was organized on May 12, 1918  and one of their early places of worship was  815 North Beaumont. The first congregation  was composed of 30 members.  In 1936,  the church called  the Reverend  E.R. Williams to the pastorate and the mem bership has continuously grown to its present  enrollment of over 1,300.  In  1943, Pilgrim Rest Missionary Baptist  Church moved  to 2900 Gamble and  later  added an educational building  to accommo date their many young people. Now after 19  years  they are  taking another giant step  to  keep their membership and many friends com fortable. The new properties at 1341  to 1359  were purchased for worship and educational  purposes. The new church and educational  buildings are completely air-conditioned and  equipped with modern heating facilities. Two  of  the buildings will be used  for residential  quarters.  I congratulate the members of the Christ Pil grim Rest Missionary Baptist Church on  this  very special occasion and I hope their new fa cilities will provide many years of happy serv ice.  INTRODUCING LEGISLATION TO  GRANT A FEDERAI., CHARTER  FOR  THE AMERICAN  PHILA TELIC SOCIETY  HON. SID MORRISON  OF WASHINGTON  IN THE HOUSE OF REPRESENTATIVES  Thursday, June 25, 1987  ",1987
315,,100,0.153,662,13,Mr. MORRISON of Washington.," Mr. Speak er, today I am introducing, along with nine of  my distinguished colleagues.  legislation  that  would grant a Federal charter to the American  Philatelic Society.  The American Philatelic Society  is a non profit corporation headquartered in State Col lege, PA.  It  is  the  largest organization of  stamp collectors in  the United States, with a  current membership of over 55,000 members.  Most importantly, the society is celebrating its  1 OOth anniversary as a national organization.  This has been  the result of the  long hours  spent by many devoted members dedicated to  making  the American Philatelic Society  the  prestigious organization we know today.  I strongly believe that recognizing the Amer ican Philatelic Society by granting it a Federal  charter would be most appropriate in this year  that we are reflecting on America's great his tory founded in our Constitution. Stamps have  played a role all along by opening a window  on America's natural landscape, her great his torical figures, and on the accomplishments of  her citizens in science, commerce, social serv ice, and  the arts. These efforts by our Na tion's stamp collectors have helped the United  States relive its rapidly changing and eventful  history.  I am pleased  to sponsor  this  legislation  which will help us give the appropriate recog nition  to  the many stamp collectors  in our  communities for their accomplishments. I urge  my colleagues  to  join us  in support of  this  measure by adding  their names as cospon sors.  ",1987
316,House,100,0.168,688,13,Mr. MILLER of Washington.," Mr. Chairman, I  rise  to urge  this body  to vote against  this  amendment. The Dornan amendment to the  District of Columbia appropriations bill would  prevent the District from using  locally raised  funds  to provide abortions  to women who  reside in the District of Columbia without ex ception even in cases of rape or life endan germent.  This amendment would deny the District of  Columbia  that which every other citizen  in  America is guaranteed: The right to determine  their local government and its policies.  Congress must uphold the principle of self  determination for the residents of the District  of Columbia. The Supreme Court recently de fined those areas of government that are re served  for State and  local decisionmaking:  Police and  fire protection, sanitation, parks  and  recreation, and public health. By voting  for this amendment. we are again denying the  people of the District of Columbia their consti tutional right to self-determination.  The District is not in violation of the Hyde  amendment which  prohibits Federal  funds  from being used to perform abortions. In fact,  there is a clause in H.R. 2713 that prohibits  Federal funds from being used for such pur poses. That is not the issue here. The issue is  self determination and equal treatment. I urge  you to vote against this amendment.  ",1987
317,House,100,0.16,688,13,Mr. SMITH of New Jersey.," Mr.  Chairman, I rise in strong support of  the Doman amendment and commend  my colleague from Calif omia for his  concern and compassion for children  and  their mothers  in offering  this  today.  A  similar amendment was offered  last year and the year before, both  were  adopted  but  regrettably  the  amendment didn't make its way into  law. With the strong backing of the  President this year I hope we will be  more fortunate this time around.  The  issue before  this body  today,  Mr. Chairman, is simply whether or  not abortion on demand will be payed  for with public funds.  Members should know and should be  fully aware that the current language  contained in H.R. 2713 may look good  to some on the surface but has been  totally ineffective and inadequate and  has not stopped public funding for a  single abortion. Not even one!  The so-called antiabortion language  in the bill is so defective that it has  permitted  taxpayer  subsidized  abor tion on demand in the District of Co lumbia. Even D.C. government offi cials admit this point. In an article in  the Philadelphia Inquirer, August 1,  1985, Elizabeth Reveal, the District of  Columbia's budget director at the time  ""confirmed that the District's govern ment has a policy of funding abortion  on demand and does not attempt to  determine  the circumstances of  the  pregnancy.    The Doman  amendment  reforms  that policy Mr. Chairman and brings  the D.C. appropriations bill  in con formance with Federal policy.  I would point out to members of the  committee that in 1985 according to a  D.C. government report, 10,357 abor tions on demand were payed for in the  District  of  Columbia with  public  funds-10,357 children lost their lives  in that year alone and Congress per mitted the taxpayer to foot the bill.  Mr. Chairman. let no one here today  seek  to diminish or gloss over  the  gruesome reality of abortion. Rather  let us allow ourselves to be sensitive to  the excessive and wanton loss of life of  children in the District.  Mr. Chairman.  abortion methods  and their impact on children are un nerving  to contemplate and  include  bodily dismemberment. which  is  the  case in D&C and suction abortions in jection of poisonous  chemicals,  the  crushing of the baby's skull and body,  as is the case in D&E abortions and  ",1987
318,Senate,100,0.239,818,13,Mr. EVANS.," Mr. President, I cared  not for General Noriega. I believe that  I  feel as much  repugnance as any  Member of the Senate for his activi ties while  leading  the armed forces  and, by doing so, the Government of  Panama.  Mr. President, it seems to me that  every charge against him which has  been made or will be made  in  the  Senate is likely to have considerable  merit. But he is not necessarily alone.  No one person, without some support,  can remain in power.  We may indulge ourselves with some  satisfaction in poking him in the eye,  consistently and repetitively, but  to  what good  if the ultimate end is  to  remove him from power and replace  him with a clone?  It is time to do what we can, careful ly. thinking about the wording and the  message we send; for what purpose is  there in an amendment or in a resolu tion like this before the Senate in the  first place? What are we  really at tempting to do? Not just to spend a  Friday afternoon enjoying beating up  on a  foreign dictator. Certainly not  spending 2 or 3 hours during  this  afternoon to craft a resolution which  will be placed in the archives.  There is only one reason for even  considering such a resolution, and that  ",1987
319,,100,-0.322,909,13,Mr. KLECZKA.," Mr. Speaker, as we cele brate the bicentennial of our Nation's Consti tution, it is fitting that we pay special attention  to the meaning this important document holds  for our children, our future.  In this spirit,  I am proud to present to my  colleagues an essay written by one of my out",1987
320,,100,-0.304,935,13,Mr. FEIGHAN.," Mr. Speaker, the more things  seem  to change  in South Korea,  the more  they stay the same.  Earlier  this week,  President Chun  had  agreed to make three important concessions  to the demonstrators in his country calling for  democracy.  He would meet  opposition  leader,  Kim  Young Sam, for the first time ever. He would  release Kim Dae-Jung  from his 53d house  arrest in  the  last 2 years, and he would re lease the hundreds of other protesters impris oned since June 10.  As the clouds of tear gas cleared away from  downtown Seoul, it seemed as if encouraging  signs were  starting  to appear  through  the  haze.  But  today  it  is clear  that President Chun  does not  intend  to move toward democracy  after all.  After only 24 hours of freedom, Kim Dae Jung is under house arrest once more. Two  days after President Chun's meeting with Kim  Young-Sam,  Kim  Young-Sam  himself was  forced  into a police car and placed under  house arrest. And  rather  than  releasing, as  promised,  the  hundreds  of  demonstrators  being held since June 10,  this morning  the  Chun  regime has placed over a  thousand  more people into its jails.  Two days ago, President Chun said that the  future security of South Korea is in a precari ous  situation. President Chun  understands  that much. But President Chun does not seem  to understand  that South Korea will not be  secure  if  its people are not  free. President  Chun does not seem  to understand that de mocracy  is  the best guarantee of security.  President Chun does not seem to understand  how deeply his people want democracy.  Mr. Speaker,  it  is  critical  that President  Chun  allow Democracy  to  grow  in South  Korea.  It is critical that President Chun stop  moving in the opposite direction toward mar tial law.  It is time for some real change after  all in South Korea.  TRIBUTE TO WILLIAM HELLMAN  HON. BENJAMIN L. CARDIN  OF MARYLAND  IN THE HOUSE OF REPRESENTATIVES  Friday, June 26, 1987  ",1987
321,,100,-0.328,935,13,Mr. CARDIN.," Mr. Speaker,  I would  like to  recognize an individual who has been a truly  outstanding public servant for Maryland who  now stands  ready  to  leave  for  the private  sector.  Maryland Transportation Secretary William  Hellman  first distinguished himself during his  years of dedicated service with Mayor William  Donald Schaefer and  the city of Baltimore  from 1979-83.  In 1984, Bill  joined the State  Government as Secretary of Transportation. A  few weeks ago, Bill announced that he would  EXTENSIONS OF REMARKS  leave public life to return to his former job in  the private sector.  Bill Hellman's insight, leadership, and politi cal savvy,  time and again, came through for  the State. He set a tone and charted a course  for  the State's Transportation Department  that, hopefully, will be a legacy for others to  follow. His wisdom and expertise will be sorely  missed by  the State but  I'm sure  they will  serve him well in his new position.  Maryland's loss is definitely the private sec tor's gain.  I would  like to thank Bill Hellman  for his years of dedicated public service, and  wish him well in his new life.  PERSONAL EXPLANATION  HON. DAVID E. BONIOR  OF MICHIGAN  IN THE HOUSE OF REPRESENTATIVES  Friday, June 26, 1987  ",1987
322,,100,-0.547,935,13,Mr. BONIOR of Michigan.," Mr. Speaker,  was absent from House proceedings on June  24 and 25, 1987, because of recurring back  problems. My physician has prescribed bed rest to relieve resulting pain and discomfort.  Had  I been present for the  following rollcall  votes, I would have voted:  ""No"" on rollcall vote 210.  ""No"" on rollcall vote 211.  ""Yes"" on rollcall vote 212.  ""No"" on rollcall vote 214.  ""No"" on rollcall vote 215.  ""No"" on rollcall vote 216.  ""No"" on rollcall vote 217.  ""Yes"" on rollcall vote 218.  THE LIABILITY INSURANCE  CRISIS: TIME TO ACT  HON. SHERWOOD L. BOEHLERT  OF NEW YORK  IN THE HOUSE OF REPRESENTATIVES  Friday, June 26, 1987  ",1987
