,branch,congressID,ideology_score,page,part,speaker,speech,year
117,,97,-0.444,1032,3,Mr. STUDDS.," Mr. Speaker, our very  distinguished  colleague, Mr. WIRTH,  has teamed up with his brother, Prof.  John Wirth, director of Stanford Uni versity's Center of Latin American  Studies, to produce a most insightful  analysis of U.S. policy toward El Sal vador. While the authors concur with  the administration's position that our  Nation does indeed have important in terests  in  the region,  they conclude  that the current policy is unlikely to  serve  these  interests.  Instead,  they  suggest that a negotiated settlement,  implemented with the cooperation of  Venezuela and Mexico, would be more  effective.  I would like to insert the Wirths' ar ticle, as printed in the Denver Post,  into the RECORD now for the benefit of  all of my colleagues:  CFrom the Denver Post, Feb. 26, 19821  AMERICA SHOULD PuRSUE EL SALVADOR  SETTLEMENT  <Tim Wirth is the congressman from Colo rado's 2nd District. His brother, Prof. John  D. Wirth, is director of the Center of Latin  American Studies at Stanford University.)  The United States should seek a negotiat ed settlement to the civil war in El Salvador,  which has claimed an estimated 20,000 lives  in the past two years.  Our current policy as defined most recent ly by Secretary of State Alexander Haig is  EXTENSIONS OF REMARKS  counterproductive. Increased economic and  military aid to maintain the Duarte junta is  likely to prolong the conflict, increase the  probability of massive human rights viola tions, and undercut moderate elements on  both sides of this complex, protracted and  tragic conflict.  The United States does have longstanding  and  legitimate  strategic  interests  in  the  region. But these can be served best by a  forward policy for the Caribbean Basin as a  whole, rather than by reacting piecemeal as  we do to epic changes sweeping through a  region which until recently was comfortably  under our influence and control.  Foreign aid legislation passed by Congress  last year took a step toward promoting a ne gotiated settlement by stipulating that fur ther military aid could only be sent to El  Salvador if demonstrated progress was made  on human rights and political reform. The  administration has declared  the situation  improved and is sending $55 million in emer gency military aid. But many in Congress  disagree, and a resolution introduced Feb. 2  <co-sponsored by Tim Wirth> would prohibit  military aid until Congress determines that  conditions established by  law have been  met.  Yet there are several paths to a more just  and economically viable social order. The  future need not be lit in neon flashing from  Havana. Thus, the United States must learn  to live with a variety of regimes, while de veloping an overall vision for a strategically  important world region that can no longer  be ignored.  El Salvador  is but one of many crises,  both real and potential. But it is a test of  statecraft. The task is not as the administra tion contends, to confront revolution which  it claims is formented from the outside but,  essentially, to channel the forces of change  toward political and economic solutions that  promote  economic  growth  and  human  rights.  To this end, the United States must end  its confrontation with Nicaragua, a  left leaning regime through which arms pass to  the Salvadoran  insurgents. Learning  to  work with Nicaragua is linked to promoting  a lasting settlement in El Salvador. In turn,  this links to placing restraints on Guatema la-a terrible violator of human rights while continuing to promote a more open,  less-aggressive regime in Honduras, to sup port democratic Costa Rica, and to maintain  close relations with strategically important  Panama. The parts must then be set in a co herent vision of the whole.  A settlement negotiated now, before more  violence and polarization occur, would be a  calculated risk. There can be no ironclad as surance that the loose coalition of centrist,  center-left and radical left elements which  currently comprise  the opposition Demo cratic Revolutionary Front <known as FDR>  would be able or willing to build a new polit ical system based on pluralism and demo cratic liberties.  Nor can we expect extreme right forces in  the junta, including the paramilitary death  squads, to acquiesce necessarily in the kind  of settlement that would be acceptable to  business and middle-class elements backing  Duarte.  It is certain, however, that more fighting  will further polarize, embitter and erode the  coalitions on both sides of this insurrection.  El Salvador will then ""fall,"" to use Haig's  term, by force of arms. Is there still time to  encourage a solution more compatible with  long-range U.S. interests?  A settlement, to be lasting and effective,  must be embedded in a larger program to  March 9, 1982  make the Caribbean Basin viable, both eco nomically and politically. Gone is the nearly  half  century of  regional  stability under  rightist dictators who  freed Americans  to  fight the Nazis and later the Cold War else where  than  in our back yard. Change  is  sweeping  through the region-however in convenient to us.  Rippling  outward,  a  coherent  forward  policy would be coordinated with oil-rich  Mexico and Venezuela, the emerging middle  powers of the Caribbean Basin.  The Japanese, who enjoy an enormously  one-sided trade advantage with the region,  should be asked to join a Caribbean Basin  Development Plan.  The Europeans should be asked as well to  support a program of  targeted  loans on  long-term, concessionary rates of interest to  offset the devastating impact of U.S. high  interest rates and the lack of capital in the  Basin.  Current policy toward El Salvador will not  work for long. Furthermore, the logical out come of confrontation is to treat the Carib bean Basin as our equivalent to the Soviet  Union's Eastern Europe. But the Soviets are  showing that imperial solutions for Poland,  the other captive satellites and Afghanistan  work poorly. if at all.  Needed is a new American policy toward  El Salvador in particular and  toward  the  Caribbean Basin  in general, a policy.  to  defend and advance legitimate vital  inter ests in ways that are compatible with Amer ican traditions and aspiration, while accom modating the equally legitimate forces for  change.e  H.R 5755 HOLDING THE LINE ON  ELECTRIC RATF.S  HON. TOM HARKIN  OF IOWA  IN THE HOUSE OF REPRESENTATIVES  Tuesday, March 9, 1982  to  e ",1982
118,,97,-0.351,1032,3,Mr. HARKIN.," Mr. Speaker, I am in troducing today, along with 26 of my  colleagues, H.R. 5755, a bill to limit  the authority of the Federal Energy  Regulatory Commission CFERC>  allow electric utilities to prebill their  customers for the financial costs  in curred in constructing electric plants  until those facilities provide benefits  to consumers.  Electric utility regulation ls complex  and, until now, has received relatively,  little public attention. However, bil lions of dollars are involved and the  pocketbooks of nearly every American  household are affected by these regu latory  decisions. During  this  past  winter  of  the  ""Siberian Express,""  there is no need to recount the hard ships  imposed  on  families  facing  higher and higher utility bills. We  must be vigilant in protecting consum ers from ill-advised regulatory reforms  that end up costing consumers addi tional billions of dollars.  One such reform ls charging custom ers for construction work ln progress CWIP. CWIP is one means by which  utilities can charge  their ratepayers  for the costs of building new plants, as  ",1982
119,,97,-0.174,1045,3,Mr. YATRON.," Mr. Speaker, I  rise  today  to recognize and applaud  the  commitment to quality and excellence  in aviation made by the Reading Aero  Club, which celebrates its 50th anni versary on March 13, 1982. The Berks  County area is well served by this out standing organization.  It is my understanding  that  this  club, which has been in continuous op eration since March 1932, is the oldest  flying club in the Nation. It is a non profit corporation in which all mem bers hold equal shares and are eligible  to participate in the running of the  club. The basic purpose of the club  has remained the same for the last 50  years:  CTlo encourage aviation in general, to ac quire, preserve and disseminate valuable in formation and knowledge  through books,  lectures and pamphlets on the subject of  aviation; to acquire, own and maintain air craft, hangers,  club house and personal  property for the use of club members, and  EXTENSIONS OF REMARKS  to promote the safe use thereof in the inter ests of the protection of public and private  property.  Aviation was  first  established  in  Berks County, Pa., with the building  of Whander Field, our first official air port, just south of Leesport in October  of 1927.  It was at  this field  that a  group of aviators  joined together to  jointly own an aircraft. After  three  years  o_f  informal  operation,  the  group, mcorporated,  and  the  first  meeting of the Reading Aero Club was  held. In 1935, the group left Whander  Field, which had become too small for  their use, and established themselves  at Madeira Field, opposite the Read ing Fairgrounds. When this field could  no  longer be used because of  the  growth of the club, a strip of land was  selected comprising 60 acres about a  mile north of the present Reading Mu nicipal Airport.  In September 1937,  the members began construction of  the airstrip and hangers. The official  name of this field was Berks Airport.  One of the members of the club, Earl  Savage,  is credited with the first air  mail flight out of Reading in October  1937.  By October 1939, the Reading Mu nicipal Airport was a reality. In 1943  an all-girls flying club based at Madei~  ra Field, called the Flying Ten Club  asked to join and was accepted int~  the Aero Club. By 1946, the club had  100 members ranging in age from 16 to  60 years old. Berks Airport continued  to grow, and seven airplanes belonging  to the club were housed in two hang ers reserved for their use. In 1950, the  club acquired its first four-place plane  a Stinson Station Wagon. Throughout  the 1950's and 1960's the club main tained and  improved  its quarters at  Berks Airport. In 1965, the club began  to investigate the advantages of leas ing a space at the Reading Municipal  Airport. A suitable building was found  where  the club  today keeps  its air planes.  The outstanding accomplishments of  all the members of the Reading Aero  Club through the last 50 years are too  numerous to mention. A special trib ute, however, should be given to Mr.  Grant Blimline, president of the Read ing Aero Club from 1955 to 1957 and  presently the chairman of their board  of directors. It has been through his  tireless and continuous efforts  that  the club has been  able  to  survive  through difficult times. Mr. Blimline  became a member of the club shortly  after its formation and has served the  members faithfully ever since.  The members of the Reading Aero  Club can be proud of their excellent  contribution to the history of aviation  in Berks County and of their consist ent dedication to benefiting the avia tion community  in general and par ticularly at  the Reading Municipal  Airport. I know my colleagues will join  me in congratulating the members of  3739  t~e Read~g Aero Club on the occa sion of their golden jubilee anniversa ry and will wish  them many more  years of continued success.e  SOCIAL SECURITY PANELS  HON. LES ASPIN  OF WISCONSIN  IN THE HOUSE OF REPRESENTATIVES  Tuesday, March 9, 1982  in th~  ",1982
120,,97,-0.32,1045,3,Mr. ASPIN.," Mr. Speaker, in Decem ~er of 1977, the Congress created an  mdependent, bipartisan, nine-member  National Commission on Social Securi t~ .. The panel was made up of private  c1t~ns wh? were to conduct a 2-year  review and mvestigation of all areas of  social security and related progyoams  and then develop a report on the kind  of system that would best serve the  United States in the future.  A year ago this month, that Com mission  issued a  report  totaling 414  pages. This report included 88 recom mendations for improving the current  s?Cial security system. The Commis sion made these recommendations in  order that we could work to restore  the  program's  financial  soundness  strengthen public confidence  system and, finally, present ways  to  better our  social  security program.  Furthermore, the Commission recom ~ended specific changes in the medic a1d and supplemental security income  programs. Today, however, it appears  as though that report has been forgot ten, along with the time and energies  of those nine Commissioners and the  $2.5 million of the taxpayers' money  that went toward the study.  The present administration  is now  asking that a new social security panel  be created.  Its purpose:  to help  im prove and reform the social security  system by proposing  realistic,  long term  reforms  to put social security  back on a sound footing and to forge a  working, bipartisan consensus so that  the necessary reforms can be passed  into law.  On January 6, the Sheboygan Press  of Sheboygan, Wis., printed an editori al asking why the President plans to  have yet another commission complete  the same assignment. Then, on Janu ary 14, James J. Dillman, former vice  chairman of the National Commission  on Social Security, responded to the  editorial. I would like to share the edi torial and letter at this point in the  RECORD.  WHY, MR. PREsIDENT?  It was less ihan 10 months ago that the  National Commission  of Social Security  issued a provocative 414-page  report-the  result of an intensive two-year study-call ing for specific measures to rescue the ailing  Social Security system.  At that time, we urged President Reagan  and the Congress to give the report the con sideration it deserved to maintain one of the  ",1982
121,,97,0.494,1058,3,Mr. CRAIG.," Mr. Speaker,  today,  Congressman  and  myself, are reintroducing a bill which  will help  the housing  industry and  allow first-time home buyers a tax de duction to purchase a home.  As you know, the housing industry is  in a prolonged downturn. The need to  create  incentives  for  individuals  to  invest in the purchase of a home is  tantamount to the success of revitaliz ing the housing industry. We believe  the ""individual housing account""  is  one tool that can be used as a  long term solution to bring about a cure for  our ailing timber and housing indus try.  The concept is very similar to indi vidual retirement accounts, in fact the  bill  is  titled ""Individual housing ac count."" This bill will create a tax de duction for first-time home purchasers  if they start an ""individual housing ac count."" A single  individual may con tribute $5,000 yearly over a 10-year  period, with a maximum allowed con tribution of $20,000. A married couple  may file jointly and make a maximum  yearly  contribution  of  $10,000  and  $40,000 over a 10-year period. This bill  also allows a couple the flexibility of  establishing  two  separate  IHA  ac counts but the maximum allowed con tribution of $40,000  over  a  10-year  period does not change.  No one needs to tell you the econom ic costs to the Nation of the current  EXTENSIONS OF REMARKS  housing downturn. The Federal Treas ury lost more than $10 billion in per sonal  income  tax, corporate  income  tax,  and  social  security  payments.  Local  jurisdictions lost over $2.5 bil lion in real estate taxes in 1979 alone.  This clearly shows the need to have a  mechanism to generate new capital in  the market dedicated for home pur chases.  The ""individual housing account"" is  an opportunity  to  help our  ailing  housing industry and off er tax incen tives for our young people to invest in  America's future. I hope you will join  those of us who are cosponsoring this  bill and assist us in our efforts to revi talize an important part of our econo my, the housing industry .e  PROF. FRANKLIN OFFNER  HON. HENRY J. HYDE  OF ILLINOIS  IN THE HOUSE OF REPRESENTATIVES  Tuesday, March 9, 1982  Louis,  Spirit of St.  e ",1982
122,,97,0.312,1058,3,Mr. HYDE.," Mr. Speaker, at  the  bottom of Capitol Hill on the left side  of the Mall rests the Air and Space  Museum of the Smithsonian. It would  do well to visit again this living tribute  to American inventive know-how. To  realize that the Wright Brothers, the  and  the Space  Shuttle are all homegrown, stirs in us  a deep sense of pride. Less glamorous,  but no less important, is  the special  exhibit on jet aviation. It is U.S. tech nology on parade. One of the principal  reasons contributing to the spectacu lar achievement in American aviation  is  the encouragement and protection  of invention, indeed it is part of our  Constitution. Article  I, section 8 di rects Congress to ""Promote the prog ress of science and the useful arts, by  securing for limited times to authors  and  inventors the exclusive right to  their respective writings and discover ies.""  More often than not, success is con tingent on cumulative effort and com bined inventions-the building blocks  of teamwork and ideas. Jet aviation is  a prime example. No one can do  it  alone.  In this special exhibit on  jet  aviation we can observe engineering  masterpieces, we  can appreciate  the  brilliance of the technical effort that  went into such engines as the J-47 and  the J-57.  They are the prototype for high per formance jet aircraft. One of the es sential elements  to the operation of  these complex engines is a fuel control  system and acceleration system invent ed  by Prof. Franklin Offner,  now  teaching at Northwestern Univesity in  Evanston, 111. Dr. Offner's credentials  as an inventor and scientist are with out peer. He was part of the Manhat tan project and has a number of other  patents to his name. He has contributMarch 9, 1982  ed to advancement in medical science  through his work  in medical  instru mention.  When Professor Offner should be  enjoying the fruits of his labor, he has  only a 30-year horror story to tell. His  saga threatens the patent law system  and the protection of small inventors  everywhere. He has fought a  lonely  battle against corporate giants  and  Federal Government  in  court  for  almost a generation.  Briefly, I would like to relate some  details about his legal battle to obtain  just compensation. In 1943, Professor  Offner, on his own initiative and his  own expense, started development of  an electronic fuel control system for  jet engines. By 1945, his development  had proceeded far enough so that the  Air Force asked for a voluntary, no cost demonstration. It was considered  a great success. He continued his de velopmental work and the Air Force  asked to purchase one of his fuel con trol systems at a total price of $7,500.  He built one for them, which they had  tested by an engine manufacturer. It  was again found to operate well, and  the development proceeded.  Because of this one sale of a device  he developed at his own expense, the  Government held it had a free license  to use his invention. They purchased  millions of dollars worth of controls  based on his invention from a major  jet engine manufacturer, and denied  him any compensation based solely on  this single purchase. He sought relief  in vain for years through the Court of  Claims. After this ugly experience Pro fessor Offner has avoided defense-re lated projects  like  the plague. The  public record documents the value of  his work with  respect  to electronic  control systems. A companion case in  another  court  says  of  Professor  Offner's invention:  It is clear that COffner'sl contribution to  the defense  effort was historic and  im mense .... It gave the U.S. a decided edge  over our international rivals. It saved the  government millions of dollars  in money  and time.  In  the  interest of  justice, science,  and protection for a small inventor, I  am introducing a bill for the private  relief of Professor Offner. No direct  compensation is provided, it merely is  a congressional referral to the Court  of Claims to review the issue. There is  no dispute as to who invented the elec tronic speed control system, the issue  concerns the use of that patent given  to Professor Offner.  Before concluding  I would  like  to  note  for  the  record  that Professor  Offner was offered $1 million by the  Air Force  to settle  this case out of  court. I believe it gives us a feel for  the strength of his claim. Ultimately,  the Offner case may lead to the pro tection  of  small  inventors  every where.e  ",1982
123,House,97,0.541,1071,3,Mr. BADHAM.," Mr. Speaker, I yield  myself such time as I may consume.  Mr. Speaker,  I would first  like  to  take this opportunity to commend my  good friend and colleague, the gentle man from Illinois <Mr. ANNUNZIO), for  his  leadership on  the Subcommittee  on Accounts. Under his chairmanship  the subcommittee has checked com mittee  spending. After a  decade of  ever accelerating committee spending,  ",1982
124,House,97,0.014,1084,3,Mr. JEFFORDS.," Mr. Speaker, I rise  to commend the Secretary of Agricul ture, John Block, on a recent speech  that he gave at the Western States  Dairy Conference  in Seattle, Wash.,  on March 3, 1982.  During the House-Senate conference  debate on the 1981 farm bill, I asked  the administration to develop a pro gram  that would penalize  those  re gions the most which contribute the  most  to  the overproduction of milk.  Because the administration failed  to  develop such a proposal, I, as well as  many of my colleagues,  accepted a  level of milk supports that would not  cause  serious  economic problems  in  those production regions where supply  and demand for milk and milk prod ucts has been in relative balance. One  of those regions is the New England  States, especially my own State of Ver mont. January milk production in my  State, according  to  the U.S. Depart ment of Agriculture, was 2 percent less  than the 1981 production level for the  same month and 1 million pounds less  than the 1980 level of production for  the same month.  In his speech, the Secretary percep tively recognizes thatThe Western States must share their fair  responsibility for this problem <overproduc tion). California alone accounted for 24 per cent of CCC butter purchases last year       and 26 percent of the dry milk purchases.  Four Western States-and I am referring to  California,  Idaho, Oregon,  and Washing ton-accounted for 31 percent of our total  CCC purchases and 38 percent of our non fat dry milk purchases last year.  The Secretary thus recognizes  the  regional disparity in production, and, I  am convinced, is working toward devel oping an equitable solution. I support  and endorse his call for a 2-day nation al dairy economics symposium  to be  held in Kansas City later this month  in order to discuss ways to bring milk  production under control in an equita ble manner.e  A NEW PROPOSAL ON  ANTITRUST CONTRIBUTION  ",1982
