,branch,congressID,ideology_score,page,part,speaker,speech,year
0,,112,0.498,1,2011-01-07,Mr. COFFMAN of Colorado.," Madam  Speaker, today our national debt  is  $14.01 trillion. It rolled over to above  $14 trillion for the first time on New  Year’s Eve last week. On January 6,  2009, the start of the 111th Congress,  the national debt was at $10.63 trillion.  This means the national debt has increased by $3.38 trillion since then—in  just 2 short years. This debt and its interest payments we are passing to our  children and to all future Americans.  I have been submitting, and will continue to submit, this debt to the CONGRESSIONALRECORD daily, and I will  continue to do so until Washington  takes responsibility and ends its reckless spending addiction.  f  SEND YOUR RESUMES  (Mr. JACKSON of Illinois asked and  was given permission to address the  House for 1 minute and to revise and  extend his remarks.)  ",2011
1,,112,-0.538,1,2011-01-07,Mr. JACKSON of Illinois.," Madam  Speaker, as we enter 2011, we find ourselves in the same jobs situation as in  2010. In order to show the huge need for  jobs, I will be collecting resumes from  Americans who are unemployed or underemployed. I’ll submit them for the  CONGRESSIONALRECORD. Unfortunately,  submitting  these  resumes  for  the  RECORDwill not get anybody a job.  By collecting these resumes, I hope  to dramatize the shameful condition of  unemployment and compel Congress to  do something about it. I hope to remind my colleagues every day that we  work  for those Americans who have  been left behind but who want to work.  Today, I call on my fellow Americans  to send me your resume and your story  to resumesforAmerica@mail.house.gov.  ResumesforAmerica@mail.house.gov. If  you are out of work, send me your resume and story so that I can use it to  remind our government of the need to  act.  Martin Luther King, Jr. once said:  America has issued us a bad check. It  has come back marked  ‘‘insufficient  funds.’’ But the vault of opportunity of  this Nation is not bankrupt.  bThis symbol represents the time of day during the House proceedings, e.g.,b1407 is 2:07 p.m. Matter set in this typeface indicates words inserted or appended, rather than spoken, by a Member of the House on the floor. H105  . VerDate Mar 15 2010  23:49 Jan 07, 2011 Jkt 099060 PO 00000 Frm 00001 Fmt 0636 Sfmt 0634 E:\CR\FM\A07JA7.000 H07JAPT1 E S U O H h t i w D O R P 1 B Y O S 8 G K S D n o s e m a j t         ",2011
2,House,112,-0.465,8,2011-01-07,Ms. SLAUGHTER.," Madam Speaker, I  yield 1 minute to the gentleman from  Michigan, our ranking member of Ways  and Means, ",2011
3,House,112,-0.378,8,2011-01-07,Mr. LEVIN.,  (Mr. LEVIN asked and was given permission to revise and extend his remarks.)  ,2011
4,House,112,0.478,8,2011-01-07,Mr. DREIER.," Madam Speaker, at  this time I yield 2 minutes to another  hardworking member of  the Energy  and Commerce Committee, our friend  from Marietta, Georgia, Dr. GINGREY.  ",2011
5,House,112,0.561,8,2011-01-07,Mr. GINGREY of Georgia.," I thank  the gentleman for yielding.  Madam Speaker, we have heard a lot  of arguments on the other side of the  aisle in regard to the $230 billion cost,  and on our side of the aisle, of course,  only in America can something actually cost $1.15 trillion and eliminating  it then all of a sudden costs $230 billion. But, yes, Ms. SLAUGHTER, only in  America, only in this Congress, numbers do lie.  Let me just say that what we have  been talking about on this side of the  aisle, of course,  is the voice of the  American people.  You know, it was about 3,000 years  ago that a little shepherd boy walked  into that valley of death looking up at  all of those Philistines and that 9-foot  giant Goliath from Gath. He had that  coat of mail, he had the sword, he had  the shield, he had the  javelin. And  what did little David have? He had a  little pouch and a handful of stones.  But he hit that giant right between the  eyes, brought him to his knees, and  then cut off the head of the snake.  That pouch and those little pebbles  represent the voice of the American  people. That is what we have on this  side of the aisle. That is why we are  going to pass H. Res. 9 and we are going  to pass H.R. 2 next week, and we are  going to deliver our promise to the  American people to eliminate, to repeal ObamaCare.  The American people spoke loudly.  They don’t like this bill. The Democratic majority in the Senate and the  President have  one  last  chance  to  make amends. I think they will do it.  ",2011
6,House,112,-0.502,8,2011-01-07,Mr. MARKEY.," This debate is about  health care versus don’t care.  The Democrats’ health care law lowers prescription drug costs, helps middle class families pay for health coverage for their sick children, and expands health care for 32 million more  Americans, reducing the deficit by $143  billion. The Democrats’ health care law  helps grandma afford her prescription  drugs.  The Republicans don’t care about  grandma. They want to take back the  drug benefits in the new law. GOP used  to stand for Grand Old Party; now it  stands for ‘‘grandma’s out of prescriptions.’’ The Republicans’ ‘‘don’t care’’  repeal shows they don’t care about sick  children with medical bills pushing  families  into bankruptcy,  that  they  don’t care about grandma and grandpa  who need help paying for prescription  drugs.  Vote down this rule so that we can  help grandma, sick children, and middle class families struggling to pay for  health care.  ",2011
7,House,112,0.571,8,2011-01-07,Mr. CANSECO.," Madam Speaker,  I  rise today in support of the rule and in  support of the underlying legislation,  the repealing of the job-killing health  care act.  Ten months ago, President Obama  and his allies  in the Democrat-controlled House and Senate committed  legislative malpractice  when  they  jammed through the Congress and into  law a Washington takeover of health  care. They did so despite the overwhelming opposition of the American  people. Since its enactment into law,  what was already a unpopular law has  only continued to become more unpopular.  There is no doubt that we need to reform health care in America. However,  it is not done by assaulting individual  liberties guaranteed in our Constitution,  bankrupting  our  children  and  grandchildren, and putting Washington  bureaucrats in the personal relationships between our doctors and our patients.  Repealing the health care bill will  also help encourage job growth to get  our economy back on track. Our economy is not suffering from a capital crisis; it is suffering from a confidence  crisis.  ",2011
8,House,112,-0.402,8,2011-01-07,Mr. PALLONE.," Madam Speaker, this  is nothing but a gag rule. I and so  many of my colleagues on the Democratic side went up to the Rules Committee yesterday and asked for amendments, and they were almost all excluded from this rule.  The Republican chairman of the committee says there is transparency. He  says that there is an opportunity for  participation. He can say it as many  times as he wants, but it is simply not  true.  He also said that this was a commitment to the American people. There is  no commitment to the American people here. The only commitment is to  the insurance companies. They are the  only ones that are going to gain from  repeal of this very important legislation, because they want to  increase  premiums, and they want to institute  discriminatory practices again against  women, a woman perhaps who has  breast cancer and a preexisting condition and can’t get insurance, or bring  back those lifetime caps, or bring back  those annual caps where people  lose  their insurance if they have had a serious operation and they try to go back  again and they don’t have insurance, or  perhaps the child who is up to 26 and  who also will not be able to get on  their parents’ insurance policy again.  Let me tell you here, the only one  who benefits is the insurance company,  not the American people.  VerDate Mar 15 2010  23:49 Jan 07, 2011 Jkt 099060 PO 00000 Frm 00008 Fmt 0636 Sfmt 0634 E:\CR\FM\K07JA7.015 H07JAPT1 E S U O H h t i w D O R P 1 B Y O S 8 G K S D n o s e m a j t         ",2011
9,,112,0.478,15,2011-01-07,Mr. DREIER.," Madam Speaker, I am  the only speaker on my side, so I will  reserve the balance of my time.  ",2011
10,,112,-0.408,15,2011-01-07,Mr. WEINER.," Madam Speaker,  I  yield myself such time as I may consume.  I  thought  that  the chairman was  going to say that he was going to be  brief. Well, he had no choice with this  rule. It’s a pretty short one.  I just want to say in the brief 2 minutes that we have here that this is a  pretty  important  issue  that we are  faced with. And I should say just at the  outset that I have the greatest respect  for my friend, ",2011
11,,112,0.202,15,2011-01-07,Mr. FITZPATRICK.,"  These two individuals were in this  Capitol. They were  in  this Capitol  when they took the oath of office. They  didn’t happen to be in this exact room.  Under the standard of collegiality in  Jefferson’s Manual, it is indicated that  they have to be within the proximity of  the Speaker.  Madam Speaker, any Member who  does not vote in favor of this resolution  is allowing the problem to persist. This  resolution rectifies the problem which  we all realize has happened. I believe  that we have a responsibility to this  institution, we have a responsibility to  the Constitution, we have a responsibility to the American people, and this  resolution rectifies a problem that has  existed.  Madam Speaker, I yield back the balance of my time.  ",2011
12,House,112,0.593,22,2011-01-07,Mr. POE of Texas.," Mr. Speaker, history,  heritage  and  symbols  of  the  United States are  constantly under  criticism in this country. Even yesterday when we read the Constitution of  the United States on the House floor,  the first time it has ever been done in  200 years, there were some who complained that it is irrelevant. It is kind  of like folks in church that cover their  ears when certain sections of the Bible  are read. They don’t want to hear it because it may apply to them.  People go to court nowadays to try  to remove our national motto, In God  We Trust. It  is above the  flag, Mr.  Speaker, although television very seldom shows our national motto.  Then there are those who are offended  by  the American  flag, Old  Glory. It is not even displayed in parts  of the United States because it offends  some people. Some people that are included in the group are foreigners who  are offended by the American flag.  Now we get to today, a report by the  Houston Chronicle about Marine Michael Merola, a 60-year-old vet from  the United States Marine Corps, and he  flies, here he is, he still looks like a  Marine, this is a photograph from the  Chronicle that shows Old Glory and, of  course, the Marine flag, flying in his  backyard on a 20-foot flagpole.  No one has complained. His neighbors  like it. Kids walk by and actually compliment him on flying Old Glory and  the Marine flag. But the neighborhood  association has complained and sued.  Now, who is this guy? Well, he served  in the United States Marines from 1969  to 1977. He trained with the United  States Navy SEALs. After he left the  Marine Corps, he was responsible as  sergeant of the guard for raising the  flag at NSA right down the road. He is  from New York, but he got to Texas as  fast as he could, and he has no intention of taking down this flag or flagpole. He is a passionate American. He  is a marine.  But the association doesn’t like it,  and here  is what they have said  in  their  lawsuit: the  flagpole  is a detriment to the association. It causes imminent harm and irreparable injury to  the association. The problem with the  flagpole of that height and that significance is it flaps in the wind and causes  noise to other homeowners. That  is  their problem. So they sued him.  Now, first of all, we have an issue of  freedom of speech. The Supreme Court  has said it is a right to fly the flag.  Speech includes the flying of the American flag. It is the symbol of everything that  is good and right about  America. That is why it is behind you,  Mr. Speaker, when we go into session  every day.  Marines and sailors and soldiers and  members  of  the Coast Guard have  fought under that  flag all over the  world and have died for that flag so the  association can exist down there  in  northwest Houston. Right now we are  engaged in two wars, in Afghanistan  and Iraq, and members of our military  are fighting under that flag. But it is  flying in the breeze and offends the association because the flapping causes  irreparable injury.  Well,  flapping  in  the  breeze  has  brought safety to the United States.  The flag flying throughout the world  and the noise, if we can use that word,  the sound of freedom, is the sound of  that flag flying in the United States  and throughout the world. It is freedom of speech, and it trumps the elitist  concept that the flag and the flagpole  are offensive to the association.  You know, Mr. Merola is a marine.  Once a marine, always a marine. And  we are proud of our marines in the  United States. They  are  a  unique  bunch. That was best said by an Army  general about the Marines, ‘‘There are  only two groups that understand the  marines—the marines, and the enemy.’’  And that is correct.  So good for you, Mike Merola. Keep  your flagpole up. Fly Old Glory. Fly  the marine flag. We are proud of you.  Keep fighting for the flag, because freedom of flying the flag trumps the concept that it is offensive to some people.  God bless our marines, God bless you,  Mike Merola, and semper fi.  And that’s just the way it is.  f  ",2011
13,House,112,0.618,22,2011-01-07,Mr. KING of Iowa.," Thank you, Mr.  Speaker. I very much appreciate the  privilege to address you here on the  floor of the House in this leadership  hour designated by the majority leader.  There are a number of subjects  I  wanted to take up this afternoon, but I  am  first  inspired by  the  statement  made by the gentleman  from Texas,  Judge, Congressman, Mr. POE, about  Marine Mike Merola.  This is one of these recurring stories  that we hear across the country. Somebody that is an ACLU individual, somebody that thinks somehow they get indignant because  there  is  something  somewhere that would allow them to  vent  some  of  their  prepackaged  hyperventilation against patriotism or  the truth or life or the Constitution or  the Declaration of  Independence or  American values or the values of Western Civilization or Judeo-Christianity,  all those people out there are full of indignities.  So an American flag and a marine  flag offends somebody? I say tough. I  am glad you are there. Fly that flag.  Fly it proud and fly it long.  I especially appreciate the statement  made by Mr. POEabout the sound of  that flag. My flag is on a flagpole about  that same height, 20 foot. I step out my  door in the morning, I check the wind  and the weather and I look at that flag,  and I listen to that sound. And there is  times I am sitting there in the dark at  night on my deck and I am hearing  that flag from the light that shines on  it around the corner just a little bit,  and I hear that ripple of Old Glory. It  gives me comfort and it gives me pride,  and it reminds me of the privilege of  serving here, anywhere you can serve  Americans anywhere on this globe.  I think of a time also on March 18,  2003, where I went out here to Pershing  Park, this side of the White House,  when there was an antiwar demonstration that took place. I actually walked  around through the Mall, around the  Washington Monument as  they prepared their demonstration. I remember  former chairman of the Judiciary Committee, John Conyers, standing on a  little stage there with great big speakers calling  for  the  impeachment of  President Bush because it looked like  there was an impending liberation of  Iraq. And I saw a man there.  Every kind of discontented, counter-  cultural, anti-American group was represented in those thousands of people  that came here that day. I saw the Japanese communist flag. I saw Vegetarians for Peace. I saw every counter-  culturalist group you can imagine. And  I saw a man there, an aging hippie. He  had on a  jacket. He was a photographer, you could tell, and he was taking pictures with great pride of this  anti-Americanism.  He reached in his pocket of his jacket, a worn leather jacket, and pulled  out of his pocket a flag, an American  flag, a silk American flag, a small flag,  and he used it to wipe the lens of his  camera. That is an image I will never  forget.  But no one stepped up to say he  couldn’t do  that. Where were  they  then? Where were the critics of Mr.  Merola then? When flags are used as  grease rags to scrub the lens of a camera that  is taking pictures of anti-  Americans joined together to protest  the saving of our freedom that Marine  Merola has stepped up to defend.  Those actions against him are offensive to me, and I say guard the flag, defend the flag, and I will stand with you,  and I know Judge POEwill too. Thanks  VerDate Mar 15 2010  00:07 Jan 08, 2011 Jkt 099060 PO 00000 Frm 00022 Fmt 0636 Sfmt 0634 E:\CR\FM\K07JA7.055 H07JAPT1 E S U O H h t i w D O R P 1 B Y O S 8 G K S D n o s e m a j t         ",2011
14,,112,-0.565,36,2011-01-07,Mr. HASTINGS of Florida.," Mr. Speaker,  I  rise today to honor the life of a great American, Katherine C. Kelly, a lifelong champion  of human  rights and universal health care,  who died on the morning of January 6, 2011  at the age of 86.  Katherine was a good friend and supporter  for more than 40 years. Over the course of  her life, she and her late husband, Edward M.  Kelly, were prominently active in the civil rights  movement, the fight for women’s rights, gay  rights, and every progressive movement in the  United States. Katherine dedicated her life to  the Democratic Party, serving as State Committeewoman from Palm Beach County for 26  years.  Additionally, she was named to the Electoral  College and served as a delegate  to  five  Democratic National Conventions.  She also served as the Legislative Director  for Florida NOW, as Vice President of  the  Florida Women’s Political Caucus, as a Board  member for NARAL, and as Development Director of Women Leaders Online. Her continued dedication  to political and progressive  causes led to recognition as the Outstanding  Feminist 2001 by Florida NOW and Woman of  the Year in 2008 by the Democratic Women’s  Club Palm Beach County.  Mr. Speaker, Katherine was deeply  loved  and widely respected by everyone who knew  her. Today, our nation has lost someone who  represented all that is good in the world.  f  IN  RECOGNITION  OF  THE  PANPAPHIAN  ASSOCIATION  OF  AMERICA ON THE OCCASION OF  ITS ANNUAL DINNER-DANCE  HON. CAROLYN B. MALONEY  OFNEWYORK  INTHEHOUSEOFREPRESENTATIVES  Friday, January 7, 2011  ",2011
15,,112,-0.386,36,2011-01-07,Mrs. MALONEY.," Mr. Speaker, I rise today  to pay tribute to the PanPaphian Association  of America for its tremendous contributions to  our cultural and civic life. Founded more than  two decades ago by Hellenic Cypriot Americans of Paphian ancestry, the Association has  carried out its vital educational, cultural, charitable, and humanitarian mission while helping  promote peace, unity, and understanding on  the occupied island of Cyprus.  The PanPaphian Association of America  held the Ninth Evagoras Pallikarides Award of  Merit dinner-dance last month. The Evagoras  Pallikarides Award of Merit was bestowed  upon Mr. Alkinoos Ioannidis for his dedication  to promoting Hellenic culture  through music  and song. Born and raised in Nicosia, Cyprus,  Mr.  Ioannidis studied classical guitar at  the  European Conservatory, moved  to Athens,  and was signed by Universal Music at age 23.  He went on to pursue a successful career in  acting and music, eventually focusing his efforts as a thriving musical performer and composer with many successful recordings. Influenced by traditional Cypriot music, the Greek  composers of the last decades, and classical,  jazz and rock genres. He often performs with  orchestras and ensembles. Above all, he remains devoted to the Cypriot people, their culture, and their struggle for justice, donating his  time and talent to numerous concerts and performances benefitting various Hellenic organizations and causes associated with justice for  Cyprus.  The PanPaphian Association awarded  the  Distinguished Fellow Cypriot Award  to Mr.  Polys Kyriacou, a distinguished poet and lyricist who has distinguished himself in his passionate commitment to justice for Cyprus and  his love for Hellenic culture. Born in Nicosia,  he served in the Cyprus National Guard before his studies at Pantios University in Athens. He came to New York City in 1982 to  earn a Master’s Degree in Communication and  Graphic Design at the Pratt Institute and then  worked as an Art Director at the Proini daily  newspaper. He served for many years on the  board of  the Cyprus Federation of America  and  the Justice  for Cyprus Committee, published  two  volumes  of  poetry,  including  Sximata, which won First Prize for a Young  Poet from the Cyprus Ministry of Education. A  Member of the Board of Directors of Cosmos  FM Radio, he hosts his own program every  Sunday morning and remains deeply involved  in New York City’s vibrant Hellenic community.  The Member of the Year Award was given  to Mr. George Kouspos. Born and raised  in  Paphos on Cyprus, he came  to  the United  States in 1984 after serving as an officer in  the Cyprus National Guard. He earned a  Bachelor of Science degree in Electrical Engineering  from  the City College of New York  and an M.B.A. degree from Adelphi University  while working his way through school. He became  a  principal  at  CY  Electric  Corp.  Throughout his studies and his subsequent  professional success, he has  remained extraordinarily devoted to the cause of justice for  Cyprus; to the PanPaphian Association, which  he has served as Vice President, Cultural Officer, and Treasurer; and above all to his beloved family, Nancy (Nafsika), who was born  in Asgata, Cyprus, and his beautiful daughters, Demetra and Maria.  Mr. Speaker,  I ask  that my distinguished  colleagues rise to join me in paying tribute to  the PanPaphian Association of America,  the  recipients of its awards, and all its many contributions to the civic life of our Nation.  f  TRIBUTE  TO  CLARK  SHERIFF’S  DEPUTY  WAUGHTEL HOPPER  COUNTY  SUZANNE  HON. STEVE AUSTRIA  OFOHIO  INTHEHOUSEOFREPRESENTATIVES  Friday, January 7, 2011  ",2011
16,,112,0.367,36,2011-01-07,Mr. AUSTRIA.," Mr. Speaker, today I will be  traveling back  to Ohio  to express my sympathy to the family of Clark County Sheriff’s  Deputy Suzanne Waughtel Hopper. Deputy  Hopper’s funeral will be at 11:00 a.m. on Friday, January 7, 2011.  Deputy Hopper was killed in the line of duty  on New Year’s Day while responding to shots  fired in a local community. Because of her decisive action, courage and bravery lives were  saved. She is a true American hero.  f  IMAN ABBASI  HON. TED POE  OFTEXAS  INTHEHOUSEOFREPRESENTATIVES  Friday, January 7, 2011  ",2011
17,,112,0.593,36,2011-01-07,Mr. POE of Texas.," Mr. Speaker, in just a  few days, on January 9, Iraqi authorities will  deport  the Abbasi  family  to  Iran where  they  face certain persecution.  The Abbasis are political refugees. Their father got in trouble in Iran because he dared to  write that Iranians actually deserve freedom.  He wrote that every man should be able to  have a say in who governs them. This simple  idea is the very foundation on which our great  Nation was built and  the  fundamental, universal human right of all mankind. But the tiny  tyrant of  Iran did not  like  that. He saw Mr.  Abbasi as a threat to his power.  The regime, having tasted power, is doing  whatever it can to keep it. That includes imprisoning,  torturing, and murdering anyone  who so dares speak against it. But these are  desperate actions  from a desperate regime.  VerDate Mar 15 2010  01:15 Jan 08, 2011 Jkt 099060 PO 00000 Frm 00002 Fmt 0626 Sfmt 9920 E:\CR\FM\A07JA8.001 E07JAPT1 S K R A M E R h t i w D O R P 1 B Y 0 S 9 B K S D n o z e n i t r a m s         ",2011
18,House,112,0.547,2,2011-01-18,Mr. WILSON of South Carolina.," Mr.  Speaker, South Carolinians are still  celebrating Wednesday’s inauguration  of Governor Nikki Randhawa Haley of  Lexington as the first female governor  in the 341-year history of our State.  She is the second Indian-American governor in American history, in the tradition of Louisiana Governor Bobby  Jindal, recognizing the growing significance of Indian Americans in American  society.  Our family is very grateful for the  swearing in of my oldest son, Alan Wilson of Lexington, as America’s youngest attorney general. His prosecution  experience will  serve  the people of  South Carolina well.  The inauguration was also historic  for being the first all-Republican inauguration in over 130 years with Lieutenant Governor Ken Ard; Secretary of  State Mark Hammond; Treasurer Curtis Loftis; Comptroller General Richard  Eckstrom;  Superintendent  of  Education Mick Zais; Adjutant General  Bob Livingston, Jr., America’s only  popularly elected adjutant general; and  Commissioner  of  Agriculture  Hugh  Weathers.  In conclusion, God bless our troops,  and we will never forget September the  11th in the global war on terrorism.  f  NO REPEAL OF HEALTH CARE  REFORM  (Mr. BUTTERFIELD asked and was  given permission to address the House  for 1 minute and to revise and extend  his remarks.)  ",2011
