,branch,congressID,ideology_score,page,part,speaker,speech,year
376,,112,-0.53,115,2011-09-15,Ms. MOORE.," Mr. Speaker, I rise to pay tribute to Antonio M. ‘‘Tony’’ Pe´rez, recipient of  the 2011 Frank P. Zeidler Public Service  Award. Mr. Pe´rez is a long-time social justice  advocate, mentor, community leader and consummate professional. He currently serves as  secretary-executive director of  the Housing  Authority of  the City of Milwaukee (HACM).  The Frank P. Zeidler Public Service Award acknowledges residents whose efforts most embody the social justice and public service values and vision of former Mayor Zeidler, who  died in 2006 at the age of 93.  Mr. Pe´rez’ body of work has been exemplary. He founded the Milwaukee Community  Service Corps (MCSC), a non-profit vocational  training organization that continues to provide  employment and education to young adults in  Milwaukee.  It was modelled after  the 1930s  Civilian Conservation Corps (CCC). Mr. Pe´rez  developed a holistic program  that  integrates  education and life skills with on-the-job work  experience  for  low-income 18–23-year-olds.  During his  tenure at MCSC  from 1991  to  2000, more than 900 participants found jobs  and  received more  than $4.5 million  in  income. MCSC serves an average of 100 young  participants per year and has served approximately 2,000 young adults since its inception.  In 1996, Mr. Pe´rez was one of six inspirational youth role models and mentors profiled  on PBS’, ‘‘The Merrow Report: Searching for  Heroes’’. Mr. Pe´rez serves on a number of  prestigious committees and has received numerous awards including member of the Executive Committee of  the AmeriCorps National  Civilian Community Corps, past president of  the National Association of Service and Conservation Corps, and has served as a consultant to the Peace Corps. In 2006, HACM received  the  prestigious World  Leadership  Award in London, England for developing solutions to housing that are innovative to city  leaders around the world. Also, in 2007 Mr.  Pe´rez was recognized by the National Child  Labor Committee with the Lewis Hine Award.  At HACM, Mr. Pe´rez oversees an  internationally-recognized agency that provides affordable housing options for over 12,000 low-  income families, elderly and disabled persons  in  the City of Milwaukee. During his  tenure,  the agency received or leveraged more than  $265 million  in development  resources. Accomplishments while at HACM  include  the  construction of the $28 million Milwaukee Job  Corps Center in conjunction with the U.S. Department of Labor. The facility opened in the  fall 2010 and has resulted in the creation of  over 125 administrative, teaching, health care  and service jobs. Additionally, during his tenure the City of Milwaukee obtained a five-year,  $24 million federal Enterprise Zone grant that  helped thousands of youth gain training and  employment.  Mr. Speaker, I am proud Antonio M. ‘‘Tony’’  Pe´rez hails from the 4th Congressional District  and that I can call him friend. I am honored to  give praise to his many accomplishments and  life time commitment to youth and the entire  Milwaukee Community. I wish him many more  years of success.  f  HONORING AUSTIN SALMON  HON. SAM GRAVES  OFMISSOURI  INTHEHOUSEOFREPRESENTATIVES  Thursday, September 15, 2011  ",2011
377,,112,-0.465,115,2011-09-15,Ms. SLAUGHTER.," Mr. Speaker,  I  rise  in  support of  the Pharmaceutical Stewardship  Act of 2011.  Across  the country, unused and expired  pharmaceuticals are polluting our water ways,  poisoning our children, and putting our public  safety at risk. Americans should have a convenient and safe option when they want to rid  their cabinets of unused drugs. The pharmaceutical stewardship bill  I  introduced  today  would ensure that these drugs are kept out of  drinking water and out of the hands of both  criminals and unsuspecting children.  The need for a safe drug disposal program  has never been greater. In a 2008 investigation, pharmaceutical contamination was found  in 24 out of 28 metropolitan areas’ drinking  water. Over 50 pharmaceuticals or byproducts  were found in the Philadelphia source watershed alone.  Unlike the citizens of approximately a dozen  other countries, Americans do not have a convenient and consistent place  to bring  their  medications. Without a drug  take back program, pharmaceuticals are frequently diverted  to purposes for which they were not intended.  The results can be deadly. Unguarded, unused pharmaceuticals can cause accidental  poisonings, be misused, or diverted for criminal purposes.  Every fifteen minutes, a child under four will  overdose on drugs found at home. In 2011,  the Centers  for Disease Control  (CDC)  reported  that unintentional prescription opioid  overdoses now kill more Americans than cocaine and heroin combined.  In Florida,  the  death rate for prescription drugs increased 84  percent.  Without safe disposal options, our most vulnerable and unsuspecting citizens are in the  bull’s eye of a proliferating pharmaceutical  black market. The elderly are at risk of violent  home break-ins, scams, and death as prescription drug addicts seek to steal their medications.  Drug  thieves  also  target  ‘open  house’  events and ask to use the bathroom in order  to have access to the medicine cabinet. The  problem  is so rampant  that realtors  in Ohio  are given medication lockboxes to store medications during open houses and the National  Association of Realtors recommends hiding all  prescription medications during open houses.  Americans who want to reduce the threat to  their health and safety posed by leftover prescription medications have few options.  Federal agencies from the Office of National  Drug Control Policy to the Drug Enforcement  Agency are encouraging Americans to use secure medicine  take-back programs  to return  drugs for environmentally sound disposal. But  these programs are too few and far between,  and communities are struggling  to provide  them. Because secure  take-back programs  are not widely available,  the FDA currently  recommends that the most toxic and addictive  substances be flushed down the toilet and into  the wastewater system. When take-back programs are not available, federal agencies are  forced to advise that all other unwanted pills  should be mixed with undesirable substances  in an attempt to prevent theft and then thrown  in the trash for delivery to the landfill.  The  current disposal methods are  inadequate and even dangerous. A mother with  Crohn’s disease was prescribed an opioid  patch 100 times stronger than morphine but  she was afraid her plumbing could not handle  the used patch so she threw it away. Her 4-  year old died after  finding and applying  the  patch from the trash.  Furthermore, pharmaceuticals disposed  in  the trash or down the drain reach our nation’s  waterways and our drinking water.  In 2002, the United States Geological Survey found that 80 percent of streams and 93  percent of groundwater was contaminated with  at least one pharmaceutical. In 2008, an investigation found that at least 46 million Americans  are  exposed  to  prescription  drugs  through  their drinking water. Others are exposed when food crops are fertilized with polluted biosolids and absorb pharmaceuticals  through the roots to the plant itself. Perhaps  even more frightening is that the current extent of pharmaceutical pollution  is unknown  and understudied.  Aquatic organisms and  indeed whole ecosystems can never escape this witches brew  of pharmaceuticals. The USGS  recently  reported the widespread sexual disruption in fish  across the United States. Of the many compounds  in  the  pharmaceutical  slurry  that  VerDate Mar 15 2010  05:00 Sep 16, 2011 Jkt 099060 PO 00000 Frm 00003 Fmt 0626 Sfmt 9920 E:\CR\FM\A15SE8.006 E15SEPT1 S K R A M E R h t i w D O R P 1 N V T P T 5 K S D n o r e k a l w p         ",2011
378,Senate,112,0.43,34,2011-09-26,Mr. BLUNT.," Mr. President, today I  pay tribute to Dr. C. Pat Taylor, who  has served as president of Southwest  Baptist University in Bolivar, MO, for  the last 15 years, making him the longest serving president in the 133-year  history of the school. Dr. Taylor already had an impressive record in higher education before coming to SBU in  1996. In the last 15 years he has added  to that record of accomplishment and  earned respect for his leadership and  dedication to the students and community at Southwest Baptist University.  Southwest Baptist University  is a  very special place to me. I earned my  undergraduate  degree  there  and  20  years later served 4 years as its President. Dr. Taylor is my successor, and I  have enjoyed watching the university  grow and get even better under his  leadership.  During  his  SBU:  Dr. Taylor has presented a record  11,881 degrees since 1996.  SBU  has Missouri’s  third  largest  nursing degree program on its Springfield campus.  The number of student missionaries  sent out in North American has doubled to more than 400 in the last decade, and Dr. Taylor hopes to see that  continue to increase.  remarkable  tenure  at  VerDate Mar 15 2010  05:04 Sep 27, 2011 Jkt 099060 PO 00000 Frm 00031 Fmt 0624 Sfmt 0634 E:\CR\FM\A26SE6.019 S26SEPT1 E T A N E S h t i w D O R P 1 N V T P S 6 K S D n o s e m a j t         ",2011
379,House,112,0.66,9,2011-10-04,Mr. POMPEO.," Mr. Speaker,  since  coming to Congress 9 years ago, I have  sadly relearned that the government in  Washington D.C. only grows and grows  and grows. When Democrats and many  Republicans, too, come to the floor of  the House and  talk about  spending  cuts, they are often talking simply  about slowing the rate of growth of  government. There is seldom, if ever,  any real discussion about cutting the  size of  the Federal Government or  about eliminating an entire program or  agency. But today, with $14.8 trillion in  debt, we can’t continue to simply slow  the rate of growth. We’ve got to cut it,  and we’ve got to get rid of some things.  As a first step this week, I will proffer a bill that will eliminate the Economic Development Agency. It’s part  of the Department of Commerce and  was established in 1965 as an element of  President Johnson’s Great Society. For  over 45 years, the EDA has spent billions on  local projects, not national  projects, trying to pick winners and  losers amongst various projects by region, industry, and community. Much  like a stimulus bill or earmarks, the  EDA provides loans and grants to pet  projects  of  the  administration  in  power.  In 2008, the EDA spent $2 million on  the Harry Reid Research and Technology Park at the University of Nevada, Las Vegas. Just  last year,  it  spent $25 million on the Global Climate  Mitigation Incentive Fund. This year,  the agency will spend almost $300 million of  taxpayer dollars. Now,  this  might not sound like a lot of money  sometimes here in Washington, D.C.,  but  in Newton,  in  Independence,  in  Wichita,  and  in  Goddard,  Kansas,  that’s still a lot of money.  I want to take just a minute to talk  about the EDA. Most folks in Congress  and most  folks back  in Kansas will  have never heard of it. I had not before  I entered Congress. It provides these  grants and loans to projects it selects  all over the country. At its very core,  the EDA is nothing more than a giant  wealth redistribution machine. It takes  money from people in one place and at  one time and redistributes it all across  the  country  for  inherently  local  projects.  For example, it gave $2 million to the  ‘‘culinary amphitheater,’’ wine tasting  room, and gift  shop  in Washington  State. It gave $350,000 to renovate a  theater in Colorado. In 2011, it gave $1.4  million to build infrastructure development so that a steel plant of $1.6 billion could be built in Minnesota. Like  the vast majority of projects,  that  steel plant would have been built without Federal taxpayer dollars. It was a  $1.6 billion project helped by the Federal Government to the tune of only  $1.4 million.  Our even bigger problem, however, is  with EDA. It’s duplicative. It’s just one  of at least 80 Federal economic development agencies. HUD and Ag and HHS  all have economic development grants  as well.  Second, it’s ineffective. It typically  provides a very small part of any given  project. The GAO reports that most of  its financing did not have any significant effect on the success of projects  and produced, at best, inconclusive results and, in some cases, may even detract from a more flexible workforce.  Third, this is an incredibly wasteful  agency. It was identified by GAO as  one of the agencies that ought to go  away. Indeed, a recent inspector general audit of 10 projects totaling $45  million showed that 29 percent of the  grant money had been wasted due to  various violations of EDA grant requirements. Four of the 10 projects  EDA funded in that group were never  completed.  Finally  and  perhaps more  importantly, this is not the role of the Federal Government. As the Cato Institute  has written, the Federal Government  has no business trying to direct economic activity through politicized subsidy vehicles like the EDA. We’ve seen  that with bad outcomes,  like with  Solyndra, only too recently.  Every great  journey starts with a  single step. This is a small agency, but  it’s time for the first time in decades  that we eliminate an entire program,  an entire agency, so that it cannot continue to grow and grow and grow as  part of our Federal Government.  I  would ask my colleagues to support the  EDA Elimination Act.  f  POVERTY  ",2011
380,House,112,-0.562,16,2011-10-04,Ms. EDWARDS.," Mr. Speaker,  the  other side has been in the majority for  39 weeks and they still haven’t passed  a single piece of legislation to create  jobs or help small businesses. And now  they reject out-of-hand, commonsense  ideas in the American Jobs Act that  would help small business owners who  really are the economic engine responsible for creating 70 percent of the jobs  in this country.  Last week, I visited with small business owners  like Susan Bishop,  the  owner of Jaha Hair Studio. She has  been in business 16 years, has eight employees, and she has found it impossible to get a $30,000 credit extension to  meet payroll from a bank that she has  done business with for 16 years. She  wants to expand her business, to hire  others, to train others, and she can’t do  it, but she could with the American  Jobs Act.  Constituents  Abeba  and  Lene  Tsegaye, owners of Kefa Cafe, told me  that they would actually hire someone  if they could get the tax credits available in the American Jobs Act.  So why aren’t we doing it, doing it  for the owners of Kefa Cafe and other  small businesses throughout my congressional district? These are real job  creators. It’s time for this to be our top  priority.  Pass  the American Jobs Act. Get  America back to work. It’s time for the  majority to act.  f  b1230  PENDING FREE TRADE  AGREEMENTS  (Mr. MORAN asked and was given  permission to address the House for 1  minute and to revise and extend his remarks.)  ",2011
381,House,112,-0.256,30,2011-10-04,Mr. CARNEY.," I thank my colleague  from Hawaii, one of the other small  States. I know you’re a delegation of  two; we’re a delegation of one. I represent the whole State of Delaware. I  tell my constituents that we have two  Senators and one Member of Congress.  That means that I have to work twice  as hard, Mr. Speaker, to serve the people in my State.  I’m pleased to join my freshman colleagues on the Democratic side of the  aisle this afternoon for our discussion  about small business and job creation,  and I’d  like to talk  for a  little bit  about the situation in my State, the  State of Delaware.  All of us are coming off a district  work week, where we spent our time,  I’m sure, meeting with constituents,  talking to business owners, small business owners, large business owners, and  working our districts. And I did the  same thing in Delaware, not too far  from the Capitol here. I would like to  highlight two meetings that I had in  particular. One was a job fair that we  held in Georgetown, Delaware, which is  the county seat in the lower part of our  State. Many people  from the Washington, D.C. area know Georgetown as  they pass through it to go to our lovely  beaches during the summer time to  enjoy time with their family at the  beach.  This particular day we sponsored a  job fair in Georgetown, along with Senator CARPERand Senator COONS. This  was a program  that Senator COONS  championed  in Wilmington  initially,  and we’ve moved it now to the other  two counties of our State and had a job  fair in Dover and a job fair in Georgetown this past week, really helping to  connect those folks in our State who  are  unemployed  or  underemployed,  people looking to move up with employers who are looking to hire. And  even though we have over 9 percent unemployment nationally and a little bit  over 8 percent unemployment in our  State of Delaware, there are still a lot  of  jobs that go wanting, mostly because the employers are not able to  find people  that have  the  required  skills for that particular enterprise.  So the good news about this job fair  is that we had 55 employers there,  many of whom were prepared to hire  people and offer them jobs, certainly  take resumes and interview people or  set up interviews. But we had over 8,000  people who came seeking employment  or seeking an upgrade in their current  job situation. And that’s a lot of people  in the small State of Delaware in the  least populous area of our State. So it  tells us the very serious problem that  we have with the lack of jobs and the  lack of skills that people might have to  do the jobs that are out there.  Later on in the week, I met at PATS  Aircraft, which is an airplane manufacturing facility at Georgetown Airport.  They’ve been hiring airplane mechanics over the last several years. In fact,  when I was lieutenant governor, one of  the biggest problems that they had was  finding workers that had the requisite  skills to do the jobs that they had.  Now, they have since lost some of that  work; but they were looking ahead and  anticipating,  with  some  assistance  from the FAA, to extend the runway  there  at Georgetown Airport—going  back to your point about the need for  infrastructure to stir business development, business growth and  job creation. If we were able to extend the  runway  there at  the airport, PATS  would be able to hire more mechanics.  But there are a  lot of people out  there, while they might want those  jobs, would not have the skills to do  the work. And so Delaware Technical  and Community College, with the help  of the State government, has developed  a training program specifically to prepare workers for that facility and other  airplane manufacturing  facilities  in  our region.  b1450  We have a Dassault Falcon plant,  which does airplane maintenance and  mechanics at the New Castle County  Airport, as well as a large Boeing facility over the line in southeastern Pennsylvania. So these are jobs. They are  highly skilled jobs. They are jobs that  require mechanical ability. They are  jobs that require training. And there  are certainly lots of folks out there  that are looking for employment, and  these are the kinds of jobs that we need  to prepare people for.  One of the press conferences we had  this week was at Delaware Technical &  Community College where we highlighted a Federal grant that was going  to Delaware Tech to create training  programs for businesses, basically to  enable people to upgrade their skills to  take the jobs that are available. One of  the problems, obviously, that we have  in our country—and  the President’s  employment council has identified this  problem—is that we have jobs that are  out there, but we don’t have people  with the right kinds of skills for those  jobs. So we need to have programs—  and this  is where the public sector  comes into play, particularly technical  and  community  colleges—to provide  that training and those skills for those  folks.  Later on  in the week,  I met and  spoke with the Georgetown Chamber of  Commerce; and the Georgetown Chamber, of course, is comprised mostly of  very small businesses. They had a really simple message for me, as a Member  of Congress, and that is that they see  their businesses struggling because of a  lack of confidence among consumers.  And when you think about the U.S.  economy at large, about 70 percent of  economic activity is consumer driven.  So when consumers don’t have confidence either in their employment situation in the present—they may not be  employed—or their future employment  situation, they’re not willing to spend  money on small business services or  products in the community and, therefore, these small businesses suffer.  So their message to me was really a  simple one,  twofold. One  is: Do no  harm in Washington, DC. Do the work  of the people, solve the problems that  we have, and inspire confidence. And I  think one of the ways that we can do  that—there’s a lot of discussion. Most  of the discussion that I hear from my  constituents in the State of Delaware—  and we’ve had  town hall meetings.  We’re going to have a telephone town  hall meeting tonight. I’m sure I will  hear the same thing: Enough with the  partisan  bickering  back  and  forth  across the aisle. Let’s  focus on the  challenges that we face—creating jobs  and strengthening businesses, creating  a business climate in the short term  where  businesses  can  thrive, where  consumers  can  have  confidence  so  they’ll be willing to spend on small  businesses and other procurement. And  in the long term, address our deficits,  our debt, and our budget imbalances.  If we’re able to do that, we’ll at least  provide some confidence to the people  that we represent that those that they  send from Delaware, the Members of  the House of Representatives here and  our Senators across the Capitol, are  doing their part, are working together,  are focused on not the politics of where  we all stand in relation to the next  election but on solving the problems  that face our country.  I think the vote that we have coming  at the end of this year, which will be  the result of the work of the Committee on the Budget, will be maybe  one of the most important votes in a  number of years. I have heard our majority whip STENYHOYERrefer to it as  the most important vote here in the  last 30 years. And I think that’s right  in many respects, because people out  there, my constituents, your constituents, Ms. HANABUSA, in Hawaii—I see  our colleague from Rhode Island (Mr.  CICILLINE) has joined us as well—our  constituents are asking us, begging us  to do our work to inspire confidence  and to do the right thing for the country. And that involves giving people  the skills they need to be able to do the  jobs that are available out there, creating  confidence  so  businesses  can  make investments, so people will be  willing to spend money and consume so  our economy will get back on its feet  again. In the long term, we’ll set up a  fiscal situation with our government so  that the economy can be strong and  create jobs for my children and their  children.  So I want to thank my colleague  from Hawaii for leading our dialogue  this  afternoon  on  job  creation,  on  small business development across our  country in our respective districts, and  I look forward to sitting here with you  for a few more minutes and engaging in  this dialogue. I just wanted to give a  few words about how the people  in  Delaware are responding to the work  that we are doing or are not doing here  in the Congress.  ",2011
382,House,112,-0.368,30,2011-10-04,Ms. HANABUSA.," Thank you. And before the Congressman from Delaware  VerDate Mar 15 2010  01:52 Oct 05, 2011 Jkt 019060 PO 00000 Frm 00030 Fmt 7634 Sfmt 0634 E:\CR\FM\K04OC7.059 H04OCPT1 E S U O H h t i w D O R P 1 N V T P S 6 K S D n o s e m a j t         ",2011
383,House,112,0.366,37,2011-10-04,Mrs. ROBY.," The only other thing  that I would have to offer is to say  that, as we move forward in the coming  months and weeks, we’ve got to find  common ground, but we do not have to  forfeit our principles in doing so. We  stand by the things that conservatives  stand by.  It’s a  three-legged  stool:  We’re  fiscally  responsible, we’re  socially conservative, and we are pro-  military, pro-defense. And we can still  stand on that stool but yet continue to  seek  opportunities  to  find  common  ground.  The problem is that the Senate is not  even  having  this  conversation. We  watched 2 weeks ago as they tabled the  continuing resolution that we passed in  the House, meaning they’re not even  going to take an up-or-down vote on  this, and ultimately passed something  much different.  We are asking our  friends on the  other side of the aisle in the Senate  and the White House to have a conversation with us. We have passed all  of these bills that will lift the heavy  hand of government off of the very job  creators in this country; and we just  want an opportunity  to debate and  then find where we do share that common ground, again, without ever compromising our core conservative principles.  Thank you again to the gentleman  from Arkansas. I really appreciate the  opportunity to spend this hour with  you.  ",2011
384,Senate,112,0.128,58,2011-10-04,Mr. BROWN of Massachusetts., I ask  unanimous consent the order for the  quorum call be rescinded.  ,2011
