,branch,congressID,ideology_score,page,part,speaker,speech,year
402,,112,-0.519,180,2012-06-20,Mr. TOWNS.," Mr. Speaker,  I rise  today  in  recognition  of  Lawrence  E. Gary,  Ph.D.,  LICSW, on the occasion of his retirement as  a full professor from Howard University School  of Social Work.  Dr. Gary has enjoyed a  long and distinguished career as a scholar, researcher, educator, author, administrator, and clinical counselor spanning more than half a century. He is  recognized as one of the nation ’s preeminent  scholars on the impact of mental health issues  on African American males and African American families. Dr. Gary received his Bachelor  of Science degree with high honors  from  Tuskegee University and earned his Master of  Public Administration degree, Master of Social  Work degree, and Ph.D. from the University of  Michigan. Dr. Gary has received appointments  at the School of Social Work at the University  of Michigan and Howard University School of  Social Work and was the Samuel S. Wurtzel  Professor at Virginia Commonwealth University School of Social Work.  Dr. Gary has received funding for research  totaling more  than $8 million, authored and  published hundreds of scholarly articles and  papers, and has presented lectures at more  than 50 universities and colleges  throughout  the United States and in South Africa. He has  provided consultation to scores of public and  private entities in the areas of mental health  and substance abuse.  Dr. Gary is a devout Christian and has been  a devoted member of the Saint Paul African  Methodist Church  in Washington, DC where  he has provided exemplary  leadership as a  servant leader on the Board of Trustees and  the Steward Board for several decades. He is  a devoted husband to Dr. Robenia Gary and  father  to  three  children:  Lisa, Andre  and  Jason.  Dr. Gary  received  the 2002 Distinguished  Alumni Service Award from the Alumni Association at the University of Michigan, the 2001  Distinguished Alumni Award from the School  of Social Work at the University of Michigan,  the 2001 Scholarly Contribution  to Mankind  Award from Alpha Phi Alpha Fraternity, inc.,  as well as awards and distinction from numerous organizations, and is listed in Who’s Who  in America and Who ’s Who in the World.  Mr. Speaker, I would like to recognize the  outstanding  contributions Dr.  Lawrence E.  Gary has made to the social work profession  and to the well-being of citizens of the United  States of America.  Mr. Speaker, I urge my colleagues to join  me in paying tribute to Dr. Lawrence E. Gary.  HON. ANNA G. ESHOO  OFCALIFORNIA  INTHEHOUSEOFREPRESENTATIVES  Wednesday, June 20, 2012  ",2012
403,House,112,-0.238,12,2012-06-29,Mr. BOSWELL.," I would just like to  give my  appreciation  to  you, Mr.  Chairman, to Mr. RAHALL, and to you,  PETER, and everybody that’s worked so  hard on this.  Just one comment. We’re moving forward. We’re going to have jobs. We’ve  done the right thing. It’s a good first  step. We’ve got more to do, as was just  said. Everybody gives up something.  We’ve got this control box, if you  want to call it, the black box; the recorder that’s going to be in all trucks.  The Mexican trucks get theirs paid for.  This happens  to be a commercial  driver’s  license.  I  don’t know how  many of you have got one, but if you  want to see one, come look at it sometime. It’s a  little doing to get one.  Owner-operators have to pay for their  own. They’re making $50,000, $60,000 a  year if they’re doing a good operation.  That’s  prevalent  in  trucks  running  across this country. They’re doing a  good  job. They’re keeping commerce  moving. We ought to just keep in mind  we ought to give those middle class,  hardworking, patriotic Americans the  consideration they deserve.  But I’m glad we got the bill. I will go  out there and work with all of you to  try to get it better and get more done,  but we’ve got a good first step.  ",2012
404,House,112,0.598,40,2012-06-29,Mr. GOHMERT.," It’s always an honor  to speak before the House of Representatives, a great storied history here,  just as the Supreme Court has a great  storied history. There’s some moments  in  time with  regard  to  the United  States Supreme Court which show it to  have consisted of a bastion of strong-  willed,  determined,  principled,  constitutionally minded Justices. There  are other  times when  the Supreme  Court has shown itself to consist of  some great judges and some who are  more interested in politics, more interested in feathering their friends’ nests  than they are in doing what was right  under the Constitution, even though it  was easy enough for them to rationalize that, gee, if they did what helped  their  friends,  then  obviously  that  would make  it better  for the whole  country.  I think we get some of that rationalization from this administration. Gee,  if they just throw billions or hundreds  of billions of dollars at friends, then  their friends will do better. And if their  friends are doing better, surely the rest  of the country would. We have also  found that to be true with regard to  things like Solyndra and the massive  number of other cronies of the administration that have received hundreds of  billions of dollars over time and also at  a time when this country  is sorely  hurting from overspending and running  up debt.  In fact, today we had a bill regarding  transportation and a conference report.  I know my friend JOHNMICAfrom Florida worked exceedingly hard, as had  other members of Transportation, trying to reach an agreement with the  conference report. It looked like the  Senate got the better end of the deal.  But I know these people, I know their  hearts, and I know they try to do what  is right for America when it comes to  Chairman MICAand those who are assisting him.  But,  nonetheless,  we  heard  our  friends across the aisle over and over  today talk about how critically important infrastructure is, how we ought to  be spending money, and how just $1 billion added to the transportation budget  could really make a tremendous difference. I hearken back to a year-and-  a-half ago when the President of the  United States, Barack Obama, had told  people that if you will give me basically a trillion—whether it’s $800 billion, $900 billion, apparently it looked  more like a trillion dollars by the time  it was finished—you just hand me over  a trillion bucks and we’ll get this economy going. If you don’t give it to me,  then it will turn out that we may see  as high as 8.5 percent unemployment.  But if you do give it to me, we’ll never  see 8.  Of course, he was wrong  that we  would never see 8 percent unemployment. We’ve gone for many months—I  guess that was 31⁄2years ago now—that  he was telling us about his big stimulus. How quickly time flies.  As  the  transportation  proponents  were pushing their bill today and talking about what the good infrastructure  will do, many of us believed that was  true back in January of 2009, that it  would be good. If we’re going to spend  money on anything, spend it on the  things  that we  really need  to  do:  bridges, roads, all these things that  need construction, need renovation.  So the President sold America largely on his stimulus because we’re going  to fix all the infrastructure in America. But the last 31⁄2years have borne  out that the President did not spend  $800 billion, $900 billion on infrastructure. He spent maybe 6 percent of the  largest giveaway in American history.  He surpassed the terrible mistake that  TARP  was—$700  billion.  And  we  haven’t been able to get an exact number, but of the $700 billion, it may be  $450 billion-or-so that his administration inherited. So when you get the  $800 billion, $900 billion, trillion-dollar  stimulus giveaway—porkulus, as some  called it—and you combine that with  $400 billion, $450 billion, $500 billion  that he was able to inherit from the  TARP fund, you think maybe a trillion  and a trillion-and-a-half dollars he had  to give away.  And we hear debate over what difference $1 billion would make. He was  talking about a thousand times that  for infrastructure. And he spent a tiny  fraction on  infrastructure, preferring  instead to have massive grants and  giveaways to programs that were his  cronies, his pets, that are now producing no dividends and in fact are increasing further debt.  So we hear those things, how wonderful infrastructure would be, and yet we  know when we as a Congress provided  this  administration  with  massive  amounts of money for infrastructure,  they diverted it. They did more damage  to the country than they did good. And  we look at the people that this President has surrounded himself with. He  had a Solicitor General named Elena  Kagan. The Solicitor General’s job is to  assist the White House, assist the administration with potential legislation  that may come to  litigation, assist  them with litigation. As I know from  working 30 years ago in the private sector, you can’t advise people about existing litigation and do your job without advising them about the way to  avoid future litigation problems that  you run into.  So we know that the biggest legislative agenda item for this administration was  the  complete  takeover of  health care. And as most thinking people would understand, if you could control all health care, you can pretty  well control all people. You get to decide who gets what treatments, who  can have a new hip, who can have a  new knee, who can have radiation therapy, who can have the surgery. And as  one secretary in my hometown pointed  out, her mother acquired breast cancer  in England, and since the English Government’s wonderful health care system decided how long you had to wait  before you could get to have diagnostic  tests  done,  before  you  could  have  therapeutic activity occur, her mother  didn’t get the diagnostic tests in time  to find out she had it for sure, didn’t  get the surgery in time, didn’t get the  treatment in time and she said, My  mother died of breast cancer because  she lived in England and the government was in charge of health care.  b1440  She said I have been found to have  cancer since I’ve been here in the U.S.,  and because the government was not in  charge of my health care, I got it diagnosed in time. I got treatment in time.  VerDate Mar 15 2010  05:18 Jun 30, 2012 Jkt 019060 PO 00000 Frm 00040 Fmt 4634 Sfmt 0634 E:\CR\FM\A29JN7.055 H29JNPT1 E S U O H h t i w D O R P 1 N V T P T 6 K S D n o z e n i t r a m s         ",2012
405,Senate,112,-0.326,54,2012-06-29,Mr. ROCKEFELLER.," Mr. President, S.  1335, the Pilot’s Bill of Rights, takes  several steps to protect the rights of  pilots, including modifications to the  appeals process, and improvements to  the Federal Aviation Administration’s  Notice to Airman System and medical  certification process.  Most  importantly,  it preserves the  FAA’s authority to take actions to  maintain the safety of the air transportation system, and we want to be clear  about the Congressional intent regarding one particular section of the bill.  Three provisions of the bill eliminate  language in current statute governing  the National Transportation Safety  Board’s (NTSB) adjudication of appeals  of FAA orders that deny, amend, modify, suspend, or revoke an airman’s certificate. Specifically,  language  in 49  U.S.C  §§  44703(d)(2),  44709(d)(3),  and  44710(d)(1), which expressly binds the  NTSB to ‘‘all validly adopted interpretations of laws and regulations the Administrator carries out and of written  agency policy guidance available to the  public related to sanctions to be imposed . . . unless the Board finds an interpretation  to  be  arbitrary,  capricious, or otherwise not according to  law.’’  It is not the intention of the Senate  to eliminate the NTSB’s practice to observe  the principles of  judicial deference to the FAA Administrator when  reviewing airmen appeals. The Senate  only finds that this language is redundant of what is already provided for  under the law and it is not the intent  of the Senate to prevent the NTSB  from applying the principles of judicial  deference in adjudicating Federal Aviation Administration cases.  The purpose of these changes is simply  to make  the  statute consistent  with the laws governing all other Federal agencies. Thus, it is the intention  of the Senate that the NTSB, in reviewing FAA cases, will apply principles of judicial deference to the interpretations of  laws,  regulations, and  policies that the Administrator carries  out in accordance with the Supreme  Court’s ruling in Martin v. OSHRC, 449  U.S. 114 (1991).  ",2012
406,Senate,112,-0.06,61,2012-06-29,Mr. MANCHIN.," Mr. President,  if I  may say I appreciate the leadership of  my good friend from Oklahoma and his  unwavering support in bringing this to  all of our attention. I have been a pilot  for not quite 55 years, but 45 years, and  I  understand  completely.  Senator  INHOFEbrought it to the attention of  all of us, even the nonpilots here. His  steadfast leadership in support of this  action and also his ability to work  across the aisle with those on our side  of the aisle, Democrats, I appreciate so  much.  I know Senator BOXER feels very  compelled about this and the Senator’s  leadership in working with her on the  Transportation bill and both of them  bringing that to the forefront for all of  us. We are all going to benefit from  that.  I thank the Senator and look forward  to continuing to work with him.  ",2012
407,Senate,112,0.409,68,2012-06-29,Mr. GRAHAM., Would  yield?  ,2012
408,Senate,112,-0.42,68,2012-06-29,Mr. BLUMENTHAL.,) The Senator from New  Hampshire is recognized.  ,2012
409,,112,0.505,110,2012-06-29,Mr. ISSA.," Mr. Speaker,  I submit  the  following letters to Ranking Member ELIJAHCUMMINGSregarding H. Res. 711.  VerDate Mar 15 2010  07:23 Jun 30, 2012 Jkt 019060 PO 00000 Frm 00007 Fmt 0626 Sfmt 0634 E:\CR\FM\A29JN8.020 E29JNPT1 S K R A M E R h t i w D O R P 1 N V T P S 6 K S D n o s e m a j t         ",2012
410,,112,0.366,117,2012-06-29,Mrs. ROBY.," Mr. Speaker, I rise today to express my deep disappointment with the recent  United States Supreme Court ruling on June  28, 2012  that upheld  the constitutionality of  the Patient Protection and Affordable Care Act  (PPACA).  The Court’s opinion  is  lengthy and complicated and will require careful evaluation and  review. However, we know that the Court affirmed  the view  that President Obama ’s  law  represents a significant tax on the American  people, and that it is through the federal government’s power to levy taxes that the Court  upheld the law as constitutional.  Mr. Speaker,  the Court’s  legal analysis  is  dubious and cause for concern given the dangerous precedent it sets. Can the government  now require Americans  to purchase government-approved goods and services or else  face the threat of a tax? What we do know,  however, is that the Court put restraint on the  power of Congress to mandate the purchase  of goods and services under the Commerce  Clause of the United States Constitution.  The Court ruled on the legal issues, not the  wisdom of  the policy. The American people  have already weighed in and overwhelmingly  rejected this law. As a whole, the law, which  the nonpartisan Congressional Budget Office  predicts will cost $1.6 trillion and will result in  as many as 20 million Americans losing their  existing health care coverage, remains deeply  unpopular with the public. This is a stark contrast to the President Obama’s repeated promise that, ‘ ‘if you like your health care plan, you  can keep your health care plan.’ ’  The President’s law has also proven to be  ineffective at reducing the cost of health care,  as it is suffocating small businesses with overbearing  regulations and hampering  job creation in a time of economic uncertainty. Recent estimates indicate that the law will actually cost 800,000 American  jobs, not create  400,000  jobs as NANCY claimed  in  2010.  By law, beginning in 2014, employers with  more than 50 employees will be required to  offer health insurance coverage or face financial penalties.  In addition, an employer plan  must cover a specific set of services determined  by  the Department  of Health  and  Human Services  (HHS) and meet actuarial  standards laid out in the law. As a result, employers will be  forced  to choose whether  to  meet  the new  insurance  requirements, pay  noncompliance penalties to the Internal Revenue Service (IRS), or reduce workers’ hours  so  they do not qualify as  full-time.  I have  heard from several small business owners in  my home state of Alabama, and across  the  United States, that will have financial struggles  no matter which decision they chose. How can  a business owner provide health insurance to  his employees if his business is bankrupt?  We can all agree that the Court’s preservation of PPACA’s employer health  insurance  mandate is costly, to both employers and to  their employees. Rising costs will  force employers to consider dropping health coverage  PELOSI VerDate Mar 15 2010  07:23 Jun 30, 2012 Jkt 019060 PO 00000 Frm 00014 Fmt 0626 Sfmt 9920 E:\CR\FM\K29JN8.002 E29JNPT1 S K R A M E R h t i w D O R P 1 N V T P S 6 K S D n o s e m a j t         ",2012
411,,112,0.69,124,2012-06-29,Mr. LAMBORN.," Mr. Speaker, I rise today to  thank  the heroic men and women who are  battling  the Waldo Canyon Fire. 1,200  firefighters  from all over Colorado’s 5th District  and  the nation have been  fighting  this  fire  around the clock since Saturday. They have  been assisted by numerous law enforcement  agencies who have managed an orderly and  injury-free evacuation of 32,500 citizens.  The  cooperation between all  levels and  branches of government has been seamless,  coordinated, cooperative, and effective. One  example is the use of military assets, such as  C–130 MAFFS  firefighting  aircraft.  These  planes have dropped over 73,000 gallons of  slurry on this fire in coordination with the highly skilled firefighting teams on the ground. Additionally, Fort Carson, Peterson Air Force  Base, and Cheyenne Mountain Air Force Station have contributed firefighters, support personnel, and air and ground equipment to assist  in  fighting and containing  the  fire along  Highway 24 and on  the Air Force Academy  grounds.  The community response has been equally  impressive. Shelters,  food banks, and other  charitable  organizations  have  been  overwhelmed by the generous donations of food  and manpower. The Care and Share Food  Bank has received hundreds of thousands of  pounds of food and the Red Cross is doing  extraordinary work at  the shelters  they are  running throughout the District. Many homes  have been lost and much work remains, but I  know  that we have  the people and  the resources we need to win this fight.  f  THE TUAREG REVOLT AND THE  MALI COUP  HON. CHRISTOPHER H. SMITH  OFNEWJERSEY  INTHEHOUSEOFREPRESENTATIVES  Friday, June 29, 2012  ",2012
412,House,112,0.633,5,2012-07-09,Mr. MILLER of Florida.," Mr. Speaker,  I move to suspend the rules and pass  the bill (H.R. 4114) to increase, effective as of December 1, 2012, the rates of  compensation for veterans with service-connected disabilities and the rates  of  dependency  and  indemnity  compensation for the survivors of certain  disabled veterans, and for other purposes.  The Clerk read the title of the bill.  The text of the bill is as follows:  H.R. 4114  Be it enacted by the Senate and House of Representatives of the United States of America in  Congress assembled,  SECTION 1. SHORT TITLE.  This Act may be cited as the ‘‘Veterans’  Compensation  Cost-of-Living  Adjustment  Act of 2012’’.  SEC. 2. INCREASE IN RATES OF DISABILITY COMPENSATION AND DEPENDENCY AND  INDEMNITY COMPENSATION.  (a) RATEADJUSTMENT.—Effective on December 1, 2012, the Secretary of Veterans Affairs shall increase, in accordance with subsection (c), the dollar amounts in effect on  November 30, 2012, for the payment of disability compensation and dependency and indemnity compensation under the provisions  specified in subsection (b).  (b) AMOUNTSTOBEINCREASED.—The dollar  amounts to be increased pursuant to subsection (a) are the following:  (1) WARTIME DISABILITY COMPENSATION.—  Each of the dollar amounts under section  1114 of title 38, United States Code.  (2) ADDITIONALCOMPENSATIONFORDEPENDENTS.—Each of the dollar amounts under section 1115(1) of such title.  (3)  dollar  amount under section 1162 of such title.  ALLOWANCE.—The  CLOTHING (4) DEPENDENCYAND INDEMNITYCOMPENSATIONTOSURVIVINGSPOUSE.—Each of the dollar amounts under subsections (a) through  (d) of section 1311 of such title.  (5) DEPENDENCYAND INDEMNITYCOMPENSACHILDREN.—Each  TION TO of  the  dollar  amounts under sections 1313(a) and 1314 of  such title.  (c) DETERMINATIONOFINCREASE.—  (1) PERCENTAGE.—Except as provided  in  paragraph (2), each dollar amount described  in subsection (b) shall be increased by the  same percentage as the percentage by which  benefit amounts payable under title II of the  Social Security Act (42 U.S.C. 401 et seq.) are  increased effective December 1, 2012, as a result of a determination under section 215(i)  of such Act (42 U.S.C. 415(i)).  (2) ROUNDING.—Each  dollar  amount  increased under paragraph (1), if not a whole  dollar amount, shall be rounded to the next  lower whole dollar amount.  (d) SPECIALRULE.—The Secretary of Veterans Affairs may adjust administratively,  consistent with the  increases made under  subsection (a), the rates of disability compensation payable to persons under section  10 of Public Law 85–857 (72 Stat. 1263) who  have not received compensation under chapter 11 of title 38, United States Code.  SEC. 3. PUBLICATION OF ADJUSTED RATES.  The Secretary of Veterans Affairs shall  publish in the Federal Register the amounts  specified in section 2(b), as increased under  that section, not  later than the date on  which  the matters  specified  in  section  215(i)(2)(D) of the Social Security Act  (42  U.S.C. 415(i)(2)(D)) are required to be published by reason of a determination made  under section 215(i) of such Act during fiscal  year 2013.  ",2012
413,House,112,-0.429,5,2012-07-09,Ms. BROWN of Florida.," Mr. Speaker,  I yield myself such time as I may consume.  I wholeheartedly  support  the Veterans’ Cost-of-Living Adjustment Act  of 2012, H.R. 4114. While this committee  does not control the amount of the  COLA, it is critical that we pass the  bill so that it can be put in place when  the Social Security COLA is enacted. It  is so important that the payments that  our veterans, their families, and survivors receive keep pace with inflation  and better enable them to put food on  the table and a roof over their heads.  Mr. Speaker, I am pleased that last  year’s veterans COLA increase was 3.6  percent for 2012 and that we can likely  expect an increase for 2013. The exact  figure will be tied directly to the Social  Security  COLA,  whose  beneficiaries will also see the same increase  in their payments.  As  it  has  since  1976,  Congress,  through the passage of the Veterans’  Cost-of-Living Adjustment Act, directs  the Secretary of the Department of  Veterans Affairs to increase the rates  of basic compensation for disabled veterans and the rates of dependency and  indemnity compensation to their survivors and dependents. This bill will  benefit disabled veterans, their families, and their survivors from the World  War I era through the current conflict  in Iraq and Afghanistan.  Many of the over 3.5 million veterans  who  receive disability  compensation  benefits depend on these payments not  only to provide for their basic needs,  but for those of their spouses, children,  and parents as well. Without an annual  COLA increase, these veterans, their  families, and survivors will likely see  the value of their hard-earned benefits  slowly eroding.  Mr. Speaker, I think we would be derelict in our duties if we fail to guarantee that those who sacrifice so much  for this country are able to receive  benefits and service that keep pace  with their needs and inflation.  b1620  We fund the wars; let’s fund the warriors. Let me repeat: we fund the wars;  let’s fund the warriors.  I urge my colleagues to support the  Veterans’ Compensation Cost-of-Living  Adjustment Act of 2012, H.R. 4114, without delay.  I reserve the balance of my time.  ",2012
