,branch,congressID,ideology_score,page,part,speaker,speech,year
193,House,109,0.453,24,2005-05-26,Mr. MICA.," Mr. Chairman, I move to  strike the last word.  Mr. Chairman, I would like to enter  into a colloquy with the chairman of  the Subcommittee on Military Quality  of Life and Veterans Affairs of the  Committee on Appropriations.  First of all, I want to take a moment  to commend the gentleman from New  York (Mr. WALSH) and the committee  for bringing  this  important pending  bill  to  the  floor and providing  resources to our military and those who  serve in our military. I thank him for  his  leadership  in  the United States  House of Representatives and for his  service to our Nation.  I had intended to offer an amendment  to add $1.3 million to the Army National Guard construction account in  order to complete the design of a joint  National Guard Reserve Center in Daytona  Beach,  Florida.  Last  year,  through the good work of this appropriations  subcommittee,  the  Subcommittee on Military Construction  appropriated $789,000 in fiscal year 2005  funding to begin the design, and that  funding is now being depleted.  Mr. Chairman,  this project  is  the  Florida National Guard’s number one  priority in the 2012 to 2013, 5-year plan  and will be included in the President’s  budget for the 2007 budget.  I am concerned that possibly cutting  the funding or not providing the funding for this project now may negatively  impact on the Florida National Guard’s  ability to move forward with this important project that is now some nearly 8 years behind schedule.  I would ask the gentleman from New  York whether he can commit to working with me during the conference on  this bill to ensure that funding or adequate attention and language is in the  final bill.  ",2005
194,House,109,-0.232,24,2005-05-26,Mr. CHANDLER.," Mr. Chairman,  I  move to strike the last word for the  purpose of entering  into a colloquy  with the gentleman  from New York  (Chairman WALSH).  Mr. Chairman, I would like to enter  into a colloquy to discuss a funding  matter  concerning  the  Assembled  Chemical Weapons Alternatives program.  I rise today, Mr. Chairman, to bring  attention to a significant funding problem that, if it is not solved, could halt  the destruction of dangerous chemical  weapons stockpiles in Richmond, Kentucky and Pueblo, Colorado.  Within the last 2 months, there have  been significant changes in the status  of what is known as the ACWA program which manages the Blue Grass  Ammunition Demilitarization Facility  at the Blue Grass Army Depot in Kentucky and at  the Pueblo Chemical  Depot in Pueblo, Colorado.  VerDate jul 14 2003  01:36 May 27, 2005 Jkt 039060 PO 00000 Frm 00024 Fmt 7634 Sfmt 0634 E:\CR\FM\A26MY7.006 H26PT1 ",2005
195,,109,-0.652,38,2005-05-26,Mr. FILNER.," Mr. Chairman, on rollcall No.  224, on the Melancon Amendment, I was in  my Congressional District on official business.  Had I been present, I would have voted ‘‘aye.’’ AMENDMENTNO. 2OFFEREDBYMR.  BLUMENAUER  The CHAIRMAN. The pending business is the demand for a recorded vote  on amendment No. 2 offered by the gentleman from Oregon (Mr. BLUMENAUER)  on which  further  proceedings were  postponed and on which the noes prevailed by voice vote.  The  Clerk  will  amendment.  The Clerk redesignated the amendment.  redesignate  the  RECORDEDVOTE  The CHAIRMAN. A recorded vote has  been demanded.  A recorded vote was ordered.  The CHAIRMAN. This will be a 5minute vote.  The vote was taken by electronic device, and there were—ayes 171, noes 254,  not voting 8, as follows: [Roll No. 225]  AYES—171 Abercrombie  Ackerman  Allen  Andrews  Baca  Baird  Baldwin  Barrow  Bean  Beauprez  Becerra  Berkley  Berman  Bishop (NY)  Blumenauer  Boswell  Brady (PA)  Brown (OH)  Brown, Corrine  Butterfield  Capps  Capuano  Cardin  Cardoza  Carnahan  Carson  Case  Chandler  Clay  Cleaver  Clyburn  Conyers  Costa  Costello  Crowley  Cummings  Davis (IL)  Davis, Jo Ann  DeFazio  DeGette  Delahunt  DeLauro  Dingell  Doggett  Edwards  Ehlers  Emanuel  Engel  Eshoo  Etheridge  Evans  Farr  Fattah  Ford  Gingrey  Gonzalez  Gordon  Green, Al  Aderholt  Akin  Alexander  Bachus  Baker  Barrett (SC)  Bartlett (MD)  Barton (TX)  Bass  Berry  Biggert  Bilirakis  Bishop (GA)  Bishop (UT)  Blackburn  Blunt  Boehlert  Boehner  Bonilla  Bonner  Bono  Boozman  Boren  Boucher  Grijalva  Gutierrez  Hall  Harman  Hastings (FL)  Higgins  Hinchey  Hinojosa  Holt  Honda  Hooley  Inslee  Israel  Jackson (IL)  Jackson-Lee  (TX)  Jefferson  Johnson (IL)  Jones (OH)  Kaptur  Kildee  Kilpatrick (MI)  Kind  Kucinich  Langevin  Lantos  Larson (CT)  Lee  Lewis (GA)  Lipinski  Lofgren, Zoe  Lowey  Lynch  Maloney  Manzullo  Markey  Matheson  Matsui  McCarthy  McCollum (MN)  McDermott  McGovern  McKinney  McNulty  Meehan  Meek (FL)  Meeks (NY)  Melancon  Miller (NC)  Miller, Gary  Miller, George  Moore (KS)  Moore (WI)  Moran (VA)  Nadler  Napolitano  Neal (MA)  Oberstar  NOES—254 Boustany  Boyd  Bradley (NH)  Brady (TX)  Brown (SC)  Brown-Waite,  Ginny  Burgess  Burton (IN)  Buyer  Calvert  Camp  Cannon  Cantor  Capito  Carter  Castle  Chabot  Chocola  Coble  Cole (OK)  Conaway  Cooper  Cramer  Obey  Olver  Owens  Pallone  Pascrell  Paul  Payne  Pelosi  Price (NC)  Rahall  Rangel  Rothman  Roybal-Allard  Ruppersberger  Rush  Ryan (OH)  Sabo  Salazar  Sa´nchez, Linda  T.  Sanchez, Loretta  Sanders  Schakowsky  Schiff  Schwartz (PA)  Scott (GA)  Serrano  Simmons  Slaughter  Smith (WA)  Sodrel  Solis  Stark  Strickland  Stupak  Tauscher  Taylor (MS)  Thompson (CA)  Thompson (MS)  Tierney  Towns  Udall (CO)  Udall (NM)  Van Hollen  Vela´zquez  Walden (OR)  Wasserman  Schultz  Waters  Watson  Watt  Waxman  Weiner  Wexler  Wilson (NM)  Woolsey  Wu  Wynn  Crenshaw  Cubin  Cuellar  Culberson  Cunningham  Davis (AL)  Davis (CA)  Davis (FL)  Davis (KY)  Davis (TN)  Davis, Tom  Deal (GA)  DeLay  Dent  Diaz-Balart, L.  Diaz-Balart, M.  Dicks  Doolittle  Drake  Dreier  Duncan  English (PA)  Everett  Feeney  VerDate jul 14 2003  04:53 May 27, 2005 Jkt 039060 PO 00000 Frm 00038 Fmt 7634 Sfmt 0634 E:\CR\FM\A26MY7.031 H26PT1 ",2005
196,House,109,0.644,45,2005-05-26,Mr. PRICE of Georgia.," Mr. Speaker, I  ask unanimous consent that the business  in  order  under  the  Calendar  Wednesday rule be dispensed with on  Wednesday, June 8, 2005.  ",2005
197,House,109,-0.348,45,2005-05-26,Mr. SCHIFF.," Mr. Speaker, along with  the gentleman  from North Carolina  (Mr. COBLE), chairman of the Judiciary  Committee’s Subcommittee on Crime,  Terrorism, and Homeland Security, I  am pleased to introduce the Reducing  Crime and Terrorism at America’s Seaports Act of 2005.  There are 361 seaports in the United  States that serve essential national interests by facilitating the flow of trade  and the movement of cruise passengers,  as well as supporting the effective and  safe deployment of U.S. Armed Forces.  These seaport facilities and other marine  areas  cover  some  3.5 million  square miles of ocean area and 95,000  miles of coastline.  Millions of shipping containers pass  through our ports every month. A single container has room for as much as  60,000 pounds of explosives, 10 to 15  times the amount in the Ryder truck  used to blow up the Murrah Federal  Building in Oklahoma City. When you  consider that a single ship can carry as  many as 8,000 containers at one time,  the vulnerability of our  seaports  is  alarming.  Each year, more  than  141 million  ferry and cruise ship passengers, more  than 2 billion tons of domestic and  international freight and 3 billion tons  of oil move through U.S. seaports. Millions of truck-size cargo containers are  off-loaded onto U.S. docks. Many seaports are still protected by little more  than a chain link fence and, in far too  many instances, have no adequate safeguards to ensure that only authorized  personnel can access sensitive areas of  the port. If we allow this system to  continue unchecked, it is only a matter  of time until terrorists attempt to deliver a weapon of mass destruction to  our doorstep via ship, truck or cargo  container.  New reports by the Government Accountability Office, Congress’  investigative arm, fault both the CustomsTrade Partnership Against Terrorism  and the Container Security Initiative.  C-TPAT allows international shippers  to get quicker clearance through Customs in exchange for voluntary security measures. But the GAO said that  the U.S. Customs and Border Protection’s vetting process was not thorough  enough. It found that only 10 percent of  the certified members had been validated through an actual physical inspection by the Agency. The rest had  been certified by paperwork applications.  As part of the recently passed Homeland Security authorization bill, the  House took some important steps to  improve the screening of cargo by expanding the Container Security Initiative and refocusing it, based on risk.  But the truth is that not every container can be inspected, and we need to  use other tools at our disposal to deter  those who would use our seaports as a  point of attack until we can inspect or  somehow  verify  each  container.  Strengthening criminal penalties, as  Chairman COBLE and I are proposing  with this bill, is one way we make our  Nation’s ports less vulnerable.  The Reducing Crime and Terrorism  at America’s Seaports Act of 2005 will  fill a gaping hole in our defense against  terrorism and make American ports,  passengers and cargo safer. Our bill is  substantially  similar  to  bipartisan  Senate  legislation  introduced earlier  this year by Senators BIDENand SPECTERand supported by other key members of the Judiciary Committee, including Senators DIANNEFEINSTEINand  ORRINHATCH. The Senate version of  this legislation has been reported favorably by the Senate Judiciary Committee and is awaiting action by the  full Senate.  Our  bill  makes  common-sense  changes to our criminal laws and will  help to close security gaps confronting  our ports. The amendment will make it  a crime to use a vessel to smuggle terrorists or dangerous materials, including nuclear material, into the U.S., impose stiff criminal penalties for providing false information to a Federal  law enforcement officer at a port or on  a vessel, and double the sentence of  anyone who fraudulently gains access  to a seaport.  Our bill would also directly access  several immediate threats by increasing penalties for smugglers who misrepresent illicit cargo. It would also  bridge specific gaps in current Federal  law by making it a crime for a vessel  operator to fail to stop when ordered to  VerDate jul 14 2003  01:56 May 27, 2005 Jkt 039060 PO 00000 Frm 00045 Fmt 7634 Sfmt 0634 E:\CR\FM\K26MY7.102 H26PT1 ",2005
198,Senate,109,0.429,80,2005-05-26,Mr. GREGG.," Mr. President, I wish to  join my colleague from Oklahoma and  other colleagues who have risen today  to  support  the nomination of John  Bolton to be our U.N. ambassador.  The United Nations is a unique institution, obviously. It is an institution  which has gone through its good times  and some bad times. Many of us, on our  side of the aisle especially, have been  critical of the United Nations over the  years for different activities, whether  they have been policy driven or,  in  some cases, just the operations aspects  of the United Nations. But I think, at  least for my part, I agree that it is an  extremely important institution, that  it represents an attempt by the community of nations across the world to  find a forum where they can interact  and,  hopefully,  reach  conclusions  which are  constructive  to mankind  generally and especially address issues  which cannot and should not be addressed by nation states individually,  such as issues involving large expansions of disease, issues involving the  treatment  of  children  around  the  world, issues involving the questions of  war.  It  is  important we have a  forum  where nations can come together and  try to work together and, if they disagree, at least have the disagreements  be more transparent and, therefore, the  ability,  hopefully,  to  reach  agreements, and at least have the capacity  to temper those disagreements, which  is more probable of occurring as a result of transparency.  VerDate Mar 15 2010  21:24 Jan 30, 2014 Jkt 081600 PO 00000 Frm 00010 Fmt 0624 Sfmt 0634 E:€5SENATE\S26MY5.REC S26MY5 Y T I R U C E S L I A C O S h t i w 1 G 4 P S G C K S D n o r e h a m m         ",2005
199,Senate,109,-0.383,94,2005-05-26,Mr. REED.," Mr. President, I rise to  speak in opposition to the nomination  of John Bolton to be ambassador to the  United Nations.  There are two issues at stake. First  is an issue of whether this Senate will  receive critical information so that we  can  deliberate  carefully  and  thoroughly about Mr. Bolton’s nomination.  So far, the State Department, as my  colleagues, Senators DODDand BIDEN,  pointed out, failed to provide information under the theory that they get to  decide what we should know when we  are casting a vote as important as ambassador to the United Nations. It is a  novel theory, but it holds no water. If  we allow this to go on, it will make the  Senate  irrelevant when  it comes to  major decisions about nominations and  major decisions about the future policy  of the country.  The second issue is the qualifications  of Mr. Bolton to be ambassador to the  United Nations. For me, this is not a  particularly hard vote. I opposed Mr.  Bolton’s nomination to be Assistant  Secretary for Arms Control. That was  based upon my review of his record, his  statements, and his commitment  to  arms control and counterproliferation.  Frankly, I think over the last several  years—the record is mixed, but in large  part it suggests that his duties there  certainly don’t warrant a promotion to  be ambassador to the U.N.  He was instrumental in establishing  the Proliferation Security Initiative,  which  is a potentially useful  framework, but as CRS pointed out:  VerDate Mar 15 2010  21:24 Jan 30, 2014 Jkt 081600 PO 00000 Frm 00024 Fmt 0624 Sfmt 0634 E:€5SENATE\S26MY5.REC S26MY5 Y T I R U C E S L I A C O S h t i w 1 G 4 P S G C K S D n o r e h a m m         ",2005
200,Senate,109,-0.352,108,2005-05-26,Mr. KERRY.," Mr. President,  I ask  unanimous consent that the order for  the quorum call be rescinded.  The  PRESIDING  OFFICER  (Mr.  CHAFEE). Without objection, it is so ordered.  ",2005
201,Senate,109,0.409,108,2005-05-26,Mr. GRAHAM.," Mr. President, I ask  unanimous consent that the order for  the quorum call be rescinded.  ",2005
202,Senate,109,0.409,143,2005-05-26,Mr. THUNE.," Mr. President, today I  rise to congratulate two outstanding  men  from South Dakota, Staff Sergeant Eric Borah of New Underwood  and Sergeant Daniel Iverson of Madison. Both men have been honored this  year for their unwavering dedication to  our country.  Eric, a Wheeled Vehicle Mechanic in  the South Dakota Army Guard’s 235th  Military Police Company from Custer,  has been named Non-Commissioned Officer of the Year.  Daniel, an Army Bandsman with the  South Dakota Army Guard’s  147th  Army Band from Mitchell, was named  Soldier of the year.  Eric and Daniel will be recognized in  Washington, DC  two  of  the  Outstanding Soldiers and Airmen of the  Year for the National Guard. It is with  great pleasure that I offer my congratulations to these two men not only  for their admirable achievements but  also for the great name that they bring  to the State of South Dakota.∑  H.R. 2566. An act to provide an extension of  highway, highway safety, motor carrier safety, transit, and other programs funded out of  the Highway Trust Fund pending enactment  of a law reauthorizing the Transportation  Equity Act for the 21st Century.  f  HONORING  THE  ACCOMPLISHMENTS OF MR. MATTH TOEBBEN  ∑",2005
203,Senate,109,0.521,143,2005-05-26,Mr. BUNNING.," Mr. President, I pay  tribute and congratulate Mr. Matth  Toebben of Northern Kentucky, who  was recently honored with one of the  ‘‘Movers and Shakers’’ awards for the  Greater Cincinnati area. Mr. Toebben’s  life accomplishments and dedication to  Commonwealth  of  Kentucky  have  given me reason to be proud.  I believe Mr. Toebben to be the embodiment  of  the American Dream.  After immigrating to the United States  from Borger, Germany  in  1953 with  only $10 to his name, he used all of his  money to buy a train ticket to Cincinnati. Upon arrival in the area, Mr.  Toebben took up not only one job, but  two jobs as a carpenter for a Ft. Wright  home builder  in Northern Kentucky.  He worked both night and day saving  as much money as he  could. This  quickly paid off and by 1955, only 2  years after his arrival to the United  States, Mr. Toebben started his own  business, Toebben Builders and Developers.  The ‘‘Movers and Shakers’’ award of  Northern Kentucky is an annual award  presented to honor those within the  Greater Cincinnati region who stand as  an example for all. It is presented by  the Kentucky Enquirer, the Sales and  Marketing Council of Northern Kentucky, The Home Builders Association  of Northern Kentucky and The Kentucky Post.  As a Senator from Kentucky, I commend Mr. Toebben for his hard work  and dedication.  I hope that he will  serve as an inspiration to the citizens  of Kentucky.∑  f  MESSAGES FROM THE PRESIDENT  Messages from the President of the  United States were communicated to  the Senate by Mr. Williams, one of his  secretaries.  f  EXECUTIVE MESSAGES REFERRED  As in executive session the Presiding  Officer laid before the Senate messages  from  the President  of  the United  States submitting sundry nominations  which were referred to the appropriate  committees.  (The nominations received today are  printed at the end of the Senate proceedings.)  f  MESSAGES FROM THE HOUSE  At 9:34 a.m., a message  from the  House of Representatives, delivered by  Ms. Niland, one of its reading clerks,  announced that the House has passed  the following bill, in which it requests  the concurrence of the Senate:  At 4:16 p.m., a message  from the  House of Representatives, delivered by  Mr. Hays, one of its reading clerks, announced that the House has agreed to  the following concurrent resolution, in  which it requests the concurrence of  the Senate:  H. Con. Res. 167. Concurrent resolution  providing for a conditional adjournment of  the House of Representatives and a conditional recess or adjournment of the Senate.  At 5:27 p.m., a message  from the  House of Representatives, delivered by  Mr. Hays, one of its reading clerks, announced that the House has passed the  following bills, in which it requests the  concurrence of the Senate:  H.R.  810. An act  to amend  the Public  Health Service Act to provide for human embryonic stem cell research.  H.R. 2520. An act to provide for the collection and maintenance of human cord blood  stem cells for the treatment of patients and  research, and to amend the Public Health  Service Act to authorize the C.W. Bill Young  Cell Transplantation Program.  H.R. 2528. An act making appropriations  for military quality of life functions of the  Department of Defense, military construction, the Department of Veterans Affairs,  and related agencies for the fiscal year ending September 30, 2006, and for other purposes.  f  ENROLLED BILL SIGNED  The message also announced that the  Speaker of the House of Representatives has signed the following enrolled  bill:  H.R. 2566. An act to provide an extension of  highway, highway safety, motor carrier safety, transit, and other programs funded out of  the Highway Trust Fund pending enactment  of a law reauthorizing the Transportation  Equity Act for the 21st Century.  The enrolled bill was signed subsequently by the President pro tempore  (Mr. STEVENS).  At 7:00 p.m., a message  from the  House of Representatives, delivered by  Ms. Niland, one of its reading clerks,  announced that the House disagrees to  the amendment of the Senate to the  bill (H. R. 3) to authorize funds for Federal-aid highways, highway safety programs, and transit programs, and for  other purposes, and asks  for a conference with the Senate on the disagreeing votes of the two Houses thereon; and appoints the following members as the managers of the conference  on the part of the House: From the  Committee on Transportation and Infrastructure, for consideration of the  House bill (except title X), and the Senate amendment (except title V), and  modifications  committed  to  conference: Messrs. YOUNG of Alaska,  PETRI,  BOEHLERT,  COBLE,  DUNCAN,  MICA, HOEKSTRA, LATOURETTE, BACHUS,  BAKER, GARYC. MILLERof California,  VerDate Mar 15 2010  21:24 Jan 30, 2014 Jkt 081600 PO 00000 Frm 00073 Fmt 0624 Sfmt 0634 E:€5SENATE\S26MY5.REC S26MY5 Y T I R U C E S L I A C O S h t i w 1 G 4 P S G C K S D n o r e h a m m         ",2005
204,Senate,109,0.091,178,2005-05-26,Ms. SNOWE.," Mr. President,  I rise  today to offer my cosponsorship to the  Acadia National Park  Improvement  Act of 2005. For those of you who have  not had the good fortune to visit one of  the crown jewels in the National Park  system, Acadia National Park, the first  national park established east of the  VerDate Mar 15 2010  21:24 Jan 30, 2014 Jkt 081600 PO 00000 Frm 00108 Fmt 0624 Sfmt 0634 E:€5SENATE\S26MY5.REC S26MY5 Y T I R U C E S L I A C O S h t i w 1 G 4 P S G C K S D n o r e h a m m         ",2005
