,branch,congressID,ideology_score,page,part,speaker,speech,year
107,,101,0.378,1103,1,Mr. LAGOMARSINO.," Mr. Speaker, during a  recent speech at Time Magazine's ""Man of  the Year"" dinner,  former President Richard  Nixon analyzed the real Mikhail Gorbachev his goals, his power, his weaknesses and his  challenges. The historic events of  the past  year are  incredible and Mr. Gorbachev has  played a major role in their continued unfold ing. Unfortunately, some  in  the West have  become  carried  away with  ""Gorby-mania""  and, to borrow President Nixon's analogy, are  thinking  too much with  their hearts and not  their heads. These are time of great hope, but  they are also  times with difficult challenges  demanding strong,  level headed  leadership  and policy.  I strongly suggest that my colleagues care fully study President Nixon's very  insightful  analysis. After examining his comments, I be lieve others will agree with me that President  Nixon's points are very much on the mark and  worth  incorporating  into  our  thinking  and  policy for the new decade.  [From the Washington Times, Jan. 31,  Documentation was not difficult to come  by; more  than 50 desecrations of Jewish  cemeteries, some 1,000 anti-Semitic rallies,  and vitriolic hate leaflets in the thousands  distributed everywhere. Moreover, some 60  goons from Pamyat, a chauvinist Russian  national movement, greeted the delegates  with cries of ""Yid!"" and ""Jewish prostitute!""  Beyond  these  hate-spewing  vulgarities,  and reinforcing  them,  is  the defense and  promotion  of  Pamyat  and  anti-Jewish  stereotypes by prominent and conservative  nationalist publications.  Then, too, there are newly formed patriot ic and religious organizations that would os tracize the Jew as ""alien"" and ""cosmopoli tan"" <a resurrected Stalinist era code word  meaning ""traitor""), and populist novelists  fill their books and essays with flagrant ap peals to bigotry.  Only the Young Communist League news paper has carried as Cassandralike warning.  Written by  the Lithuanian Jewish writer  Grigory Kanovich, a member of the Con gress of People's Deputies, the article de scribed ""clouds of pogroms  . . . gathering  over our heads."" He expressed dismay that  ""as this incitement to murder takes place  before  the eyes of  all,""  the authorities  ""ignore the thugs and inciters.""  From President Mikhail Gorbachev not a  single word has come-no  repudiation of  Pamyat or of omni-present Jew-baiting. Last  year, when Mr. Kanovich,  joined by  two  members of the Academy of Sciences, Vitaly  Ginzburg and Oleg Gazenko, submitted to  the presidium of the Congress of People's  Deputies a petition calling for a condemnation of anti-Semitism, and for creating a  special committee to follow up on the issue,  the petition was buried.  Even though the petition was signed by  Since  this  is Time's Man of  the Year  more than 200 deputies, and Mr. Kanovich  dinner, I would like to share with you my  is reported to have conferred briefly with  evaluation of Time's Man of the Decade Mr. Gorbachev on three occasions, urging Mikhail Gorbachev.  him to make the appeal known to the ConBecause my views differ  in several  re gress, not only was it not brought before the  spects  from  the conventional wisdom  re Congress, it was stricken from the list of pefleeted  in Time's excellent cover story,  I  titians submitted to the presidium.  would first like to indicate the areas where  It is not that Soviet prosecutors are unwe agree.  aware of Pamyat's provocations. In one inGorbachev is the most enlightened Rus stance, Pamyat's chief was summoned by  sian leader of this century and possibly in  Russian history. He  is  the best-educated  the K.G.B. and warned against stirring up  Soviet leader since Lenin. he earned a bach""national hatred."" In another, the Leninelor's degree  in law. He was born with a  grad city public prosecutor  said he had masters' degree in public relations.  brought an end to Pamyat's numerous ralHe is by far the most popular leader in  lies in one of the public parks because they  Europe, and among America's elite intellec violated the Soviet Constitution. Yet no artuals, those with postgraduate training, he  rests have been forthcoming anywhere and  is even more popular than George Bush Pamyat's  provocations  remain  undiminone of America's most popular presidents.  ished.  Let me now turn to areas where I do not  The absence of any official public denunshare  the conventional Beltway wisdom.  elation is especially disturbing. When antiOne  highly  respected major  publication  Jewish pogroms seemed to loom on the horitells us that Gorbachev's goal for the Soviet  zon in 1918, Lenin, the founder of the Soviet  Union  is ""an economically and politically  state, personally drafted the language in a  liberal  regime without any expansionism  decree requiring that ""pogromists and perambitions."" You might reach that conclu sons  inciting  to  pogroms  be  outlawed.""  sion from some of the things he has said  Later, in a historic address broadcast to the  and done. But we should always bear in  Russian people, Lenin cried:  ""Shame on mind three hard facts in appraising his acthose who foment hatred toward the Jews.""  tions.  President Gorbachev, glasnost's great adGorbachev is a true-believing communist.  His goal is not to abandon communism, but  vocate,  has  repeatedly  insisted  that he  to save it.  draws his inspiration from Lenin. He could  He is a proud Russian nationalist with the  take a leaf from his mentor's book by now  same goals  for his country  that Russian  forcefully expressing humane concern. It  leaders have had for centuries before Lenin.  could even prove helpful to his program of  He is a brilliant, pragmatic political leader  perestroika. Certainly, he must be aware  who likes power, knows how to use it and  that his enemies on the right have no hesiwill do what is necessary to keep it.  tancy in exploiting anti-Semitism in their  With these facts in mind, let us examine  attempts to turn back the clock.  what he has done. His political  reforms,  BY WHAT HONORIFIC IN THE YEAR 2000?  <By Richard Nixon>  1990]  ",1990
108,Senate,101,0.056,1155,1,Mr. HATFIELD.," I thank the Chair.  Mr. President, I suggest the absence  of a quorum.  ",1990
109,Senate,101,-0.205,1155,1,Mr. LIEBERMAN.," Mr. President, I  ask unanimous consent that the order  for the quorum call be rescinded.  ",1990
110,Senate,101,0.346,1168,1,Mr. MURKOWSKI.," Mr. President,  recycling,  alternate  el).ergy  sources,  off-shore drilling, and global warming  are all issues certain to be echoing in  the Halls of Congress well  into  the  next century. As our constituents turn  to us for guidance, we must be pre pared to provide leadership as well as  adequate answers to their questions.  One such answer lies in our Nation's  youth. It we can develop a nation of  energy-literate students we  are one  step closer to a citizenry of informed  adults.  I  rise  today,  along with  a  number of my colleagues, to assist in  this energy education effert by intro ducing a joint resolution to designate  March 23,  1990 as National Energy  Education Day.  Congress  launched NEED  in 1980.  Since then, the project has grown to  include 38 State committees and over  150 regional committees. This year be tween 8,000 and 10,000 schools are ex pected to culminate weeks and months  of prior planning and research  in a  celebration of NEED's 10th anniversa ry. Based on the theory that students  retain more knowledge when actively  engaged, NEED incorporates coopera tive  learning and  the most current  educational research into a year-round  study of energy  topics.  In addition,  students use NEED as a vehicle  to  heighten their community's awareness  of many complex energy issues.  I urge may colleagues to cosponsor  this joint resolution, not as simply an other commemorative day but as an  opportunity to allow students, educa tors and community  leaders  to cele brate  the national  energy network  that the National Energy Education  Development Project has become.e  By Mr. CHAFEE  (for himself,  Mr. BAUCUS, Mr. BRADLEY, and  Mr. WILSON):  S.J. Res. 250. Joint resolution desig nating April 1990 as ""National Recy cling Month"";  to  the Committee on  the Judiciary.  NATIONAL RECYCLING MONTH  ",1990
111,House,101,-0.023,1181,1,Mr. CONTE.," Mr.  Speaker,  one  Member  after another got up  last  week to bash the President's budget.  The noted budget philosopher and  social critic Mr. Russo let us know in  his immortal words that it ""stinks and  lies."" The powerful chairman of the  House Budget Committee said Presi dent Bush is ""playing games with the  budget."" A thoughtful Member from  Kansas  told us  that  the President  wanted to kill Tiny Tim.  The critics say this budget's spend ing priorities are wrong. They say it's  full of smoke and mirrors. And they  say if they were in charge, that would  all change. We'd get us the cleanest,  tightest,  deficit  reducingest  budget  we've ever seen.  Well, last fall they were in charge.  And what did we get? Last November's  reconciliation bill-a scandalous meas ure  full  of  sham  savings,  special  favors, one-time revenues and mystery  amendments nobody ever saw or ex amined. Moving agriculture deficiency  payments  from  fiscal  year 1990  to  fiscal year 1989. Delaying Medicare  payments for 2 days to claim a half  billion dollar savings. Shifting the post  office  off-budget,  for  $1.7  billion.  Those clouds of  smoke and  jagged  chunks of mirror made up a quarter of  the savings.  That was the best part of it.  The worst was sequestration. And  the Budget Committee-the home of  the  loudest  bashers  of  this  year's  budget-stood by and let  it happen.  Committees  that  failed or even  re fused to meet their savings targets like Merchant Marine and Fisheries  with the Coast Guard user fee-got off  scot free, and committees which met  their targets got hit with a sequester.  Maternal and child health care,  re search on cancer, student aid-they all  got hit. That bill was a shame and a  scandal on the whole Congress.  Now, this year's budget isn't perfect.  No one expects it to be perfect-it's  the first step in a year-long process.  We all have an interest, and we all  want to change it in our own way.  That's fine. But nobody's going to  get anything done by standing here at tacking the President of the United  States and pretending the Ways and  Means Committee or the Budget Com mittee is as pure as driven snow.  Let's cut the nonsense, get off the  soapbox and get to work.  MAKING SENSE OF NON-PROFIT  AND VOLUNTEER LIABILITY  <Mr. PORTER asked and was given  permission to address the House for 1  minute and to revise and extend his  remarks.)  ",1990
112,House,101,0.372,1181,1,Mr. MICHEL.," Mr. Speaker, the fol lowing  is  the  text of  the en bloc  amendment to H.R. 2190, the National  Voter Registration Act of 1989, to be  considered on Tuesday, February 6.  AMENDMENTS TO H.R. 2190 OFFERED BY MR.  MICHEL OF ILLINOIS OR Hrs DESIGNEE  <Note:  Section  references  are  to  the  amendment in the nature of a substitute  printed in the report of the Committee on  Rules, H.Rept. 101-396)  In section 102, strike out ""In addition""  and all that follows through ""this Act."" and  insert in lieu thereof the following: ""In ad dition to any other voter registration proce dure provided for by law, each covered State  may provide  for voter registration proce dures for elections for Federal office in ac cordance with this Act.''.  In the  first sentence of section 103(a),  strike out ""shall"" and insert in lieu thereof  ""may"".  In section 104(a), strike out ""shall"" and  insert in lieu thereof ""may""'.  the first sentence oi section 105(a),  In  strike out ""shall"" and insert in lieu thereof  ""may"".  In the second sentence of section 105(a) (1) insert after ""available,"" the following:  ""to the extent practicable,""; and  <2> strike out ""shall"" each place it appears  and insert in lieu thereof ""may"".  In the third sentence of section 105(a),  strike out ""shall"" and insert in lieu thereof  ""may"".  In section 105(b), strike out ""shall"" each  place it appears and insert in lieu thereof  ""may"".  In section 107(2), strike out ""may"" and  insert in lieu thereof ""shall"".  Strike out section 113 and insert in lieu  thereof the following:  SEC.  113. VOTER REGISTRATION ENHANCEMENT  BLOCK GRANTS.  (a) AUTHORIZATION OF APPROPRIATIONS. There are authorized to be appropriated to  the  Federal  Election  Commission  for  making grants under this section for fiscal  years  1991,  1992,  and  1993,  a  total  of  $120,000,000. There are authorized to be ap propriated such sums as may be necessary  for administative expenses of the Federal  Election Commission  in carrying out this  Act.  ",1990
113,House,101,-0.172,1194,1,Mr. SKELTON., I yield to the gentle man from Mississippi.  ,1990
114,House,101,0.017,1194,1,Mr. MONTGOMERY.," Mr. Speaker,  the gentleman is right. We did learn  from Grenada, and I hope that we will  take what took place in Panama and  use it to improve further future oper ations, which we hope we will never  have again.  However, talking to our troops who  participated down  there,  the airmen  and especially the Army type, active  duty types, as well as some National  Guardsmen and Reservists,  they are  volunteers. I used to be very strong in  that I  thought that we needed the  draft, and go back to selective service;  but these were volunteers. They knew  what they were getting into.  I guess what I am saying is, the all volunteer service, as far as I am con cerned is working well.  ",1990
115,,101,0.176,1207,1,Mr. CLINGER.," Mr. Speaker, I rise today to  officially inform my colleagues of the recent  weather decision of the only true forecaster in  ",1990
116,House,101,0.253,1233,1,Mr. HAMMERSCHMIDT.,"  Speaker, I demand a second.  ",1990
117,House,101,-0.308,1233,1,Mr. PEASE.," Mr. Speaker,  I  first  would like to thank Chairman ANDER SON  for his expeditious handling of  this bill. Plans are afoot to allow the  American-Soviet Youth Orchestra to  perform on the Capitol Grounds. A lot  of preliminary work, preparatory work  has to be undertaken. It is very impor tant that we get  this permission as  soon as possible.  Chairman ANDERSON has been very,  very helpful in moving this bill for ward.  As has been said by other speakers,  the American-Soviet Youth Orchestra  is sponsored by the Conservatory of  Music at Oberlin College, which is in  my district, and by the Moscow Con servatory of Music and the Soviet Min istry of Culture.  Its mission is  to help young musi cians and  their  audiences  to  learn  from each other and to live together  in  the same spirit of harmony that  their music engenders.  First Lady Barbara Bush  is  the  American honorary chairperson of the  orchestra,  as  you have heard,  and  Raisa Gorbachev  is  the  honorary  Soviet chairperson.  Mr. Speaker, this is the second year  that the finest young musicians from  both the United States and the Soviet  Union will be selected for the orches tra, which will make concert tours in  both countries.  This year in the United States, for  example, they will be playing here in  Washington and in my hometown of  Oberlin, also at Epcot Center and at  the Hollywood Bowl.  In many communities where  they  perform, the musicians join with the  local educational and other  institu tions to give chamber ensembles and  master classes.  The effort is intended to reach and  influence  a  grass-roots  constituency  and  to  familiarize  people  through  music with language, the customs and  political systems of another country.  D 1330  The orchestra does need the permis sion of Congress to perform on the left  lawn.  This  concurrent  resolution  simply provides that permission, and  does not have funding as an objective.  Again, Mr. Speaker, I would like to  thank the gentleman from California  [Mr. ANDERSON] and his committee for  their expeditious  treatment of  this  resolution. I  just want to say that I  think  this  is a  small but important  step toward increasing understanding  between  the United States and  the  Soviet Union. As we all know, there  ",1990
118,House,101,0.371,1246,1,Mr. THOMAS of California.," Mr.  Chairman, I yield myself 6 minutes.  Mr. Chairman, let me rise in support  of a piece of legislation which is less  than its critics have claimed it to be,  and, frankly, more than some of its  supporters believe it to be. It is a piece  of legislation which, although compre hensive at the Federal level, provides a  significant amount of individual deci sionmaking for States and areas where  clearly  the States should have  that  kind of individual decisionmaking.  I, too, as my colleagues, the gentle man from Washington CMr. SWIFT],  the chairman of  the subcommittee,  with whom I have enjoyed a long and  mostly positive working relationship,  feel compelled primarily to talk about  what this bill is not, since most of the  criticisms of the bill are in fact criti cisms which the bill does not deserve.  For-example, I would urge all my col leagues to be very, very careful about  material that has been disseminated in  terms of cost. There  is  in fact one  piece of  information  from  a  study  group which says that the cost of H.R.  2190  to  the Federal Government  is  $200 million. If we would examine the  documents, I think we would find that  the actual amount is $200,000.  Now, we are often accused of drop ping zeroes in spending money in various areas, but I would hope that when  we report on this bill, we would under stand that it is not a $200 million cost  but a $200,000 cost.  During debate on the rule there was  an accusation that the bill is virtually  useless because of its vagueness, for  example, in section 106. There is no  specificity  in  terms of  the kinds of  criminal  convictions  under  which  someone would be denied the right to  vote. There was a discussion about the  fact that if they meant a felony, they  should have said, ""a felony,"" and if  they meant  a misdemeanor,  they  should have said, ""a misdemeanor.""  They said this bill is too vague to be of  any use, ""and look at all the mandat ing that is required.""  I would urge my colleagues to read  the entire section in dealing with the  information on death, criminal convic tion, or mental incapacity, because it  is stated over and over again in the  bill, after that kind of vital statistic in formation is transmitted to the official  voter registration list for adjustment,  it is under State law. The decision as  to which criminal conviction removes  someone from the voting list is to be  determined under State  law. What  kind of mental incapacity is to be de termined as to what removes someone  from the voter list is to be determined  under State law.  If someone wants to argue that we  are vague in that area, I guess they  can argue on a specificity basis that we  are vague. We do not have the Federal  Government dicatating what specific  criminal convictions are going to keep  someone  from  or  remove  someone  from the voter list. We had no inten tion of doing that. We had no inten tion of involving ourselves in an area  where the State ought to make that  decision, and in fact the bill says that  the States should make that decision.  We also had some of our colleagues  upset by the fact that in their particu lar States fishing and hunting licenses  are sold at 7-Eleven's and other kinds  of convenience outlets, and that all of  a sudden the Federal Government is  mandating that the local 7-Eleven reg ister voters. I would entertain some one's examination of the bill and the  terminology that was used in an at tempt to get government agencies to  involve themselves in the voter regis tration area, requiring absolute neu trality under Federal penalty of law,  in a neutral way offering the opportu nity to register people, not in private  enterprise areas, but for example, as  the bill says, in ""fishing and hunting  bureaus,"" agencies of the government.  Now, we have an outreach program  for the private sector to be involved if  they so wish. In California we have  been able  to  involve fast food  fran chises and outlets  in a  number of  other areas in offering an opportunity  to  register people  to vote.  I  think,  given today's lifestyle of people, it is  not  inappropriate  that  the Govern ment try to be as outreaching and for ward-looking as possible, including the  private sector, in extending people an  opportunity to register.  Mr. Chairman,  another complaint  levied against the bill is that it is sup posed to increase voter turnout, and  some say, ""We really don't think it is  supposed to increase voter turnout or  we don't think it will."" I will ask them  to turn to the purposes of the Act. No.  1, it says, ""to increase registration of  citizens as voters."" It is not that the  registered voters are necessarily going  to turn out.  I say to my colleagues that I think  we have a vast amount of work to do  in the area of an honest and fair ap portionment, in the area of campaign  finance, and in putting back into the  picture local people so they can feel as  though they have a chance to influ ence an election. All of those are items  that would affect turnout.  What  this bill  intends  to do and  indeed does is to get people in a con venient way registered and, more im portantly,  in an orderly fashion,  re moved from the rolls so that what we  have are accurate rolls. I think a rea sonable program to get people to vote  is to, first of all, have an accurate roll  from which  one  can make  those  choices, not one which is exceedingly  difficult to get on or impossible to get  off, but one which is reasonable and  orderly in putting people on and rea sonable and orderly in removing them.  ",1990
119,House,101,-0.43,1246,1,Mr. SWIFT.," Mr. Chairman, I yield  such time as he may consume to the  gentleman  from  Maryland  CMr.  MFUME].  ",1990
120,House,101,-0.446,1246,1,Mr. MFUME.," Mr. Chairman, I thank  the gentleman from Washington CMr.  SWIFT] for yielding time to me, and I  rise  in very  strong support of  the  measure before us today.  Mr. Chairman, I join my colleagues in strong  support of this momentous and historic piece  of legislation, H.R. 2190, the Voter Registra tion Act of 1989. This bill will make voter reg istration more accessible  to  the . millions of  Americans who, for a number of reasons, do  not have the means to register.  Five years ago we celebrated the 20th anni versary of the Voting Rights Act of 1965 to  mark the significant progress we have made  in allowing our citizenry  the opportunity  to  vote. With the passage of the 1965 act, many  blatant and  sinister obstacles administered  through  the  repressive Jim Crow  laws were  dismantled. Yet, today many Americans-par ticularly minorities and  low-income persons are still locked out of the electoral process as  other impediments prevent full participation in  the electoral process on election day.  Mr. Chairman, the United States has one of  the worst voter turnout records among indus trialized nations.  In  the Presidential election  year of 1984, only 53.1 percent of the voting  age went to the ballot box, and in 1986 only  37.1 percent. And only 50.8 percent of the  population voted in the last Presidential elec",1990
