,branch,congressID,ideology_score,page,part,speaker,speech,year
84,House,112,0.688,23,2012-02-07,Mr. GARRETT.," Madam Chair, I yield  myself such time as I may consume.  I thank the lady for commending us  for raising these issues. But actually,  we’re doing something more than just  simply raising the issue. We’re addressing it and solving this problem as well.  I appreciate the fact that the gentlelady raises the fact about a list of experts who have questions about this.  Well, I have experts too, but I actually  have the name. A former CBO Director,  Doug Holtz-Eakin, now with American  Action Forum, writes us here to express support of H.R. 3581.  The gentlelady may also know, since  she serves on the committee, when it  comes to this issue that we had this  issue up in committee recently, and we  asked the current CBO Director does he  support with regard to moving towards  fair value. And he said that is the more  appropriate basis of evaluating the obligations of the Federal Government.  So we have the experts.  AMERICANACTIONFORUM,  January 30, 2012.  Hon. PAULRYAN,  Longworth House Office Building,  Washington, DC.  DEARCHAIRMANRYAN: I am writing to express my support for H.R. 3581, ‘‘The Budget  and Accounting Transparency Act of 2011,’’  in particular those provisions that would incorporate fair value accounting (FVA) into  the federal budget process. As you are well  aware, a core objective in federal budgeting  is to accurately display the scale and timing  of the expenditure of taxpayer resources.  Since sovereign tax and borrowing powers  should always be used judiciously, there is a  premium on doing so as accurately as possible.  In some cases this is straightforward. Consider, for example, a discretionary appropriation. The scale of the overall commitment is  clear and in some cases it is straightforward  to budget the timing of the ultimate outlays  as well. Federal credit programs, however,  present particular difficulties. The timing of  budgetary cash flows differs dramatically between direct loans and federal loan guarantees—even in cases when the ultimate economic impact is identical. The Federal Credit Reform Act of 1990 (FCRA) took an important step forward by equalizing the timing of  their budgetary treatment Direct loans and  loan guarantees are both recorded  in the  budget during the year in which the commitment is incurred, regardless of the duration  and timing of the federal assistance.  This was an important step in the right direction. However, estimating the scale of required taxpayer resources remains problematic. In particular, the ability of loan recipients to make timely and complete repayments will be  influenced by  future  individual, household, and economy-wide economic conditions. In the same way, the obligation of the federal government to undertake guarantee payments will be driven by  similar forces.  While such future individual and economic  conditions are uncertain, reliable techniques  exist to estimate the likely size of the taxpayer obligation. Unfortunately, FCRA needlessly restricts the analyses to credit risk—  the probability of failure to fully repay—  while ignoring the fact that the timing of  those failures matters enormously. As the  past few years have starkly reminded every  American, the need to tax, borrow and otherwise deprive the private sector of another  dollar has far greater implications during  the depths of economic distress than during  periods of robust economic growth. Adoption  Of FVA would rectify this oversight  I recognize that significant reform to budget procedures  should not be undertaken  lightly. However, my views are informed by  the fact that during my tenure as director,  the Congressional Budget Office undertook a  number of studies of the implications of accounting  fully  for economic risks  in the  budgetary treatment of  financial commitments like credit programs. In example after  example (pension guarantees; deposit insurance; flood insurance; student loans; and assistance for Chrysler and America West Airlines), it becomes clear that an incomplete  assessment of risks leads to misleading budget presentations and may engender poor policy decisions. FVA would be a significant  step toward  improving this  informational  deficit.  My views are echoed by a wide array of  budget experts. In March 2010, CBO issued a  new report recommending the use of FVA for  federal  student  loan  programs  on  the  grounds that budget rules do ‘‘not include  the costs to taxpayers that stem from certain risks involved in lending.’’ In addition,  the Pew-Peterson Commission on Budget Reform proposed  ‘‘fair-value accounting’’  for  credit programs and the President’s National  Commission on Fiscal Responsibility and Reform advocated for reform of budget concepts that would more accurately reflect  costs.  In addition to these research views, there  is a track record of success. FVA has already  been used  successfully  for  the budgetary  treatment of the Temporary Asset Relief  Program of 2008 (TARP) and the federal assistance to Fannie Mae and Freddie Mac.  Last but not least H.R. 3581 would also fix  another shortcoming of FCRA; namely that  the administrative costs associated with federal operations are not included in the budget cost and must be provided for elsewhere.  H.R. 3581 would require that administrative  costs  (called  ‘‘essential preservation services’’) to be accounted for up-front, thereby  balancing the playing field.  In sum, I believe that the Congress should  adopt  fair value accounting and,  in particular, pass H.R. 3581 in a timely fashion. I  would be happy to discuss any aspect of this  issue in greater detail.  Sincerely,  DOUGLASHOLTZ-EAKIN.  With that, I yield 1 minute to the  gentleman  from  California  (Mr.  MCCLINTOCK).  ",2012
85,House,112,0.2,30,2012-02-07,Mr. DOLD.," Madam Chairman, I have  an amendment at the desk.  The CHAIR. The Clerk will designate  the amendment.  The text of the amendment is as follows:  At the end of the bill, add the following  new title:  TITLE IV—PRESIDENT’S BUDGET  SUBMISSION  SEC. 401. PREPARATION OF THE BUDGET.  (a) THEPRESIDENT.—Section 1105(a) of title  31, United States Code, is amended—  (1) by redesignating the second paragraph  (37) as paragraph (39); and  (2) by adding at the end the following new  paragraph:  ‘‘(40) A summary of how the use of accrual  accounting procedures would affect the estimated expenditures, appropriations, and receipts of the Government in the fiscal year  for which the budget is submitted.’’.  (b) OFFICEOFMANAGEMENTANDBUDGET.—  The Director of the Office of Management  and Budget shall prepare all of the budgets  submitted to the President according to both  accrual accounting procedures and the cash  basis accounting method.  The CHAIR. Pursuant to House Resolution 539, the gentleman from Illinois  (Mr. DOLD) and a Member opposed each  will control 5 minutes.  The Chair recognizes the gentleman  from Illinois.  ",2012
86,House,112,0.69,37,2012-02-07,Mr. LAMBORN.," Mr. Speaker, I thank  the  gentleman  from Mississippi  for  putting this time together. And I rise  today in support of National Marriage  Week.  In  so many ways,  from  so many  sources, marriage is under attack in  America. When we consider the many  social  problems  facing  our  country  right now, the erosion of marriage and  family is at the core of many of them.  Scholar Michael Novak once famously  referred to the family as the ‘‘original  Department of Health, Education, and  Welfare’’ because of  its role  in providing for the needs of all its members  and, particularly, the next generation.  Study after study has shown the tremendous advantages for children and  society as a whole when there is a sustained presence of mothers and fathers  in the home. Families in which mothers and fathers strive to nurture their  children together have advantages over  every other family form that has been  studied to date.  Today we are seeing that marriage is  increasingly  in  trouble  in America.  High  rates  of  divorce,  nonmarital  childbearing,  and  single  parenthood  were  once  problems  primarily  concentrated  in poor communities. Now  the American retreat from marriage is  moving  into the heart of the social  order, the middle class. There is a widening gulf between the middle class,  where a sharp decline in marriage is at  work, and the most educated and affluent Americans, where marriage indicators are either stable or are even improving.  As unwed childbearing continues to  climb, risking continued social breakdown and  increased government dependency, national leaders should be  encouraging stable  family  formation,  not redefining marriage. I call upon  Congress  to  recognize  the  intrinsic  good that results to all of society when  husbands and wives strive to uphold  their marriage vows and raise children  in loving and stable homes.  I again want to thank the gentleman  from Mississippi for putting this time  together on such an important issue.  ",2012
87,House,112,0.488,37,2012-02-07,Mr. NUNNELEE.," Thank you, ",2012
88,House,112,-0.426,44,2012-02-07,Mr. TONKO.,"  Representative  GARAMENDI, as you toss out pieces of  the puzzle there,  it conjures up all  sorts of responses that I think we need  to provide and share.  You talk about the intermittent nature of renewables. The sun not shining  at night, the wind ceasing to blow, you  name it. The hydro facilities perhaps if  you have a dry season, whatever. We  need to advance the notion of the battery as the linchpin to move forward  aggressively with a sustainable agenda  which renewables can provide. And so  the advanced battery manufacturing  that I see taking hold in the 21st Congressional  District  in  Schenectady  with the GE operation.  ",2012
89,House,112,-0.313,44,2012-02-07,Mr. GARAMENDI.," Mr. TONKO, why do  we keep coming back to the 21st Congressional District?  ",2012
90,House,112,-0.119,58,2012-02-07,Mr. BARROW.,"  H.R. 3652: Mrs. BLACKBURN, Mrs. NOEM, and  ",2012
91,House,112,0.548,58,2012-02-07,Mr. FARENTHOLD.,  H.R. 3698: ,2012
92,House,112,0.56,58,2012-02-07,Mrs. MYRICK.,"  H.R. 3702: Mr. CLARKEof Michigan.  H.R. 3767: Mr. GERLACH, Mrs. DAVISof California, Mr. DEUTCH, and ",2012
93,House,112,0.605,58,2012-02-07,Mr. HARRIS.,  H.R. 3811: ,2012
94,House,112,0.505,58,2012-02-07,Mr. DUFFY.,  H.R. 3816: Mr. POMPEOand ,2012
95,House,112,0.616,58,2012-02-07,Mrs. BLACKBURN.,  H.R. 3852: Ms. LEE of California and ,2012
96,House,112,-0.317,58,2012-02-07,Mr. QUIGLEY.,"  H.R. 3856: Mr. BILIRAKIS, and Ms. ROS-  LEHTINEN.  WALZ H.R. 3866: Mr. SERRANO, Mr. CLEAVER, Mr.  RANGEL, Mr. DINGELL, Mr. ALTMIRE, Mr.  of Minnesota, Mr. COSTELLO, Mr.  RAHALL, Mr. MICHAUD, Mr. LARSENof Washington, Mr. NADLER, and ",2012
97,House,112,0.24,58,2012-02-07,Mr. JONES.,"  H.R. 3903: Ms. SUTTON, Mr. WELCH, Mr.  JOHNSONof Georgia, Mr. JACKSONof Illinois,  Mr. CONYERS, Ms. KAPTUR, Ms. MOORE, Mr.  MCGOVERN, Ms.  of  California, Mr.  HONDA, Mr. FILNER, and ",2012
98,House,112,-0.391,58,2012-02-07,Mr. CICILLINE.,"  H. Res. 298: Ms. ZOELOFGRENof California.  H. Res. 460: Ms. ZOELOFGRENof California,  Mr. LANGEVIN, Mr. HOLT, Mr. CALVERT, Mr.  LEWISof Georgia, Ms. EDDIEBERNICEJOHNSONof Texas, and Ms. ROYBAL-ALLARD.  H. Res.  532: Mr. NUNNELEE and Mr.  LEE FITZPATRICK.  f  PETITIONS, ETC.  Under clause 3 of rule XII,  36. The SPEAKER presented a petition of  the City of Lauderdale Lakes, Florida, relative to Resolution No. 2011-121 setting forth  the City’s 2012 Federal Legislative and Appropriations priorities; jointly to the Committees on Energy and Commerce, Transportation and Infrastructure, Homeland Security, the Judiciary, and Financial Services.  f  AMENDMENTS  Under clause 8 of rule XVIII, proposed amendments were submitted as  follows:  S. 2038  OFFEREDBYMR. FLAKE  AMENDMENTNO. 1: Add at the end the following new title:  TITLE III—EARMARK ELIMINATION  SEC. 301. SHORT TITLE.  This title may be cited as the ‘‘Earmark  Elimination Act of 2012’’.  Subtitle A—House of Representatives  SEC. 311. PROHIBITING CONSIDERATION OF LEGISLATION CONTAINING EARMARKS.  (a) PROHIBITION.—  (1) INGENERAL.—It shall not be in order in  the House of Representatives to consider any  bill,  joint resolution, amendment, or conference report if the bill, joint resolution,  amendment, or conference report, or any accompanying  report  or  joint  explanatory  statement of managers, includes a congressional earmark, limited tax benefit, or limited tariff benefit.  (2) PROCEDURE.—If a point of order is raised  under paragraph (1) with respect to a congressional earmark, limited tax benefit, or  limited tariff benefit and the point of order  is sustained, the congressional earmark, limited tax benefit, or  limited tariff benefit  shall be deemed to be stricken  from the  measure involved.  (3) SPECIALPROCEDUREFORCONFERENCERETHE  PORT AND AMENDMENTS BETWEEN HOUSES.—  (A) IN GENERAL.—If a point of order  is  raised and  sustained under paragraph  (1)  with respect to a conference report or a motion that the House recede from its disagreement to a Senate amendment and concur  therein, with or without amendment, then  after disposition of all such points of order  the conference report or motion, as the case  may be, shall be considered as rejected and  the matter remaining in disagreement shall  be disposed of under subparagraph (B) or (C),  as the case may be.  (B) CONFERENCEREPORTS.—After the House  has sustained one or more points of order  under paragraph (1) with respect to a conference report—  (i) if the conference report accompanied a  House measure amended by the Senate, the  pending question shall be whether the House  shall recede and concur in the Senate amendment with an amendment consisting of so  much of the conference report as was not rejected; and  (ii) if the conference report accompanied a  Senate measure amended by the House, the  pending question shall be whether the House  shall  insist  further on the House amendment.  (C) MOTIONS.—After the House has sustained one or more points of order under  paragraph (1) with respect to a motion that  the House recede and concur in a Senate  amendment, with or without amendment,  the following motions shall be privileged and  shall have precedence in the order stated:  (i) A motion that the House recede and  concur in the Senate amendment with an  amendment in writing then available on the  floor.  (ii) A motion that the House insist on its  disagreement to the Senate amendment and  request a further conference with the Senate.  (iii) A motion that the House insist on its  disagreement to the Senate amendment.  (b) DETERMINATIONBYHOUSE.—If a point of  order is raised under this section and the  Chair is unable to ascertain whether a provision constitutes a congressional earmark,  limited tax benefit, or limited tariff benefit,  the Chair shall put the question to the House  and the question shall be decided without debate or intervening motion.  (c) CONFORMINGAMENDMENT.—Rule XXI of  the Rules of the House of Representatives is  amended by striking clause 9.  SEC. 312. DEFINITIONS.  In this subtitle—  (1)  the  term  ‘‘congressional  earmark’’  means a provision or report  language  included primarily at the request of a Member,  Delegate, Resident Commissioner, or Senator providing, authorizing or recommending  a specific amount of discretionary budget  authority, credit authority, or other spending authority for a contract, loan, loan guarantee, grant, loan authority, or other expenditure with or to an entity, or targeted to  a specific State, locality or Congressional  district, other than through a statutory or  administrative  formula-driven or competitive award process;  (2) the term ‘‘limited tax benefit’’ means—  (A) any revenue-losing provision that—  (i) provides a Federal tax deduction, credit,  exclusion, or preference to 10 or fewer beneficiaries under the Internal Revenue Code of  1986, and  (ii) contains eligibility criteria that are  not uniform in application with respect to  potential beneficiaries of such provision; or  (B) any Federal tax provision which provides one beneficiary temporary or permanent transition relief from a change to the  Internal Revenue Code of 1986; and  (3) the term ‘‘limited tariff benefit’’ means  a provision modifying the Harmonized Tariff  Schedule of the United States in a manner  that benefits 10 or fewer entities.  Subtitle B—Senate  SEC. 321. PROHIBITION ON EARMARKS.  (a) BILLSANDJOINTRESOLUTIONS, AMENDMENTS, AMENDMENTSBETWEEN THEHOUSES,  ANDCONFERENCEREPORTS.—  (1) INGENERAL.—It shall not be in order in  the Senate to consider a bill or resolution introduced in the Senate or the House of Representatives,  amendment,  amendment  between the Houses, or conference report that  includes an earmark.  (2) PROCEDURE.—Upon a point of order  being made by any Senator pursuant to paragraph (1) against an earmark, and such point  of order being sustained, such earmark shall  be deemed stricken.  (b) CONFERENCEREPORT ANDAMENDMENT  BETWEENTHEHOUSESPROCEDURE.—When the  Senate is considering a conference report on,  or an amendment between the Houses, upon  a point of order being made by any Senator  pursuant to subsection (a), and such point of  order being sustained, such material contained  in such conference report shall be  deemed stricken, and the Senate shall proceed to consider the question of whether the  Senate shall recede from its amendment and  concur with a further amendment, or concur  in  the House amendment with a  further  amendment, as the case may be, which further amendment shall consist of only that  portion of the conference report or House  amendment, as the case may be, not so  stricken. Any such motion  in the Senate  shall be debatable under the same conditions  as was the conference report. In any case in  which  such  point  of  order  is  sustained  against  a  conference  report  (or  Senate  amendment derived from such conference report by operation of this subsection), no further amendment shall be in order.  (c) WAIVER.—Any Senator may move to  waive any or all points of order under this  section by an affirmative vote of two-thirds  of the Members, duly chosen and sworn.  (d) DEFINITIONS.—  (1) EARMARK.—For the purpose of this section, the term ‘‘earmark’’ means a provision  or report language included primarily at the  request of a Senator or Member of the House  of Representatives as certified under paragraph 1(a)(1) of rule XLIV of the Standing  Rules of the Senate—  (A)  providing,  authorizing,  or  recommending a specific amount of discretionary  budget authority, credit authority, or other  spending authority for a contract, loan, loan  guarantee, grant, loan authority, or other  expenditure with or to an entity, or targeted  to a specific State, locality or Congressional  district, other than through a statutory or  administrative  formula-driven or competitive award process;  (B) that—  (i) provides a Federal tax deduction, credit,  exclusion, or preference to a particular beneficiary or  limited group of beneficiaries  under the Internal Revenue Code of 1986; and  VerDate Mar 15 2010  03:55 Feb 08, 2012 Jkt 019060 PO 00000 Frm 00058 Fmt 4634 Sfmt 0634 E:\CR\FM\A07FE7.049 H07FEPT1 E S U O H h t i w D O R P 1 N V T P T 7 K S D n o r e k a l w p         ",2012
99,Senate,112,-0.4,65,2012-02-07,Mr. FRANKEN.," Mr. President, I ask  unanimous consent the order for the  quorum call be rescinded.  ",2012
100,Senate,112,0.351,72,2012-02-07,Ms. AYOTTE.," Madam President,  I  certainly share the concerns of my colleague from Missouri, and I share the  concerns of my constituents  in New  Hampshire and citizens across this Nation who see the recent rule issued by  the administration for what it is, an  unprecedented, unnecessary affront to  religious liberty in our country.  I wish to say at the outset that this  issue  is not  limited to the Catholic  Church.  The  administration’s  new  health care mandates on religious institutions  impact all religions. Religious freedom is a foundational American  right enshrined  in our Bill of  Rights. The  first amendment to our  Constitution makes clear  that Congress shall make no law respecting an  establishment of  religion or prohibiting the free exercise thereof.  Unfortunately, I see the administration chipping away at these bedrock  freedoms as it engages in a troubling  pattern here with respect to this rule,  and I think we saw that the President’s  new mandate on religious institutions  highlights the deep flaws in the health  care bill.  This unconstitutional law was moved  through Congress and signed by the  President 2 years ago without the type  of due consideration, transparency, or  accountability we would all expect, and  we  have  been  suffering  the  consequences since. It is highlighted with  what we see with these recent mandates from Health and Human Services.  I wish to share some of the concerns  my  constituents  have  raised  about  these mandates  that were  recently  issued by Health and Human Services.  There is a letter I received this week  from William Edmund Fahey, who is  the president of Thomas More College  in Merrimack, NH, and he says: To condition the availability of medical benefits upon a community’s willingness to  violate a cardinal teaching of its faith  effectively prevents the full practice of  its religion; and thus, again, violates  the  free exercise of a constitutional  liberty.  He pleaded with our delegation, the  New Hampshire congressional delegation, and he said: I hope you will see  that the mandate undermines the Constitution, compromises the integrity of  the  government  and  abuses  the  foundational principle that free associations form an essential part of the  social fabric of the United States.  We are fortunate in New Hampshire  to have a number of very effective  Catholic  institutions  and  organizations. We have the Catholic Medical  Center in Manchester which serves so  many  in the Manchester community  and surrounding areas. The Catholic  Medical Center has also expressed concerns about the mandate, saying: It  would force us to offer services that  were against our ethical and religious  directive or force us not to offer insurance altogether.  They added: Neither are acceptable  options.  The president of one of our great colleges in New Hampshire, Saint Anselm  College, President Jonathan DeFelice,  said: In a country and a State that values and respects individuals’ rights to  exercise their religious beliefs and live  according  to  their conscience’s best  light, it is simply appalling to think  that this mandate is anything other  than an unprecedented incursion into  freedom of conscience.  I have heard many concerns from my  constituents, and I would hope that  Health and Human Services would stop  what it is doing right now, this mandate that places religious institutions  in this impossible position, with this  impossible choice of violating  their  core beliefs in order to comply with a  mandate or dropping employee insurance coverage altogether. We should  not be putting these organizations that  do great work throughout this country  in that position. And, again, this is not  an issue that just applies to the Catholic Church; this applies to all religious  institutions.  I would ask my colleague from the  State of Missouri: As a result of our  concerns about the actions of the administration, we have offered legislation to address this, and what does that  legislation do in order to make sure  that this mandate does not go forward?  ",2012
