,branch,congressID,ideology_score,page,part,speaker,speech,year
289,Senate,101,0.342,1245,11,Mr. GRASSLEY.," Mr.  President,  much of  this crime bill debate has  been about convicted criminals-their  rights of collateral appeals, for exam ple, and whether they can be constitu tionally put to death by the State for  their crimes.  Other parts of the debate have fo cused on other substantive and proce dural rights of criminal defendants.  This amendment, Mr. President,  different.  It focuses not on the perpetrators of  crime, but rather the victims of crime.  This amendment  is  the product of  independent work on my part, and on  the  part  of my  distinguished  col league, Senator NICKLES. I am pleased  that we have been able to join forces  on this amendment to the crime bill to  provide the only occasion the Senate  will have to support the rights of vic tims.  Our amendment establishes:  is  First, a bill of rights for the victims  of crime;  Second, services  to be provided  to  crime victims, once they have entered  the criminal justice system;  Third, improved means of providing  restitution to the victim of a crime;  Fourth, reversal of a recent Supreme  Court decision  that would allow de crees of bankruptcy  to discharge  a  valid order for restitution on the part  of a convicted criminal; and  Fifth, procedural rights for victims  to have  input  in a  distinct written  statement during the sentencing phase  of a Federal capital case.  Mr. President, we all work in what  has been called the murder capital of  the world-a place where crime scenes  are as commonplace as the neighbor hood ice cream truck on a June after noon.  As  the victims of violent crime  in crease  in  number,  our  senses  get  dulled. We necessarily lose our capac ity to feel any emotion for the pain  that the bloodshed causes victims and  their survivors.  Ironically, as the crimes grow more  outrageous, we are losing our ability to  be outraged, on behalf of crime's vic tims, and society.  In 1982, Congress enacted the Victim  and Witness Protection Act [VWPAJ  to try to address the rights of crime  victims.  This statute is well-intended, and I  was pleased to support it. But it needs  to be beefed up.  Under current law, the crime victim  does not have the right to communi cate his or her views distinctly to the  sentencing judge in Federal cases.  Federal Rule of Criminal Procedure  No. 32(c) provides only that a presen tence  report  be  prepared. Among  other things, the report, which is pre pared by court-appointed officers,  is  supposed to contain:  Information concerning any harm, includ ing  financial,  social,  psychological,  and  physical harm, done to or loss suffered by  any victim of the offense, and any other in formation  that may aid the court  in sen tencing,  including the restitution needs of  any victim of the offense.  Various States, on the other hand,  provide victims with the opportunity  to communicate to the court through  a ""victim  impact statement""  in non capital cases.  My portion of the Grassley /Nickles  amendment would apply this essential  rule,  in a more direct, distinct, and  formal procedure,  in Federal capital  cases.  No doubt, it will be argued that this  amendment is unconstitutional.  In 1987, by a bare 5-to-4 majority in  Booth versus Maryland, the Supreme  Court  determined  that  the  eighth  amendment prohibited a  jury  from  considering such a victim impact state ment during the sentencing phase of a  State capital trial.  But as has been often observed, ""the  Constitution is what five members of  the Court say it is.""  This opinion was written by Justice  Powell, who is no longer on the Court.  The question  is a very close one.  Other members of  the Court have  strongly urged reconsideration. This is  the Senate's way to take up the Su preme Court's offer to reconsider.  I  believe  that  a  distinct  victim  impact  statement-a  truthful  state ment on the loss of the victim and the  impact of  that  loss on  the victim's  family-can be presented to the trier  of fact during the sentencing phase of  the  proceeding without violating  a  convicted  defendant's  constitutional  due process safeguards.  Allow me  to describe  for my col leagues the circumstances surrounding  the deaths of the victims in the Booth  case.  I believe it will explain why I am  proposing this amendment, why I be lieve the Court ought to take another  look at this issue.  FACTUAL BACKGROUND  Mr. President, in 1983, Irvin Bron stein, aged 78, and his wife Rose, aged  75, were robbed  in  their west Balti more home.  The murderers,  John Booth  and  Willie Reid, entered the victims' home  for the apparent purpose of stealing  money to buy heroin.  Booth, a neighbor of the Bronsteins,  knew  that the couple could identify  him. So,  the Bronsteins were bound  and gagged and stabbed repeatedly in  their chests with a kitchen knife.  The Bronsteins' son discovered the  bodies of his parents 2 days later.  A Maryland jury found Booth guilty  of two counts of first-degree murder,  two counts of robbery, and conspiracy  to commit robbery.  The prosecution requested the death  penalty and Booth elected to have his  sentence  determined  by  the  jury  rather than the judge.  Before  the  sentencing  phase  of  Booth's prosecution began, the Mary land State Division of Parole and Pro bation compiled a presentence report  that  described Booth's background,  education,  employment history,  and  criminal record.  At that time, Maryland law also re quired  a  victim  impact  statement  [VISJ be considered during this phase  of the criminal proceedings.  The VIS was  intended  to describe  the effect of the crime on the victim  and his family. Compiled by the State,  the VIS  information was  to be sup plied by  the victim or his or her  family.  The VIS could be read to the jury  during  the sentencing phase or  the  victim's  family members  could  be  called to testify as to the information  contained in the VIS.  ",1990
290,Senate,101,-0.231,1258,11,Mr. GRAHAM.," Mr.  President,  I  strongly  oppose  the  second-degree  amendment which essentially eviscer ates  the concept of this amendment  and  substantially negates  the argu ments that many of us made when we  were discussing the Racial Justice Act.  The Racial Justice Act, as you recall,  Mr. President, was a provision in the  original crime bill  that would have  said if a State had a statistical imbal ance as between the composition of its  population or various components of  its population and those to whom the  criminal  laws were applied, and par ticularly the death penalty, then the  States assumed the burden of showing  that they did not have a racially dis criminatory  criminal  justice  system  and would be precluded from utilizing  the death penalty until they had over come that presumption.  Mr. President,  the argument  that  many of us made was  that the Su preme Court has said that there is no  constitutional right to have any par ticular statistical outcome of your jus tice system, that our justice system is  predicated on  individual  justice and  that constitutional  rights are  those  things that relate  to your  individual  status, and there must be a showing of  discrimination in the specific case of  the defendant before the bar.  The whole purpose of this proposal  is to allow for a broad examination of  the justice system, not a narrow exam ination, as the chief justice of Florida  has stated when such a  commission  was established in my State, to look at  issues from the question of are we pre paring a sufficient number and proper ly prepared, trained lawyers that are  representative of  the population of  the State so that they can be available  to the justice system; are we training  persons to work in our justice system  in ways that will give us some assur ance that invidious but not necessarily  unconstitutional  racial  and  ethnic  practices are not being used to distort  the justice system.  It is  important, Mr. President, not  only that the substance of the justice  system be upheld but the constitution al standard be maintained. It is also  important, Mr. President,  that  the  perception, the perception, the view of  justice by the average American man  and woman be  that  this  is  a  fair  system. It is  to that goal that these  studies are directed.  Also these studies are not limited to  the specifics of an individual or class  of criminal defendant. They are  in tended to  look broadly, systemically,  at the process of  the  justice system  within our State.  As I indicated, Mr. President, this is  not a novel idea. States as diverse as  Florida, New Jersey, New York, Massa chusetts, and others have adopted a  proposal to initiate similar studies.  The Senator  from Utah  suggests  that these are going to be out-of-con trol commissions,  that  they will be  turned into sociological laboratories. If  we read the proposal, the amendment  says that these panels have to be es tablished  by  one  of  three  groups,  either  the highest court within  the  State, or by  the  legislature of  the  State, or by the Governor of the State.  None of  those  three convening au thorities is exactly likely to lose con trol of what is expected.  Second, I would point out that it is  up  to  the U.S. Attorney General  to  pass  judgement on  specific  applica tions for these grant funds. So a  re sponsible constitutional body within  the State must initiate, and the high est justice officer in the U.S. Govern ment must  approve  and  allocate,  before  these panels  to  study  racial  issues within a State's justice system,  so they can be funded and can move  forward, at least with Federal funds.  The States that have already initiat ed these studies have done so because  they felt it was in their State's inter est, sufficiently in their interest, that  they would  initiate  and  fund with  their State dollars. I believe this is an  appropriate area for the Federal Gov ernment to further encourage States  to  look  seriously  at  their  justice  system, and with that examination to  take such steps as that State considers  to be appropriate.  I believe and I do not feel I would  have any disagreement with either the  Senator from Utah or South Carolina,  that  this  is  a more appropriate  re sponse  than  the attempt  to convert  our justice system into a mathematical  system, which was the essence of the  original title I of S. 1970.  Mr. President, I  therefore strongly  urge  the defeat of  this amendment,  which would significantly undermine  the very purpose for which this pro posal is made: to encourage a serious  examination of the system of justice  within the State, and through that ex amination to give reassurance to the  public that justice for all is,  in fact,  not only an objective, but a  reality  within that State's justice system.  ",1990
291,,101,-0.214,1414,11,Mr. EXON.," Mr. President, one final  note: I would like to indicate to the  Senate  that  this matter has  been  taken up with the chairman of the En vironmental and Public Works Com mittee which will be the committee of  jurisdiction. They  intend  to handle  this very promptly. I appreciate the  ",1990
292,,101,0.196,1518,11,Mr. SCHIFF.," Mr. Speaker,  today  I, along  with Congressman JOE SKEEN and Congress man BILL RICHARDSON, am  introducing a bill  to make a technical correction  in a land de scription contained in the San Juan Basin Wil derness Protection Act of 1984. A section of  the statute authorizes the Secretary of the In terior to convey to Sumner Lake Corp. certain  land situated in Lake Sumner State Park, NM.  For this  land  transfer to  take place,  the de scription should refer to section 33 instead of  section 34. The original bill inadvertently used  the wrong section number and this was only  recently discovered. The Department of  the  Interior has determined  that  this correction  cannot be effected administratively, but  re quires congressional action.  INTRODUCTION  OF  MOUNT.  SOPRIS TREE NURSERY LAND  EXCHANGE  ..,  HON. BEN NIGHTHORSE CAMPBELL  OF COLORADO  IN THE HOUSE OF REPRESENTATIVES  Thursday, June 28, 1990  ",1990
293,,101,-0.141,1518,11,Mr. CAMPBELL of Colorado.," Mr. Speaker,  today  I am  introducing  legislation  to allow  Pitkin and Eagle Counties to acquire an 186  tree nursery in the White River National Forest  in exchange for roughly 1,344 acres of patent ed mining claims which are owned by  the  counties.  The  tree  farm has been  targeted  for ex change, transfer or sale by the General Serv ices  Administration  [GSA].  The  counties  intend to use the tree farm to develop recre ational facilities,  for open space, and to build  a senior center. This exchange also protects  the property from  future private development  because  it contains a clause which directs  that all  the proceeds from any sale or lease  would go to the United States.  As you know,  the ski areas of Vail, Beaver  Creek, and Aspen are world  reknown. This  recognition has not been without cost. A tre mendous amount of stress has been placed  on  local facilities and property values are ski  high. The county needs land to fulfill responsi bilities  that  local governments have, but are  often overlooked by the public.  EXTENSIONS OF REMARKS  The bill also sets up an orderly process to  address any claims which may arise when the  United States is granted title to the patented  mining claims. This  is necessary  to prevent  any  further  forest management  problems  which could arise.  The Forest Service and  the counties have  been attempting  to complete  this exchange  administratively for many years. Unfortunately,  the cost of clearing the title on every acre of  property makes this  infeasible  in  light of the  stressed Forest Service and county budgets.  This exchange will  serve  a valuable public  purpose-and save the Government money.  MEDICAL  INSURANCE  SAFETY  NET MISSING  FOR MILLIONS  OF CITIZENS  HON. SAM GEJDENSON  OF CONNECTICUT  IN THE HOUSE OF REPRESENTATIVES  Thursday, June 28, 1990  ",1990
294,,101,-0.416,1518,11,Mr. GEJDENSON.," Mr. Speaker,  I am sure  that my colleagues are well aware of the vast  number of  individuals-the poor,  the unem ployed, the working uninsured, and in fact, the  many children-who are without health insur ance coverage. Currently, an estimated 32 to  37 million  individuals  live on  a day-to-day  basis without  a medical  safety  net. They  cannot afford visits to the family doctor, have  no access  to preventive care, no means  to  obtain prenatal  care, and no protection  in  case of a medical emergency. Several worthy  proposals have already been  introduced by  Members of this body which seek to address  the problems of the uninsured.  Mr. Speaker,  legislators and other  individuals  in  the State of Connecticut have also  grappled with  this difficult issue. On May 17,  1990, Gov. William O'Neill approved a  farreaching  plan  to make  health  insurance  cheaper and more accessible  to  the unin sured. As many as 37 disparate groups of in dividuals were  involved in  the drafting of this  legislation, ranging  from citizen-action groups  to insurance industry representatives.  The new law will extend health coverage to  an additional 60,000 Connecticut representa tives, at a cost of $2 million. This is a signifi cant step  toward a  resolution of  the health  access crisis on a State level. I would first like  to commend my colleagues in Connecticut for  all of their efforts in this area. As well, I would  encourage legislators from other States and at  Federal level to give this legislation close con sideration:  AN ACT CONCERNING THE RECOMMENDATIONS  OF THE BLUE RIBBON COMMISSION ON STATE  HEALTH INSURANCE  Summary: This bill expands access to and  increases  the  availability of health  care  services and  insurance coverage  to people  currently without health insurance or with  inadequate coverage. It allows expansion of  Medicaid, within available appropriations,  to serve more children, pregnant women, el derly, and disabled people. It also requires  granting presumptive eligibility to pregnant  women applying for Medicaid. The bill ex pands a current Medicaid waiver program  assisting disabled children and adults.  also allows for a Medicaid ""buy-out,"" within  available funds, to encourage Medicaid-eligiIt  June 28, 1990  accept  employment-based  ble  people  to  health coverage.  The bill allows the Department of Health  Services [DOHSl, based on available fund ing,  to contract with  insurers  to develop  both subsidized nongroup health insurance  for children and pregnant women, and in surance for people with disabilities.   DOHS can establish, again based on avail able  funding, a grant program  to expand  access to primary care services.  The  bill  requires  creation  of  ""special  health care plans"" offered by health insur ers and health care centers-HMO's-for a  limited time to small employers who are not  currently offering their employees any cov erage. It is also available to individuals. Spe cial health care plans must be available to  certain low-income individuals through the  existing Health Reinsurance Association  [ERAl.  The bill includes a number of small group  market reforms designed to increase afford ability  and  accessibility  of  insurance  through  creation of  a  reinsurance  pool,  limits on premiums  that can be charged,  limits  on  use  of  pre-existing  condition  clauses, disclosure of specified rating prac tices, and other measures.  Under the bill, the Commission on Hospi tals and Health Care [CHHCl must address  Medicare cost shifting and improvements in  its data gathering.  Finally, the bill creates a Health Access  Commission within  the  legislative branch  charged with monitoring the programs to be  developed under the bill and their effect on  addressing trhe uninsured population.  WELCOMING THE THAI  PRIME  MINISTER'S VISIT TO UNITED  STATES,  AND  ENDORSING  THAI ANTIDRUG EFFORTS AS  A MODEL FOR THE REGION  HON. CHARLES B. RANGEL  OF NEW YORK  IN THE HOUSE OF REPRESENTATIVES  Thursday, June 28, 1990  ",1990
295,,101,-0.514,1518,11,Mr. RANGEL.," Mr. Speaker,  last week  the  Thai Prime Minister, Chatichai Choonhavan,  visited the United States. Thai antidrug efforts  serve as a model for Asia. I am pleased that  the Thai Minister met with President Bush  during his visit here.  Under Prime Minister Chatichai Choonha van, the Thais have become leaders in Asia  on drug control. We need Thailand, as  the  economic and political  leader of Southeast  Asia,  to forge a regional strategy to stop the  production and  flow of narcotics  from  the  Golden Triangle.  I want to commend Prime Minister Chatichai  Choonhavan  for  recently appointing and ar ranging  for me  to meet a new minister, Korn  Dabbaransi, the Thai National Drug Policy Co ordinator. In addition, our committee has seen  first hand, during several study missions-the  most recent being in January 1990-the very  effective Thai  crop  substitution program  to  reduce opium cultivation through growing rice,  coffee,  and  beans. Thailand  has also  im proved its infrastructure with the construction  of roads to move these goods.  Burma and Laos continue to be the major  producers of heroin and opium  in Southeast  Asia. We have recently begun narcotics con",1990
296,,101,-0.259,1531,11,Mr. JONES of North Carolina.," Mr. Speaker,  today I introduce a bill to provide for the bond ing of non-vessel-operating common carriers,  and for other purposes.  The Shipping Act of 1984 ("" 1984 act"") de fines a ""non-vessel-operating common carri er"" [NVOCC] as ""* * * a common carrier that  does not operate  the vessels by which  the  ocean  transportation  is provided, and  is a  shipper  in  its  relationship with  an  ocean  common carrier."" 46 U.S.C. app. § 1702(17).  NVOCC's hold themselves out to the public to  provide common carriage. They generally con solidate the shipments of small shippers and  take advantage of full container rates that are  offered by ocean common carriers. NVOCC's  assume  full  responsibility  for  the shipments  that  they handle and  issue bills of lading  to  the underlying shippers.  Although NVOCC's act as  intermediaries  like ocean  freight  forwarders, unlike forward ers, NVOCC's are not licensed or bonded by  the Federal Maritime Commission  [FMC] or  otherwise subject to any restrictions on entry.  However, as common carriers, NVOCC's are  subject to the tariff filing requirements of sec tion 8 of the 1984 act, 46 U.S.C. app. § 1707,  and to the prohibitions set forth in section 1 O  of the act, 46 U.S.C. app. § 1709. There are  approximately  1,450 NVOCC's operating  in  the U.S. foreign commerce.  Over the past several years,  the FMC has  received an  increasing number of complaints  concerning the activities of NVOCC's. During  fiscal year 1989; the FMC's Office of Informal  Inquiries and Complaints dealt with 61  infor mal complaints about NVOCC practices. The  complainants  included  representatives  from  many segments of  the ocean  transportation  industry-shippers/importers,  ocean  freight  forwarders, ocean common carriers,  terminal  operators, and ports. Their complaints reflect ed an  increasing pattern of unlawful conduct  by NVOCC's that has had significant adverse  impacts. These problems are often exacerbat ed by the fact that many NVOCC's lack tangi ble assets.  One of the recurring problems is the situa tion where a shipper prepays freight charges  to an NVOCC, but when  the consignee at tempts to obtain release of the cargo,  it dis covers it must first pay the ocean carrier be cause  the NVOCC has  failed  to do so.  In  other  instances, NVOCC's have gone bank rupt and shippers or consignees have had to  pay duplicate charges  to obtain  release of  cargo. NVOCC bankruptcies have also affect ed ocean carriers and inland carriers who are  owed money by such NVOCC's.  In addition,  ocean  freight  forwarders have  indicated  that  NVOCC's have failed to pay them compensa tion for their services.  A bonding requirement for NVOCC's should  ameliorate most of  these problems. A bond,  obtained  through an acceptable surety com pany, would be available to pay any judgment  for damages arising out of an NVOCC's activi16605  ties as a common  carrier providing ocean  transportation services. The bond could also  be used  to satisfy any order of  reparations  issued pursuant to section 11 of the 1984 act.  Consistent with an NVOCC's status as both a  shipper and a carrier under the 1984 act and  its  relationship with ocean common carriers  and underlying shippers, the bill would protect  all who are injured by an NVOCC's activities.  Shippers who  rely upon NVOCC's would be  primarily protected, but so also would ocean  carriers, and others involved  in ocean  trans portation system.  The bond would also be available to satisfy  any penalty assessed against an NVOCC pur suant to section 13 of the 1984 act. All  too  often  the  FMC  has  initiated  proceedings  against an NVOCC,  found  that violations of  the act have occurred, assessed appropriate  penalties, and then had to engage in lengthy,  resource intensive efforts to collect those pen alties. Permitting the FMC to move against the  bond will make its enforcement efforts much  more effective and efficient.  The bill  sets a minimum amount  for an  NVOCC bond-that is, $50,000. The FMC can  set a higher level after notice and comment  rulemaking.  It will have the continuing flexibil ity to adjust the level of the bond as changing  circumstances warrant.  In an effort to achieve parity of treatment,  the bill will affect all NVOCC's operating in the  U.S.  foreign  commerce. This will  include a  larger number of NVOCC's who are  foreign based but who are presently subject to exist ing tariff filing requirements. They will also be  required to obtain a bond from a surety found  acceptable by  the U.S. Department of  the  Treasury.  The bill does not contain distinct penalties  for noncompliance. Inasmuch as the bill pro vides for an additional section to the 1984 act,  the penalties set forth in section 13 of the act,  46 U.S.C. app. § 1712, will apply to any viola tion of the instant provision or of any regula tion issued thereunder. This would result in a  penalty of not more than $5,000 for each vio lation unless it was willfully or knowingly com mitted, in which case the amount of the penal ty would be not greater than $25,000 for each  violation. In addition, the bill would amend the  1984 act so  that  the FMC can suspend or  cancel an NVOCC's tariff if it fails to maintain  the  requisite bond or does not designate a  resident agent  for service of process. As  is  the case with an ocean freight forwarder's li cense under section 19(b) of  the 1984 act,  the FMC will be able to suspend or cancel an  NVOCC's tariff without a formal hearing.  The bill also adds new prohibited acts  to  section 10 of the 1984 act. Ocean common  carriers will be prohibited from accepting any  cargo  from or transporting cargo  for the ac count of an NVOCC  that  is not bonded or  does not have a valid FMC tariff on file. Simi larly, ocean common carriers will be prohibited  from  entering  into  service  contracts with  NVOCC's who are not bonded or are untar iffed. This includes not only service contracts  in which an NVOCC  is  the signatory shipper  but also contracts  in which an NVOCC  is  listed as an affiliate. As a result, ocean carri ers will need to ascertain whether an NVOCC  seeking its services is indeed bonded and tar",1990
