,branch,congressID,ideology_score,page,part,speaker,speech,year
81,,112,-0.343,47,2011-02-11,Ms. SCHWARTZ.," Mr. Speaker, I rise today  to honor and congratulate Ms. Barbara Allen  on the occasion of being named as a winner  of the Purpose Prize. Ms. Allen was selected  from over 1,000 applicants for her work raising  funds for public school art programs.  The Purpose Prize  is an award given by  Civic Ventures, a  think-tank  that  focuses on  work and social purpose. For  the past  five  years the purpose prize has been given to 10  people, all age 60 and over, who have developed new ways to solve social problems. As  individuals who have completed their mid-life  careers, the winners of the purpose prize have  all shown that social innovation is not the sole  province of the young. Civic Ventures considered  the Purpose Prize  to be not a  lifetime  achievement award, but an investment in the  future of the winner.  Ms. Allen has won this award through her  laudable efforts to maintain the arts in public  schools. She is the founder and CEO of Fresh  Artists, a nonprofit that has raised more than  $100,000 benefiting 272 Philadelphia public  schools to the enrichment of over 53,000 children. Fresh Artists utilizes the creativity of our  students to achieve the goal of funding the art  programs that can help more students harness  their own creativity. The organization  invites  students  in grades K  through 12  to donate  their artwork to be used in large-scale reproductions. Fresh Artists then collects monetary  donations from businesses and organizations  who display the artwork in their buildings. The  donations are then used to buy art supplies for  Philadelphia’s most  under-resourced  public  schools. Since its founding in 2008, Fresh Artists has  installed nearly 600  reproductions.  Barbara Allen’s vision and dedication  to  the  arts have provided students with an opportunity to not only have their work displayed,  but also to have their work contribute to the  purchase of supplies that allow other students  to produce further works of art.  I ask  that my colleagues  join me  in congratulating Ms. Allen on this momentous occasion. Her dedication to the art will ensure that  the students of Philadelphia’s public schools  continue to have access to the supplies that  will allow them to fully realize their creative potential.  f  TRIBUTE TO MR. CHARLIE  BURRELL  HON. DIANA DeGETTE  OFCOLORADO  INTHEHOUSEOFREPRESENTATIVES  Friday, February 11, 2011  ",2011
82,House,112,-0.451,5,2011-02-17,Mr. SCOTT of Virginia.," Mr. Speaker,  I yield the gentlewoman an additional  minute.  ",2011
83,House,112,0.913,19,2011-02-17,Mr. BROUN of Georgia.," Thank you,  chairman. I appreciate your willingness to work with me.  AMENDMENTNO. 189OFFEREDBYMS. WOOLSEY  ",2011
84,House,112,0.332,19,2011-02-17,Mr. ROGERS of Kentucky.," Mr. Chairman, I reserve a point of order on the  gentlelady’s amendment.  ",2011
85,House,112,-0.312,19,2011-02-17,Mr. DICKS., I move to strike the requisite number of words.  The CHAIR. The  gentleman  from  Washington  is recognized  for 5 minutes.  ,2011
86,House,112,0.325,19,2011-02-17,Mr. YOUNG of Florida.," I thank the  gentleman for yielding.  Mr. Chairman, I rise in opposition to  the amendment. We just had a very  good colloquy on the issue of the EFV  and we think we have a solution here  that is good for the taxpayer, is good  for the Marine Corps, and is good for  the Marines. Here’s an opportunity to  get something for the $3 billion that  we’ve already spent on this program.  So I must be opposed to that.  On the V–22, we’ve already voted on  that once during the earlier procedures  on this bill. The V–22 did have some developmental problems years ago. The  V–22 is a most effective weapon being  used  in Afghanistan. Because of the  high mountains, because of the high altitudes, because of the weather, the V–  22 is the vehicle of choice to move our  war fighters from where they are to  where they have to be.  I would hope that the vote would be  the same on this amendment as it was  earlier on the V–22, and that’s to defeat  it. Here is an airplane—the Marines use  this V–22 in Afghanistan on a regular  basis because it has the capability that  the CH–46 does not have. It has the  ability for altitude, it has the ability  for speed, and it is an outstanding aircraft today.  Mr. VAN HOLLEN. Mr. Chair, although  I  support Secretary Gates’ call to terminate the  Expeditionary Force Vehicle (EFV), I must unfortunately oppose  the Woolsey amendment  because  it also seeks  to cancel  the Osprey  program, whose termination I do not support.  The EFV is clearly not a wise use of American tax dollars. It is 14 years behind schedule  and estimated to cost 168 percent more than  originally estimated. Because of  these realities, along with the evolving nature of naval  warfare, Secretary Gates, the Secretary of the  Navy and  the Commandant of  the Marine  Corps have all recommended that it be terminated—and  it was not  included  in President  Obama’s FY 12 Budget. By contrast, after  overcoming a number of operational and cost  concerns, the Osprey has become a top priority  for  the Marine Corps and does enjoy  command support.  If I could split this amendment into two separate votes, I would do so. Since I cannot, I  will oppose it and continue to pursue a deliberate, program by program approach to finding  needed savings in our defense budget.  ",2011
87,House,112,0.36,19,2011-02-17,Mr. ADERHOLT.," Mr. Chairman,  move to strike the last word.  ",2011
88,House,112,0.453,19,2011-02-17,Mr. MICA.," Mr. Chairman and Mr.  ADERHOLT, first of all, I want to thank  you for recognizing me and also giving  me this opportunity to speak on my  amendment which in consultation with  you, Mr. Chairman, I will withdraw and  not offer.  That  is amendment,  I believe  it’s  numbered  543  as  printed.  Mr.  ADERHOLT, first I want to thank you  for your pledge to continue to work  I  VerDate Mar 15 2010  08:21 Feb 18, 2011 Jkt 099060 PO 00000 Frm 00019 Fmt 7634 Sfmt 0634 E:\CR\FM\K17FE7.049 H17FEPT1 E S U O H h t i w D O R P 1 B Y O S 8 J K S D n o l l e b j         ",2011
89,House,112,0.554,26,2011-02-17,Mr. STEARNS.," I would just close by  saying  it  is not appropriate  for the  unelected FCC to regulate interstate  communication  services  on  barely  more than a whim and without any additional input from the United States  Congress.  If  left unchallenged,  this  claim of authority would allow  the  FCC to do anything, anything it could  allege  to  promote  broadband under  their  jurisdiction, which  they don’t  have.  So Congress must stop the FCC. This  amendment will do that just by preventing any money from being spent to  implement these rules. I urge its adoption.  I yield back the balance of my time.  ",2011
90,House,112,-0.473,26,2011-02-17,Mr. WAXMAN.," Mr. Chairman, I move  to strike the last word.  ",2011
91,House,112,0.752,26,2011-02-17,Mr. GRAVES of Georgia.," Mr. Chairman, I move to strike the last word.  ",2011
92,House,112,0.269,33,2011-02-17,Mr. KINZINGER of Illinois.," I move to  strike the last word, ",2011
93,House,112,0.2,33,2011-02-17,Mr. DOLD.," Mr. Chair,  I move  to  strike the last word.  ",2011
94,House,112,-0.302,40,2011-02-17,Mr. MORAN., Will  yield?  ,2011
95,House,112,0.293,40,2011-02-17,Mr. SIMPSON., I yield to my friend  from Virginia.  ,2011
96,House,112,0.528,47,2011-02-17,Mr. BARTON of Texas.," Mr. Chairman, I move to strike the requisite  number of words.  ",2011
97,House,112,0.612,47,2011-02-17,Mr. AKIN., I believe he has an amendment to  the amendment.  ,2011
98,House,112,0.467,47,2011-02-17,Mr. CARTER., Will  the gentleman  yield?  ,2011
99,House,112,-0.491,47,2011-02-17,Mr. SERRANO., I move to strike the  last word.  ,2011
100,House,112,0.269,54,2011-02-17,Mrs. EMERSON.," Mr. Chairman, I rise  in opposition to this amendment.  ",2011
101,House,112,-0.499,54,2011-02-17,Mr. FRANK of Massachusetts., Will  the gentlewoman yield?  ,2011
102,House,112,0.628,61,2011-02-17,Mr. NEUGEBAUER.," Madam Chair, I  move to strike the last word.  ",2011
103,House,112,-0.543,61,2011-02-17,Mr. ELLISON.," Madam Chair, I move  to strike the last word.  ",2011
104,House,112,0.348,68,2011-02-17,Mr. LEWIS of California.," Madam Chair, during voting on Walden Amendment No. 404 to  H.R. 1, I intended to vote ‘‘yes’’ in support of  the amendment, but accidentally voted  ‘‘no’’  due to the confusion of two-minute voting increments on a long series of amendments.  AMENDMENTNO. 516OFFEREDBYMR. CAMP  ",2011
105,House,112,-0.279,75,2011-02-17,Mr. POLIS.," Mr. Chairman, I move to  strike the last word.  ",2011
106,House,112,-0.509,75,2011-02-17,Mr. NADLER.," I thank the gentleman  for his remarks and for yielding.  I just want to make one comment on  what was said a moment ago by the  gentleman from Florida. This amendment reduces funding in this CR to $10  billion. It should be enough to withdraw the troops. But the argument was  made that to reduce the funding is not  to support our troops, to rob them of  the implements of doing their job. But  the fact is that the only power that  Congress has to effectuate the war-  making power, to control whether we  should be at war somewhere or another, is the power of the purse.  We are not saying, by adopting this  amendment, we would not be saying  that we want our troops there with no  weapons and so forth. We would be saying use the funds to bring the troops  home.  It  is more supportive of the  troops to bring them home from a war  that they should not be fighting, that  is not vital to our national security, it  is more supportive to bring them home  than  it  is to give them weapons to  fight an unnecessary war  in which  some of them, unfortunately, will lose  their lives.  So I say support our troops. Bring  them home. Support the country. Stop  fighting where it doesn’t make sense,  and spend our military resources where  it helps the national security of the  United States, which is not in Afghanistan right now.  ",2011
107,House,112,-0.519,82,2011-02-17,Mr. TOWNS.," Mr. Chairman, I move  to strike the last word.  ",2011
108,House,112,0.496,89,2011-02-17,Mrs. HARTZLER.," Madam Chair,  move to strike the last word.  ",2011
109,House,112,-0.389,89,2011-02-17,Mrs. CAPPS.," Madam Chair, I move to  strike the last word.  ",2011
110,House,112,0.503,96,2011-02-17,Mr. CULBERSON., I move to strike  the last word.  ,2011
111,Senate,112,0.356,117,2011-02-17,Mrs. HUTCHISON.," Madam President,  I wish to ask the Senator from Arizona  to engage in a colloquy with myself  and Senator ROCKEFELLERand any others who wish to speak within this colloquy regarding an issue that was not  able to be resolved because of the time  constraints.  I want to say that every stakeholder  representing  constituents  all  over  America gave greatly to adopt this  amendment that will have, in my opinion, a responsible relaxation of the perimeter rule at Washington National  Airport.  We can talk about the details certainly as we move forward, but there  was one major  issue  left unresolved  that I think deserves a colloquy so we  know what we have to do to finish this  process in conference before we adopt  an FAA bill that is a very important  bill for our country.  I ask the Senator from Arizona to  state his concerns about the unfinished  part of this bill, and then we will open  it for discussion.  ",2011
112,Senate,112,0.548,117,2011-02-17,Mr. KYL.," Madam President, first, I  ask unanimous consent that the cloture vote on the underlying bill occur  at 2 p.m. today.  ",2011
113,Senate,112,-0.194,117,2011-02-17,Mr. WARNER.," Madam President, let  me thank the chair and the ranking  member  for their  leadership on this  issue. Along with my colleagues from  Maryland, we have the airports that  are most affected by these changes, and  we have worked in that spirit of compromise. As the Senator from Arizona  noted, I don’t think anyone is totally  satisfied.  I wish to particularly single out the  ranking member and the chair for their  willingness to acknowledge our work  on the issue of the effects of these additional flights. Going up from where the  House position was and  the airport  authority’s original position was  to  make sure—vis-a-vis Dulles—that the  economic effects of this and the question  involving  the potential  shared  debt service between the two airports  be addressed. This was an issue, again,  that we were not able to resolve, but I  appreciate the chair, the ranking member and their staffs’ willingness to continue to work as this bill goes to conference.  It is very important that we get this  bill passed and we move forward on  NextGen and all the other important  parts of the FAA bill.  ",2011
114,Senate,112,0.552,131,2011-02-17,Mr. INHOFE.," Mr. President, Senator  LEAHY is somewhere around here. But  since he is not on the floor, I will go  ahead and present this amendment.  This is a Leahy-Inhofe amendment.  It is on two almost unrelated things,  but the Leahy portion of the amendment extends the public safety officer  program benefits from 6 to 10 families  whose  loved ones died  in voluntary  services. It is fully offset for 10 years.  The important part of this amendment is mine, and that is—if I could  have your attention over here, and I  am speaking to the Republicans now,  we have been trying to do this for a  number of years, and Senator LEAHY  and I have agreed to this. Those of us  who have been pilots—and I have been  for 55 years—I have been involved in a  lot of humanitarian missions. What  this does is offer liability protection to  those of us who volunteer ourselves,  our money, and our aircraft to do missions no one else will do. They are humanitarian missions. The longest one I  did was all the way down to Dominica,  North of Caracas, Venezuela, through  two hurricanes, and we saved a lot of  lives down there. This would offer liability protection to those individuals  who make those sacrifices.  There are 8,000 of us, by the way,  around the country, I am sure from  every State  represented here. So  I  would encourage my colleagues to support the amendment.  ",2011
115,Senate,112,0.782,131,2011-02-17,Mr. COBURN.," Mr. President, I have  no problem at all with my senior Senator’s modification to the amendment.  I am going to ask to have a voice vote  on  this  to accommodate everybody,  recognizing the late hour, but I want to  make a point. What Senator LEAHY  wants to do is great to help people. But  the one question we have not asked is—  and we are going to be asked to ask it  all the time from here forward given  where we are—is it a Federal responsibility to supply these benefits? You  can’t find it in the Constitution. You  can’t find it anywhere.  When we look at the hard decisions  we are going to have to make over the  next 2 years in terms of trimming both  mandatory programs and discretionary  programs, where we set an example  that we are going to expand something  that is not in our constitutional role,  we are making a mistake and we are  setting ourselves up for failure.  ",2011
116,Senate,112,-0.351,152,2011-02-17,Mr. SCHUMER.," Mr. President, the  Committee on Rules and Administration has adopted rules governing its  procedures for the 112th Congress. Pursuant to Rule XXVI, paragraph 2, of  the Standing Rules of the Senate, on  behalf of myself and Senator ALEXANDER, I ask unanimous consent that a  copy of the committee rules be printed  in the RECORD.  There being no objection, the material was ordered to be printed in the  RECORD, as follows:  COMMITTEE ON RULES AND ADMINISTRATION RULES OF PROCEDURE  TITLEI—MEETINGSOFTHECOMMITTEE  1. The regular meeting dates of the Committee  shall  be  the  second  and  fourth  Wednesdays of each month, at 10:00 a.m. in  room SR–301, Russell Senate Office Building.  Additional meetings of the Committee may  be called by the Chairman as he may deem  necessary or pursuant to the provision of  paragraph 3 of Rule XXVI of the Standing  Rules of the Senate.  2. Meetings of the committee, including  meetings to conduct hearings, shall be open  to the public, except that a meeting or series  of meetings by the committee on the same  subject for a period of no more than 14 calendar days may be closed to the public on a  motion made and seconded to go into closed  session to discuss only whether the matters  enumerated  in subparagraphs  (A) through  (F) would require the meeting to be closed  followed immediately by a recorded vote in  open session by a majority of the Members of  the committee when it is determined that  the matters to be discussed or the testimony  to be taken at such meeting or meetings:  A. will disclose matters necessary to be  kept secret in the interests of national defense or the confidential conduct of the foreign relations of the United States;  B. will relate solely to matters of the committee staff personnel or internal staff management or procedure;  C. will tend to charge an individual with  crime or misconduct, to disgrace or injure  the professional standing of an individual, or  otherwise to expose an individual to public  contempt or obloquy, or will represent a  clearly unwarranted invasion of the privacy  of an individual;  D. will disclose the  identity of any  informer or law enforcement agent or will disclose any information relating to the investigation or prosecution of a criminal offense  that is required to be kept secret in the interests of effective law enforcement;  E. will disclose information relating to the  trade secrets or financial or commercial information pertaining specifically to a given  person if:  (1) an Act of Congress requires the information to be kept confidential by Government officers and employees; or  (2) the information has been obtained by  the Government on a  confidential basis,  other than through an application by such  person for a specific Government financial or  other benefit, and is required to be kept secret in order to prevent undue injury to the  competitive position of such person; or  F. may divulge matters required to be kept  confidential under the provisions of law or  Government regulations. (Paragraph 5(b) of  rule XXVI of the Standing Rules.)  3. Written notices of committee meetings  will normally be sent by the committee’s  staff director to all Members of the committee at least a week in advance. In addition, the committee staff will telephone or e-  mail reminders of committee meetings to all  Members of the committee or to the appropriate assistants in their offices.  4. A copy of  the committee’s  intended  agenda enumerating separate items of legislative business and committee business will  normally be sent to all Members of the committee and released to the public at least 1  day in advance of all meetings. This does not  preclude any Member of the committee from  discussing appropriate non-agenda topics.  5. After the Chairman and the Ranking Minority Member,  speaking  order  shall  be  based on order of arrival, alternating between Majority and Minority Members, unless otherwise directed by the Chairman.  6. Any witness who is to appear before the  committee in any hearing shall file with the  clerk of the committee at least 3 business  days before the date of his or her appearance,  a written statement of his or her proposed  testimony and an executive summary thereof, in such form as the chairman may direct,  unless the Chairman and the Ranking Minority Member waive such requirement for good  cause.  7. In general, testimony will be restricted  to 5 minutes for each witness. The time may  be extended by  the Chairman, upon  the  Chair’s own direction or at the request of a  Member. Each round of questions by Members will also be limited to 5 minutes.  TITLEII—QUORUMS  1. Pursuant to paragraph 7(a)(1) of rule  XXVI of the Standing Rules, a majority of  the Members of the committee shall constitute a quorum for the reporting of legislative measures.  2. Pursuant to paragraph 7(a)(1) of rule  XXVI of the Standing Rules, one-third of the  Members of the committee shall constitute a  quorum for the transaction of business, including action on amendments to measures  prior to voting to report the measure to the  Senate.  3. Pursuant to paragraph 7(a)(2) of rule  XXVI of the Standing Rules, 2 Members of  the committee shall constitute a quorum for  the purpose of taking testimony under oath  and 1 Member of the committee shall constitute a quorum for the purpose of taking  testimony not under oath; provided, however, that in either instance, once a quorum  is established, any one Member can continue  to take such testimony.  4. Under no circumstances may proxies be  considered  for  the  establishment  of  a  quorum.  TITLEIII—VOTING  1. Voting in the committee on any issue  will normally be by voice vote.  2. If a third of the Members present so demand a roll call vote instead of a voice vote,  a record vote will be taken on any question  by roll call.  3. The results of roll call votes taken in  any meeting upon any measure, or any  amendment thereto, shall be stated in the  committee report on that measure unless  previously announced by the committee, and  such report or announcement shall include a  tabulation of the votes cast in favor of and  the votes cast in opposition to each such  measure and amendment by each Member of  the committee. (Paragraph 7(b) and (c) of  rule XXVI of the Standing Rules.)  4. Proxy voting shall be allowed on all  measures and matters before the committee.  However, the vote of the committee to report a measure or matter shall require the  concurrence of a majority of the Members of  the committee who are physically present at  the time of the vote. Proxies will be allowed  in such cases solely for the purpose of recording a Member’s position on the question  and then only in those instances when the  absentee committee Member has been  informed of the question and has affirmatively  requested that he be recorded. (Paragraph  7(a)(3) of rule XXVI of the Standing Rules.)  TITLEIV—AMENDMENTS  1. Provided at least five business days’ notice of the agenda is given, and the text of  the proposed bill or resolution has been made  available at least five business calendar days  in advance, it shall not be in order for the  Committee to consider any amendment in  the  first degree proposed to any measure  under consideration by the Committee unless such amendment has been delivered to  the office of the Committee and circulated  via e-mail to each of the offices by at least  5:00 p.m. the day prior to the scheduled start  of the meeting.  2. In the event the Chairman introduces a  substitute  amendment  or  a  Chairman’s  mark, the requirements set forth in Paragraph 1 of this Title shall be considered  waived unless such substitute amendment or  Chairman’s mark has been made available at  least five business days in advance of the  scheduled meeting.  3. It shall be in order, without prior notice,  for a Member to offer a motion to strike a  single  section of any bill,  resolution, or  amendment under consideration.  4. This section of the rule may be waived  by agreement of the Chairman and the Ranking Minority Member.  TITLEV—DELEGATIONOFAUTHORITYTO  COMMITTEECHAIRMAN  1. The Chairman is authorized to sign himself or by delegation all necessary vouchers  and routine papers for which the committee’s approval is required and to decide in  the committee’s behalf all routine business.  2. The Chairman is authorized to engage  commercial reporters for the preparation of  transcripts of committee meetings and hearings.  3. The Chairman is authorized to issue, in  behalf of the committee, regulations normally promulgated by the committee at the  beginning of each session.  TITLEVI—DELEGATIONOFAUTHORITYTOCOMRANKINGMINORITY  MITTEE CHAIRMAN AND MEMBER  The Chairman and Ranking Minority Member, acting jointly, are authorized to approve  on behalf of the committee any rule or regulation for which the committee’s approval is  required, provided advance notice of their intention to do so is given to Members of the  committee.  f  COMMITTEE ON SMALL BUSINESS  AND ENTREPRENEURSHIP RULES  OF PROCEDURE  ",2011
117,Senate,112,-0.203,152,2011-02-17,Ms. LANDRIEU.," Mr. President, the  Committee on Small Business and Entrepreneurship  today  adopted  rules  VerDate Mar 15 2010  08:49 Feb 18, 2011 Jkt 099060 PO 00000 Frm 00044 Fmt 0624 Sfmt 0634 E:\CR\FM\A17FE6.067 S17FEPT1 E T A N E S h t i w D O R P 1 C 2 8 P 5 D K S D n o r e k a l w p         ",2011
