,branch,congressID,ideology_score,page,part,speaker,speech,year
214,,112,-0.349,85,2011-04-15,Mr. BACA.," Mr. Speaker,  it  is with great  honor that I rise today and ask Congress to  recognize May 20th as TELACU Scholars  Day.  The TELACU Education Foundation was established  in 1983  to  respond  to crisis-level  dropout  rates  for Latino Students and has  since grown  into  the  largest community and  economic  development  corporation  in  the  United States. TELACU is a pioneering institution committed to service, empowerment, advancement and the creation of self-sufficiency  within the Latino community.  To  address  the  distinct  struggles many  Latino youth  face, TELACU established  the  LINC TELACU Education Foundation (LTEF).  For upwards of  two decades,  the Education  Foundation has been working towards removing the formidable barriers that could prevent  Latino youth from achieving academic success  and providing them with professional and academic role models. I am proud of the way the  LINC TELACU Education Foundation has contributed  to  the development of our  future  Latino leaders.  The TELACU Education Foundation realized  that there is no more vital asset in any community than its human capital and began their  efforts to reverse these trends. For instance,  The LINC TELACU Scholarship Program is an  exemplary program that helps students realize  their dream of a college education by providing scholarships and supplemental support.  Although TELACU understands  that  financial assistance is a vital component for college  students  to achieve academic success,  they  also  recognize  the  underlying  challenges  many  young  adults  face  including  socioeconomic  factors,  family responsibilities, cultural identity, and financial solvency. Students  who are the first member of their families to  pursue a college degree often must make their  own academic support system  in order  to  achieve  their dreams. TELACU understands  these challenges.  The LINC TELACU Scholarship Program  provides its youth not only with monetary assistance, but with  the counseling,  leadership  training, and  time management  training necessary to help students achieve their dreams.  Mr. Speaker, I ask my colleagues to join me  today to honor TELACU, the LINC TELACU  Education Foundation and for Scholarship programs like this one, for believing in the dream  of higher education for all of America’s next  generation of leaders. I extend my congratulations to the TELACU scholars and the people  who make their dreams a reality as they celebrate  the 28th Annual TELACU Education  Foundation Scholarship Awards Dinner, Building the Dream, on Friday May 20th, 2011.  f  ARMENIA REMEMBRANCE DAY  HON. DOUG LAMBORN  OFCOLORADO  INTHEHOUSEOFREPRESENTATIVES  Friday, April 15, 2011  ",2011
215,,112,0.69,85,2011-04-15,Mr. LAMBORN.," Mr. Speaker, on April 24,  2011, the world will commemorate Armenian  Remembrance Day and remember  the one-  and-a-half million Armenians that endured unspeakable suffering and loss at the hand of  the Ottoman Empire during World War I.  In addition to the loss of so many Armenian  lives, the twentieth century also bore witness  to the loss of six-million Jews and four-hundred  thousand other persons deemed  ‘‘non-  desirable’’ by the Nazis, the loss of millions of  lives in Russia and in China by communist tyrannies, and modern day horrors in Cambodia,  Rwanda, and Darfur. All too often, we have  not learned from past genocides. As the Universal Declaration of Human Rights states ‘‘No  one shall be subjected to torture or to cruel,  inhuman or degrading  treatment or punishment’’ and that ‘‘Everyone has the right to life,  liberty and security of person.’’  Though nothing changes the fact that mass  killings and unspeakable acts of brutality occurred, today I wish to learn from the past to  better bring about hope for a brighter, more  peaceful future and reconciliation of the people of Armenia and Turkey.  Only with a thorough examination of history  and open acknowledgement of  the past will  fully underthe Armenians be  the plight of  stood.  As we continue confronting atrocities taking  place today, and seek to prevent them from  occurring in the future, we must also be resolute in acknowledging genocides of the past.  f  A TRIBUTE TO SARAH SAVAGE  RAYMOND  HON. EDOLPHUS TOWNS  OFNEWYORK  INTHEHOUSEOFREPRESENTATIVES  to  today  Friday, April 15, 2011  ",2011
216,,112,-0.519,85,2011-04-15,Mr. TOWNS.," Mr. Speaker,  I rise  recognize Sarah Savage Raymond.  Sarah Savage Raymond has been a resident of Brooklyn since 1927, when, at the age  of 22, she moved from her home in Baltimore.  During her more  than 80 years  in Brooklyn  and  the Tenth Congressional district, Mrs.  Raymond has been a positive example for all  and a valued member of her community.  Mrs. Sarah Savage Raymond has been involved with the First AME Zion Church, originally the Fleet Street Church, since she first  moved  to New York and remains an active  participant. The First AME Zion Church  is  where Sarah met and married her husband,  Mr. Robert Raymond and where she became  involved in her adopted community, becoming  a member in the lodge and on the committee  visiting the sick.  Through more than a century of life, Mrs.  Raymond has kept her indomitable spirit and  remains alert and energetic. Although Mrs.  Raymond has no biological children, she has  three very close relatives that are extremely  supportive of her who live in the Bronx, New  Jersey and Pennsylvania. She also has  five  nieces and nephews that reside in Maryland  that also keep in touch with her. Mrs. Sarah  Savage Raymond has seen and heard what  most of us could only read in history books  and she is always willing to share her experiences with those who are interested in listening.  Mrs. Raymond says that she is ‘‘thankful’’ to  be one hundred six years of age because she  did not expect to live this long. She adds, ‘‘I  appreciate every year and did the best that I  could.’’ It is precisely this humble and exemplary attitude  that has preserved Mrs. Raymond in health and happiness for so long.  Mr. Speaker, I would like to recognize Mrs.  Raymond  for her extraordinary accomplishments and her spirit which reflect the best our  nation has to offer.  f  RECOGNIZING THE 30TH ANNIVERSARY OF THE FIRST FLIGHT OF  THE SPACE SHUTTLE  HON. EDDIE BERNICE JOHNON  OFTEXAS  INTHEHOUSEOFREPRESENTATIVES  Friday, April 15, 2011  ",2011
217,,112,-0.385,92,2011-04-15,Ms. SPEIER.," Mr. Speaker,  I rise  to celebrate the retirement of Mike Murphy, the San  Mateo County Counsel.  I had the great privilege to work with Mike  when  I was a member of  the San Mateo  County Board of Supervisors. He is an exceptional  public  servant,  legal  expert,  human  being and a dear friend.  Mike was born in Yokohama, Japan on November 17, 1948 as the son of a military family. He went to Pacific Grove High School from  where he graduated  in 1966. He  then attended  the U.S. Military Academy at West  Point and graduated in 1970. He later served  on the Military Academy Advisory Committee.  Mike laid the ground work for his legal career at Boalt Hall School of Law at UC Berkeley. He graduated in May of 1978 and just six  months  later was admitted  to  the California  Bar.  In May of 1982, Mike started serving in the  office of the San Mateo County District Attorney. In 1987, the civil division of the office became the San Mateo County Counsel where  Mike continued  to serve. He was appointed  one of two Chief Deputies in 1998 and Assistant County Counsel in 2006. In 2007, he became Counsel until his retirement on March  18, 2011.  Mike served as the principal land use attorney for 22 years, a pressure cooker of a job  that he made appear effortless. Among his  highest achievements were the defense of the  County’s Local Coastal Program and Measure  A, a coastal protection initiative and the defense of Measure T, authorizing  the Devil’s  Slide tunnel bypass. During his entire career,  Mike worked as a legal advisor on the San  Bruno Mountain Habitat Conservation Plan, a  landmark  environmental  document  that  he  demonstrated his legal skill in drafting.  In 1988, Mike and San Mateo County celebrated a  true David vs. Goliath victory. The  Port of Oakland was about to dump 7 million  tons of dredged spoils into the ocean off the  San Mateo coast. The Half Moon Bay Fishermen’s Marketing Association filed a lawsuit to  stop  the dumping but  lost  in  federal court.  Mike and his colleague Stephen Toben studied the case and filed a suit for injunctive and  declaratory relief. It was their legal expertise  and perseverance that resulted in a victory in  front of the California State Court of Appeals.  While  I was  in  the California Senate  in  2003, Mike defended my financial privacy legislation and faced strong opposition from multinational conglomerates. Again, his outstanding  legal acumen  succeeded  in protecting  the  rights of San Mateo County residents.  Mike has also been serving on the Military  Academy Advisory Committee  for  the 12th  Congressional District for many years, helping  select  the next generation of America’s officers.  Mike is the loving husband of Gayle Murphy, his wife of 28 years, and the proud parent of their two daughters Erin and Shannon.  In his well deserved retirement, Mike will undoubtedly enjoy  the additional  time he will  have to read and attend San Francisco Giants  games.  Mr. Speaker, I ask this body to rise with me  to honor an extraordinary man, Mike Murphy,  for his dedication to public service and justice  in San Mateo County.  f  CELEBRATION OF ANTIQUE  TRACTOR PRESERVATION DAY  HON. JO ANN EMERSON  OFMISSOURI  INTHEHOUSEOFREPRESENTATIVES  Friday, April 15, 2011  ",2011
218,,112,0.269,92,2011-04-15,Mrs. EMERSON.," Mr. Speaker, I rise to recognize the celebration of Antique Tractor Preservation Day in West Plains, Missouri. West  Plains, Missouri represents a growing community that is creating a new tradition for tractor  enthusiasts across the country.  Antique tractors and farm machinery serve  as a reminder of a key part of our nation’s agricultural heritage. Antique Tractor Preservation Day provides an opportunity  to display  these  tractors  in a venue where enthusiasts  can share their stories with one another. Enthusiasts who share this common interest can  share their passions for buying and restoring  Antique Tractors.  Antique Tractor Preservation Day also provides others, who might not be enthusiasts, an  opportunity  to  learn more about agricultural  history and  to better understand and appreciate  the significant advancements American  agriculture has made over the last century. It  is  important  to carry on  this  legacy by preserving our antique  tractors  for generations  into the future.  Mr. Speaker,  I commend Michael Hinton  and the West Plains community for their work  in creating an opportunity  for enthusiasts  to  come together and to celebrate this proud heritage and rich history.  f  TRASH REDUCTION ACT OF 2011  HON. JAMES P. MORAN  OFVIRGINIA  INTHEHOUSEOFREPRESENTATIVES  Friday, April 15, 2011  ",2011
219,,112,-0.502,99,2011-04-15,Mr. MARKEY.," Mr. Speaker,  today, we remember and honor the victims of the Armenian Genocide, and we call, once again, for  passage of a resolution affirming the Armenian  Genocide in the U.S. Congress.  Between 1915 and 1923, a campaign conceived and executed by the Ottoman Empire  forcibly deported nearly 2 million Armenians  from  their homes, resulting  in  the deaths of  1.5 million innocent children, women and men.  The history surrounding  this  issue  is abundantly clear—genocide did occur.  While the target of this campaign of extermination was  the Armenian people,  it was  indeed a crime against all people—and we must  not forget lest we let it happen again. On this  day every year, communities across our nation  and across  the world come  together  to  remember this great tragedy. On this day, we  are all Armenians.  The  term  ‘‘genocide’’ had not  yet been  coined in 1915, when the first Armenians were  driven from their homes. The definition of this  most profound crime against humanity came  in 1944 from Raphael Lemkin, a Polish Jew  who  survived  the Holocaust by  fleeing  to  America after the fall of Warsaw to the Nazis.  In the wake of World War Two, Lemkin led the  international community to establish the United  Nations Convention on  the Prevention and  Punishment of Genocide. Lemkin’s definitive  example of genocide was the crimes against  the Armenians.  And as we commemorate  the Armenian  Genocide, we must  redouble our efforts  to  stop similar crimes being committed  today.  The scorched  towns of Darfur,  in western  Sudan, continue to suffer mass murder, displacement, rape, and torture at the hands of  the government and  its militia allies.  In  the  Democratic Republic of  the Congo, armed  forces continue  to  target ethnic populations  with abductions and violence, leading to more  than 5.4 million civilian deaths in the past 15  years. And just weeks ago, the humanitarian  group Doctors Without Borders was forced to  suspend clinics in eastern Congo due to attacks from armed Congolese soldiers. These  ongoing genocides must be stopped.  Immediately.  In order to eliminate these genocides in the  future, we must keep alive the memories of  genocides past.  The U.S. House of Representatives has had  before  it,  for many years now, a  resolution  which clearly affirms the United States record  on  the Armenian Genocide.  I have been a  strong supporter and vocal cosponsor of this  resolution in every Congress, and I remain so  today.  Last year, when  the Foreign Affairs Committee voted in support of the resolution, Turkey  recalled  its Ambassador  to  the United  States. Turkey’s leaders continue to say that  properly recognizing  the Armenian Genocide  will harm U.S.-Turkey relations—that it is not  the right time to pass this resolution. But it is  always ‘‘the right time’’ for the truth.  Already, 43 states and 20 nations have officially recognized the Armenian Genocide, and  it is time for the United States to do the same.  After all, how can we have the moral authority  to call out and condemn  the genocides  in  Darfur or Rwanda when we are unable to acknowledge the tragedy of Armenia? I look forward to the day that this truth can be spoken  aloud, in one voice, by our government, and  by governments around the world. Because it  is the truth.  In 2009, the governments of Turkey and Armenia announced a roadmap for normalizing  relations between the two countries. In a process brokered by Secretary of State Hillary  Clinton, the two countries signed protocols to  resume diplomacy and end the Turkish blockade of Armenia. However, before the ink had  dried on  those accords,  the Turkish government backtracked on its commitment by adding additional preconditions.  The people of Armenia continue to face the  devastating hardships wrought by  the dual  blockades of Turkey and Azerbaijan. These  VerDate Mar 15 2010  04:26 Apr 16, 2011 Jkt 099060 PO 00000 Frm 00039 Fmt 0626 Sfmt 9920 E:\CR\FM\A15AP8.094 E15APPT1 S K R A M E R h t i w D O R P 1 9 Z 8 H V D K S D n o l l e b j         ",2011
220,House,112,0.742,9,2011-05-02,Mr. STUTZMAN.,"  I thank my colleague, Congressman BURTON, for his  comments.  What a momentous day, as he said,  that we can all take courage and to  look to the future, but as well as celebrate the ending of a chapter that has  caused so much pain and so much fear  in the lives of many Americans.  Three weeks after my wife and I had  our  first born  child, our American  homeland was attacked by terrorists  on September 11, 2001. As I held my  baby boy, I knew that I had to do something, and ensuring the future security  of my two sons is the reason I ran for  the U.S. Congress.  The terrorist attacks on 9/11 tested  our security, our defense, and our fortitude in protecting our country, but  we have not stood idly by. For nearly  10 years now, our American soldiers  have given their lives every day in Operation New Dawn, Operation Enduring  Freedom, and now Operation Odyssey  Dawn to protect our Nation and to secure justice. Their service demands respect and admiration.  b1920  Last night, justice was served. bin  Laden has been the leader and the symbol of al Qaeda for more than 20 years,  continually plotting attacks against  the United States and its allies.  The word ‘‘Qaeda’’ means foundation  or base. Osama bin Laden was the head  of  this  foundation,  the  face of  terrorism around the world, a foundation  upon which its members expected to  erect a vigorous, widespread network  spreading terror around the world.  Well, folks, we have beheaded their  foundation. We  have  beheaded  al  Qaeda. And should they continue, we  will be glad to bring justice and help  them join their leader once again if  they so choose.  We must continue to fight. Our third  President, Thomas Jefferson, said this:  ‘‘Eternal vigilance is the price of freedom.’’  We must use our strength and cultivate our relationships with the people around the world to ensure we take  a  stand against cruel dictatorships,  tyranny and radical Islam.  As I work with Congress and military  commanders,  I will  fight  to honor  those who have died to secure our freedom because they deserve our utmost  respect, and we  should only be  so  grateful.  I  congratulate  the men  and  the  women of our military and intelligence  communities who have devoted their  lives to this mission. For this, our soldiers have America’s boundless gratitude.  I also want to commend and congratulate President Obama and President Bush for their determination and  their willingness to continue the fight,  to pursue Osama bin Laden, who has  been the eluding terrorist, the face of  terrorism  around  this  world.  And  today, freedom has been victorious.  I am honored to represent the people  of  Indiana’s Third District and am  proud of Indiana’s 14,700 members of  the  Indiana Army and Air National  Guard. It  is the dedication of these  men and women and their families who  have brought the leader of al Qaeda to  justice and will continue to bring justice to those who seek to destroy freedom and destroy America.  As Winston Churchill once said: We  sleep safe in our beds because rough  men stand ready in the night to visit  violence on those who would do us  harm.  So, Mr. Speaker,  today  is one of  those days that I didn’t know that I  would ever see, but stand here knowing  that we have been victorious, but also  know that the fight in front of us is not  over with; that we will continue to be  vigilant;  that we will  support  our  troops, our men and our women, our  Commander-in-Chief  in this  fight on  terrorism.  ",2011
221,House,112,0.585,9,2011-05-02,Mr. BURTON of Indiana.," I thank my  good  friend, Congressman STUTZMAN,  for his remarks, and I really appreciate  you taking your time to come down  here tonight.  Congressman STUTZMANtalked a little bit about the military, and I really  appreciate that because we have thousands, hundreds of thousands of men  and women in the military defending  our freedoms all around the world, in  Afghanistan and in Iraq, and we have  them in Germany and we have them in  Korea. We have  them  in bases all  around the world making sure that the  freedoms we enjoy today and tonight  will be there tomorrow for us and our  kids and our grandkids.  But tonight I’d like to read a little  bit of an article that was written just  yesterday by a  fellow named Marc  Ambinder with the National Journal.  And I think it’s really well done, and it  points out all the hard work that went  into going after Osama bin Laden.  The  team  that killed Osama bin  Laden were members of the counterterrorism unit for the Navy, known as the  Navy SEAL Team 6. It’s a highly elusive group that was developed in the  1980s to rescue American hostages in  Iran. They exist outside the military  protocol and engage in operations that  are at the highest level of classification. The fact that Team 6 is front page  news today is a measure of how important the publicity about bin Laden’s  killing is to the U.S., because normally  you don’t hear about these guys.  The President gave the order on Friday morning for the operation to pursue bin Laden. The strike began early  Sunday morning, at the Ghazi Air Base  in Pakistan,  the MH–60 helicopters  made their way to Osama bin Laden’s  tightly guarded compound, which is 70  miles from the center of Islamabad.  The helicopter carrying the team of  SEALs malfunctioned. Can you imagine that? They’re over their target and  the helicopter  stops working. As  it  hovered outside the high walls, the  pilot gently landed inside the walls of  the 3-story condo, but he couldn’t get  the helicopter going again.  And  yet  the  assault  team  disembarked to raid the massive, walled  compound, prepared to take bin Laden  dead or alive, even though they knew  there was a chance they wouldn’t have  a ride back. Their lives were at risk,  and yet they went ahead and carried  out their mission.  Bin  Laden was  discovered  using  women as human shields as American  forces fired at him. One of the women  was his wife. Bin Laden was shot in the  face by the SEALs during a firefight  after  resisting capture. Three other  males were  killed  along with  bin  Laden. One of them was his adult son.  With the team still in the compound,  the commander on the ground told a  remote  commander  that  they  had  found bin Laden. The Special Forces  blew up  the malfunctioned chopper,  helicopter, then escaped in a reinforcement close to 4:15 p.m., just 40 minutes  after they landed.  The West Wing staff worked most of  the day on the operation. President  Obama joined senior national security  officials in the Situation Room that  afternoon as the  firefight was monitored.  Leon Panetta, one of our old colleagues here, was  in his conference  room at the CIA headquarters, which  he had turned into a conference center  to give him constant contact with the  tactical leaders of the strike team. And  I want to compliment Leon as well. I  hope he’s paying attention to this.  Less than 12 hours after the raid, bin  Laden’s body was taken to the aircraft  carrier, USS Carl Vinson, and he was  buried in the North Arabian Sea overnight. A DNA match from the remains  confirmed that bin Laden was dead at  age 54.  And of course President Obama made  the official announcement of his death  from  the East Room of  the White  House at 11:35 p.m., and he said what  all of us really agree with: ‘‘Justice has  been done.’’  VerDate Mar 15 2010  04:41 May 03, 2011 Jkt 099060 PO 00000 Frm 00009 Fmt 7634 Sfmt 0634 E:\CR\FM\K02MY7.021 H02MYPT1 E S U O H h t i w D O R P 1 9 Z 8 H V D K S D n o l l e b j         ",2011
222,House,112,0.407,16,2011-05-02,Mr. PAULSEN.,"  H.R.  58: Mr. BACA, Mr. LANKFORD, Mr.  DEFAZIO, Mr. DAVISof Kentucky, Ms. FOXX,  Mr. HANNA, and Mr. GRAVESof Georgia.  H.R. 114: ",2011
223,House,112,0.339,16,2011-05-02,Mr. WALDEN.,  H.R. 198: ,2011
224,House,112,-0.529,16,2011-05-02,Mr. HONDA.,  H.R. 282: ,2011
225,House,112,0.488,16,2011-05-02,Mr. NUNNELEE.,"  H.R. 303: Mr. FRANKof Massachusetts, Mr.  VISCLOSKY, Mr. CONYERS, Mr. PLATTS, and  Mr. LARSENof Washington.  H.R. 361: Mr. FITZPATRICK, Mr. HARPER, and  Mr. DAVISof Kentucky.  H.R. 374: Mr. FRANKSof Arizona.  H.R. 388: ",2011
226,House,112,-0.429,16,2011-05-02,Ms. BROWN of Florida.,"  H.R. 420: Mr. GRAVESof Georgia, Mr. DAVIS  of Kentucky, Mr. HANNA, Mr. HENSARLING,  Mr. BARTLETT, Mr. DEFAZIO, Mr. NUGENT,  Mr. LANKFORD, Mr. BACA, and ",2011
227,House,112,0.409,16,2011-05-02,Mr. GUTHRIE.,  H.R. 459: Mr. CULBERSONand ,2011
228,House,112,0.455,16,2011-05-02,Mr. GARDNER.,"  H.R. 466: Ms. SCHAKOWSKY, Mr. SERRANO,  Mr. COSTA, Mr. PAULSEN, Mr. WU, Mr.  MCGOVERN, Ms. RICHARDSON, Mr. FARR, Mr.  PIERLUISI, Mr. DOGGETT, Mr. GONZALEZ, Mr.  KILDEE, Mr.  of  Colorado, Mr.  of California, Mr. LEVIN, Mr. TIERNEY, Mr. SABLAN,  of  California, Mr. PAYNE, Mr. ELLISON, Mr.  KINGof New York, Mr. BRALEYof Iowa, Mr.  BUCHANAN, Mr.  of  Illinois, Ms.  HIRONO, Mrs. MILLERof Michigan, Mr. ALEXMr.  Ms.  LEE,  Mr.  CHAFFETZ, Ms. BERKLEY, Mr. HINCHEY, Mr.  MORAN, and ",2011
229,House,112,-0.488,16,2011-05-02,Mr. TIERNEY.,"  H.R. 601: Ms. HIRONO, Ms. KAPTUR, Mr.  COURTNEY, Ms. DELAURO, and Mr. BISHOPof  New York.  H.R. 605: Mr. NUNNELEE, Mr. SCALISE, and  Mr. COFFMANof Colorado.  H.R. 616: Mr. JOHNSONof Georgia.  H.R. 640: ",2011
230,House,112,0.426,16,2011-05-02,Mr. TERRY.,  H.R. 675: ,2011
231,House,112,0.471,16,2011-05-02,Mr. PEARCE.,"  H.R. 709: Mr. CAPUANO, Mr. BACA, and ",2011
232,House,112,-0.408,16,2011-05-02,Mr. ENGEL.,  H.R. 735: Mr. SOUTHERLANDand ,2011
233,House,112,-0.413,16,2011-05-02,Mr. MEEKS.,"  H.R. 865: Mr. TIERNEY, Mr. BOREN, and ",2011
234,House,112,0.324,16,2011-05-02,Mr. HECK.,  H.R. 881: ,2011
235,House,112,0.448,16,2011-05-02,Mr. NUNES.,  H.R. 905: Mr. DENTand ,2011
236,House,112,-0.302,16,2011-05-02,Ms. BERKLEY.,  H.R. 948: Mr. BORENand ,2011
237,House,112,0.219,16,2011-05-02,Mr. GRIMM.,"  H.R. 972: Mr. CHAFFETZ, Mr. MCKEON, Mr.  of Tennessee, Mr.  CRAWFORD, and ",2011
238,House,112,-0.348,16,2011-05-02,Mr. SCHIFF.,"  H.R. 1041: Mr. TIERNEYand Mr. BRADYof  Pennsylvania.  HELLER, Mr. DUNCAN VerDate Mar 15 2010  04:41 May 03, 2011 Jkt 099060 PO 00000 Frm 00016 Fmt 7634 Sfmt 0634 E:\CR\FM\L02MY7.001 H02MYPT1 E S U O H h t i w D O R P 1 9 Z 8 H V D K S D n o l l e b j         ",2011
239,Senate,112,-0.42,23,2011-05-02,Mr. BLUMENTHAL.,) The clerk will call the  roll.  The assistant legislative clerk proceeded to call the roll.  ,2011
