,branch,congressID,ideology_score,page,part,speaker,speech,year
115,,109,0.75,206,2005-03-10,Mr. TANCREDO.," Mr. Speaker, I would like  to submit the foreword to an article I authored  in  the Fall 2004 special migration  issue of  Mediterranean Quarterly. People on the Move:  The Security, Social, and Economic  Implications of Migration Foreword  The long cycles of history are revealing to  those who study  them but may harbor surprises for those who choose to ignore them.  The editors of Mediterranean Quarterly, cognizant of lessons learned or ignored, decided  to take a closer look at a pattern of history  that seems to be at the core of current global  instability:  the mass migration of people  in  search of basic means of survival, or just survival from brutal rulers.  On an annual basis, approximately 100 million people either attempt  to or actually do  leave  their place of birth, often not knowing  where they will end up. More than 10 million  illegal  immigrants have entered  the United  States since the last ‘‘amnesty’’ in 1986, and  the flow continues despite the promises of the  North American Free Trade Agreement. Close  to 1 million Albanians, almost one-fourth of the  country’s population, have sought  refuge  in  neighboring countries since  the collapse of  their country’s communist  regime. Tens of  thousands of Turks leave their country annually in search of work in Western Europe and  endure the consequences of cultural discrimination. More tragically, young women from the  poorest components of the former Soviet Empire have vanished into the jungle of human  trafficking and become commodities in an ugly  form of trade that is managed by the new barons of a dangerous underworld. Recent statistics assembled by Greek authorities estimate  that seventeen thousand women are being exploited by sex merchants in the Balkans alone.  Albanian mafia lords, in association with their  former enemies and with links all the way to  Afghanistan, control  lucrative drug, gun, and  human-smuggling operations across national  borders with relative impunity. And as in times  past, the Mediterranean Sea has become the  crossroads of people on  the move and  the  stage on which human tragedy unfolds almost  on a daily basis.  Human cargoes float from island to island in  the eastern Aegean, with boat crews waiting  for the opportunity to dump these people on  dry land, after having extracted the last ounce  of resources  from  their helpless victims. On  the African shores of Gibraltar, thousands of  Africans patiently wait for the first opportunity  to cross the narrow stretch of water and set  foot on European soil. Egyptians, Iraqis, Pakistanis, Filipinos, and Bangladeshis have landed on  Italian, Greek, French, and Spanish  shores over the years. They bring along their  poverty, their energies, and their hopes. They  also bring social, political, and now security  concerns.  More than a dozen scholars, policy makers,  and political leaders present diverse views on  this critical  issue  in  these pages. The  lead  essay, on  the security  implications of  illegal  migration for the United States, is written by  Congressman Tom Tancredo, Republican of  Colorado, and the unfolding drama of African  refugees  is provided by Francis M. Deng,  United Nations  representative  for  internally  displaced persons. Rochelle Gershuni, head of  Israel’s Ministry of Justice, addresses sex exploitation and human  trafficking and  its consequences for her country. Scholars of diverse  origins and  viewpoints deal with migration  issues  in Spain, Egypt, Turkey, and Greece  and  the South-North migration  in  the United  States and Canada. Naturally, we do not pretend that we provide a complete picture of a  huge historical phenomenon, but we do hope  to spark a debate on the social, policy, security, and economic  implications  caused by  ‘‘people on the move.’’  Historical patterns show  that mass population movements have altered cultures, demolished empires, given birth  to new ones,  and ultimately compelled humankind to organize itself into nation-states, with sovereignty  determining their national characters. Now the  nation-state that saw its birth in the Treaty of  Westphalia is in retreat as an organizing concept  of  human  events.  Multiculturalism,  globalization, poverty, and  the North-South  global economic divide have altered the patterns of civilization to a degree unprecedented  since  the eastern  tribes overwhelmed  the  Roman Empire and the Ottomans reached the  gates of Vienna.  The advanced  industrial democracies,  the  ultimate destination of people on  the move,  have shown a lack of vision about the implications of mass movements of people in search  of a livelihood. In their pursuit of high profits  with cheap  labor  in  the shortest  time,  they  have adopted  immigration policies  that no  longer facilitate the orderly integration of cultures and the peaceful evolution of new forms  of ethnic identity. Instead of inviting potential  citizens seeking a better life, the industrial nations have institutionalized the transplantation  of ethnic communities and have set in motion  a process for their own national balkanization.  The essays included in this special issue of  Mediterranean Quarterly (with more to follow  in future issues) examine problems caused by  migration both in countries of destination and  countries of origin. It behooves the first to examine  their social policies and  the  latter  to  come to grips with their inability to match national resources with their peoples’ needs. By  selectively examining problems on both sides  of the divide, the editors hope to spark a debate that will be grounded on the reality that  a silent invasion is under way that could, if left  unattended,  transform world politics and  foment global turmoil for generations to come.  f  PERSONAL EXPLANATION  HON. MELISSA L. BEAN  OFILLINOIS  INTHEHOUSEOFREPRESENTATIVES  Thursday, March 10, 2005  ",2005
116,,109,-0.155,206,2005-03-10,Ms. BEAN.," Mr. Speaker, on March 8, 2005,  having been unavoidably detained due to congressional business related to my work on the  Financial Services Committee, I was unable to  vote on Approving  the Journal  (Rollcall No.  53), H. Res. 133 (Rollcall No. 54), and H. Res.  122 (Rollcall No. 55). Had I been present, I  would have voted ‘‘aye’’ on all three measures  considered before the House.  f  RECOGNIZING  THE  ACCOMPLISHMENTS OF WEBB COUNTY SHERIFF RICK FLORES  HON. HENRY CUELLAR  OFTEXAS  INTHEHOUSEOFREPRESENTATIVES  Thursday, March 10, 2005  ",2005
117,,109,-0.225,206,2005-03-10,Mr. CUELLAR.," Mr. Speaker, I rise today to  recognize Webb County Sheriff Rick Flores for  a lifetime of dedication to law enforcement.  ∑ This ‘‘bullet’’ symbol identifies statements or insertions which are not spoken by a Member of the Senate on the floor. Matter set in this typeface indicates words inserted or appended, rather than spoken, by a Member of the House on the floor. VerDate Aug 04 2004  05:34 Mar 11, 2005 Jkt 039060 PO 00000 Frm 00001 Fmt 0626 Sfmt 9920 E:\CR\FM\K10MR8.001 E10PT1 ",2005
118,,109,-0.352,213,2005-03-10,Mr. ROTHMAN.," Mr. Speaker, I rise today to  join with my colleagues and Tibetan communities around  the world  to commemorate Tibetan Uprising Day, and to draw attention to  the continued serious human  rights abuses  committed by the People’s Republic of China.  On March 10, 1959, in reaction to rumors  that the Chinese were planning to kill or kidnap the Dalai Lama, thousands of Tibetan refugees  courageously  surrounded  the Dalai  Lama’s compound and began calling for the  Chinese to leave Tibet. This marked the beginning of the ‘‘Lhasa Uprising.’’ On March 17,  1959, fearing that Chinese troops would massacre the thousands of refugees who were refusing orders to disperse, the Dalai Lama disguised himself and took flight to India. Forty-  eight hours  later, believing  the Dalai Lama  was still inside, Chinese troops began shelling  his compound and other targets in Lhasa, killing  thousands of mostly unarmed civilians.  Chinese statistics estimate that 87,000 Tibetans  from all parts of Tibet were killed, arrested, or deported to labor camps during the  1959 Uprising. Only a small number of  the  thousands who fled to India survived Chinese  military attacks, malnutrition, cold and disease.  Over  the past 46 years, Tibetans  inside  Tibet and  in exile around  the world have  bravely  fought against  tremendous odds  to  preserve  their religious  identity, culture, and  history. It is estimated that 1.5 million Tibetans  have died as a result of Chinese occupation  since 1949 and 6000 monasteries,  temples,  and other cultural buildings were destroyed.  And  today, Tibetans,  including monks and  nuns, are continually persecuted for practicing  their religion, and voicing their support for His  Holiness the Dalai Lama. In fact, five Tibetan  monks were  jailed by Chinese authorities  in  February of this year for allegedly publishing  politically sensitive poems, and were given  sentences of two to three years.  The U.S. government has continually supported Tibetan self-determination, and  I am  proud of the dedication of the U.S. Congress  to drawing attention to the gross human rights  abuses committed by the People’s Republic of  China against  the Tibetan people. We must  continue to support the dialogue between His  Holiness the Dalai Lama and the government  of China, and remain committed to a peaceful  resolution  to  this  tragic conflict, keeping  in  mind our shared values of freedom of religion,  freedom of speech, and freedom from tyranny.  I commend to you the statement written by  His Holiness the Dalai Lama in commemoration of Tibetan Uprising Day, and I am honored to submit the statement in its entirety for  the RECORD.  THESTATEMENTOFHISHOLINESSTHEDALAI  LAMAONTHE46THANNIVERSARYOFTHETIBETANNATIONALUPRISINGDAY  On the occasion of the 46th anniversary of  the Tibetan People’s Uprising, I convey my  warm greetings to my  fellow Tibetans  in  Tibet and in exile and to our friends around  the world.  During these more than four decades great  changes have taken place in Tibet. There has  been a great deal of economic progress along  with  development  in  infrastructure. The  Golmud-Lhasa railway  link that  is being  built is a case in point. However, during the  same period much has been written by independent journalists and travelers to Tibet  about the real situation in Tibet and not  what they have been shown. Most of them  portray a very different picture than what  the  Chinese  government  claims,  clearly  criticizing China about the lack of human  rights,  religious  freedom and  self-rule  in  Tibet. What has actually happened and is  still happening is that since the establishment of the Tibet Autonomous Region the  real authority has been solely held by Chinese leaders. As for the Tibetan people, they  have been facing suspicions and growing restrictions. The lack of true ethnic equality  and harmony based on trust, and the absence  of genuine stability in Tibet clearly shows  that things are not well in Tibet and that basically there is a problem.  Prominent and respected Tibetan leaders  in Tibet have spoken out on this from time  to time and even suffered because of their  courageous acts. In the early 1960s, the late  Panchen Lama outlined the sufferings and  aspirations of the Tibetan people in his petition to the Chinese leaders. Baba Phuntsok  Wangyal, one of the foremost Tibetan communist leaders, in his recent biography published in English dwells at length on the  need to meet the interests of the Tibetan  people. In fact, it is clear that most senior  Tibetan officials  in Tibet deep  in  their  hearts are extremely dissatisfied.  This year  the Chinese government will  mark the 40th anniversary of the establishment  of  the Tibet Autonomous Region.  There will be much fanfare and many commemorative events to celebrate the occasion  but these will be meaningless when they do  not reflect the ground realities. For example,  the Great Leap Forward and the Cultural  Revolution were celebrated with great pomp  as real achievements at the time they took  place.  China  has made  tremendous  economic  progress during the past more than two decades. China today is not what it was twenty  or thirty years ago. Much has changed in  China. As a result she has become a major  player in the world and China rightly deserves this position. It is a big nation with a  huge population and a rich and ancient civilization. However, China’s  image  is  tarnished by her human rights records, undemocratic actions, the lack of the rule of law and  the unequal  implementation of autonomy  rights regarding minorities,  including the  Tibetans. All these are a cause for more suspicion and distrust from the outside world.  Internally, they are an obstacle to unity and  stability that are of utmost importance to  the leaders of the People’s Republic of China.  In my view, it is important that as China becomes a powerful and respectable nation she  should be able to adopt a reasonable policy  with confidence.  The world in general, of which China is a  part, is changing for the better. In recent  times there is definitely a greater awareness  and appreciation for peace, non-violence, democracy, justice and environmental protection. The  recent unprecedented  response  from governments and individuals across the  world to the tsunami disaster victims reaffirms that the world is truly interdependent  and the  importance of universal responsibility.  My involvement in the affairs of Tibet is  not for the purpose of claiming certain personal rights or political position for myself  not attempting to stake claims for the Tibetan administration in exile. In 1992 in a  formal announcement I stated clearly that  when we return to Tibet with a certain degree of freedom I will not hold any office in  the Tibetan government or any other political position and that the present Tibetan  administration  in exile will be dissolved.  Moreover, the Tibetans working  in Tibet  should carry on the main responsibility of  administering Tibet.  I once again want to reassure the Chinese  authorities that as long as I am responsible  for the affairs of Tibet we remain fully committed to the Middle Way Approach of not  seeking independence for Tibet and are willing to remain within the People’s Republic  VerDate Aug 04 2004  05:34 Mar 11, 2005 Jkt 039060 PO 00000 Frm 00008 Fmt 0626 Sfmt 9920 E:\CR\FM\A10MR8.026 E10PT1 ",2005
119,,109,0.274,220,2005-03-10,Mr. KIRK.," Mr. Speaker, I rise today to congratulate  the Winnetka Park District on 100  years of service to our community.  In 1904, a group of  concerned  citizens  wanted to restore a piece of land in front of  the  village  train  station, which  had  been  strewn with debris from the local livery stable.  This small band of citizens came together and  collected  the $8,548.30 needed  to purchase  what is now Station Park.  From  those  humble  beginnings,  the  Winnetka Park District has developed into 28  park sites that represent more than 244 acres  of  land. The  lands under  the control of  the  Park District include some of the most beautiful shoreline of Lake Michigan. And from the  initial investment of $8,548.30, the district now  boasts a $9 million annual operating budget.  Through  these 100 years, with  the needs  and  desires  of  the  public  in mind,  the  Winnetka Park District has added new facilities  to meet  the continually growing population. Now, nearly 14,500 citizens enjoy the  Park District’s facilities, which include an 18-  hole championship golf course plus a par-3  course, the first indoor tennis facilities in the  Chicago area, platform  tennis courts, an  indoor ice arena, two outdoor rinks, four public  beaches, a skate park, and a 142-acre expanse of playfield.  The Winnetka Park District also runs hundreds  of  recreation  programs,  from  day  camps,  to athletics,  to classes. The district  plans special events throughout the year, and  thousands partake annually in skating, tennis  and golf lessons.  For one hundred years the Winnetka Park  District worked to provide a balance of quality  recreational and  leisure opportunities  to a  growing community, while protecting the natural resources and open spaces for the benefit  of future generations. I hope that the next hundred years is as successful.  f  IN MEMORY OF JIMMY RIDDLE  HON. MICHAEL C. BURGESS  OFTEXAS  INTHEHOUSEOFREPRESENTATIVES  Thursday, March 10, 2005  ",2005
120,,109,0.57,220,2005-03-10,Mr. BURGESS.," Mr. Speaker, I rise today to  give  tribute  to Jimmy Riddle,  from  the 26th  Congressional District of Texas, for his contributions to his community, country and other  nations. Mr. Riddle was working  for SOC–  SMG, which disposes of munitions  in  Iraq,  when an explosive was detonated within his  convoy, which took his life and that of a co-  worker. Mr. Riddle was 53 years old.  I would like to recognize and celebrate Mr.  Riddle’s life today. Jimmy Riddle consistently  served others  throughout his  life. He  joined  the Marine Corps while  in college and was  stationed  in Japan shortly after  the Vietnam  War. After serving for our country, Mr. Riddle  became  an  officer  for  both  the Sulphur  Springs and Carollton Police Departments in  Texas.  In addition to his career, he spent considerable  time with his  family and promoted  the  ideals of being a servant to his children. As a  result, his son Chris joined the U.S. Navy. Recently, Mr. Riddle was working as a defense  contractor in Bosnia during which time he was  able to see his son Chris for the first time in  two years. Shortly after  this meeting, Chris  was killed by a drunk driver. Always looking to  serve others, Mr. Riddle joined the SOC–SMG  and went to Iraq. Just as in Bosnia, Afghanistan and Qatar, the people in Iraq appreciated  Mr. Riddle and  respected him  for his kindheartedness and devotion to helping others.  It was my honor to represent Jimmy. I extend my deepest sympathies to his family and  friends. He was best described by his fellow  workers as an ‘‘unsung hero.’’  HONORING  THE  BASKETWEAVER,  COLEMAN  ACCOMPLISHED  MRS.  SUE  HON. JIM GIBBONS  OFNEVADA  INTHEHOUSEOFREPRESENTATIVES  Thursday, March 10, 2005  ",2005
121,,109,0.484,220,2005-03-10,Mr. GIBBONS.," Mr. Speaker, I rise today to  recognize the accomplishments of a truly remarkable woman, Sue Coleman. Mrs. Coleman is a member of the Washo nation on the  Dresslerville Reservation in my home state of  Nevada. Mrs. Coleman is nationally known as  a master in the art of basket weaving. Her art  is not only known in Nevada, but throughout  the nation.  Mrs. Coleman comes from a long line of distinguished basket weavers. She  learned  the  art of weaving  through her mother, Theresa  Smokey Jackson. Together with her mother,  Mrs.  Coleman  gathered  willow,  stripped,  cleaned and made thread by splitting the willows in three sections with their teeth. With the  wisdom and guidance of her mother, Mrs.  Coleman has a very diverse portfolio of artistic  designs. These  include; cradleboards, round  baskets, burden baskets, seed beaters and  winnowing trays all of which are true weaves  of the Washo tradition.  Mrs. Coleman has  received many prestigious awards for her art, and has won over  forty  first place  ribbons  for her baskets  in  many western art competitions. In 2002, she  was awarded the prestigious Governor’s Arts  Award for Excellence in Folk Arts. She is also  part of  the committee  that  is organizing  the  Folklife Festival that will be held on the National Mall in 2006. In addition to her many  other roles, Mrs. Coleman has the honor to be  part of the committee for the Smithsonian Museum’s  ‘‘Carriers of Culture: Contemporary  Native Baskets’’. One of her hand-crafted baskets is even part of the Smithsonian’s permanent collection and will be included in a travel  exhibit  that will  feature  the  finest baskets  made by Native Americans.  Mr. Speaker, prior  to  the passing of her  mother, Mrs. Coleman  promised  that  she  would continue the tradition that they enjoyed  together and pass weaving along  to  future  generations, so  that  this wonderful art will  never be forgotten. It is clear that with her with  passion and dedication to this rich cultural art  that she will continue to honor her mother’s  wishes. I am proud to have this opportunity to  acknowledge her work.  f  RECOGNIZING THE ACHIEVEMENTS  OF THE STUDENT COUNCIL OF  CRANSTON HIGH SCHOOL WEST  WITH REGARD TO  ‘‘THE FEINSTEIN YOUTH HUNGER BRIGADE  PROGRAM’’  HON. JAMES R. LANGEVIN  OFRHODEISLAND  INTHEHOUSEOFREPRESENTATIVES  Thursday, March 10, 2005  ",2005
122,,109,-0.376,220,2005-03-10,Mr. LANGEVIN.," Mr. Speaker, I rise today to  commend  the Student Council of Cranston  High School West for their participation for the  third consecutive year in ‘‘The Feinstein Youth  Hunger Brigade Program.’’ Through this year-  long community service project,  these students will raise awareness of hunger in Rhode  VerDate Aug 04 2004  05:34 Mar 11, 2005 Jkt 039060 PO 00000 Frm 00015 Fmt 0626 Sfmt 9920 E:\CR\FM\A10MR8.051 E10PT1 ",2005
123,Senate,109,0.496,11,2005-04-04,Mr. CORNYN.," Mr. President, I ask  unanimous consent that the order for  the quorum call be rescinded.  ",2005
