,branch,congressID,ideology_score,page,part,speaker,speech,year
296,Senate,97,-0.38,33,18,Mr. EAGLETON.," Mr. President, the  Founders  of  this Nation  combined  genius and pragmatism. Thus, at the  same time that they were crafting the  breathtakingly  innovative  system of  government outlined in our Constitu tion, they realized that their plan for  a stable and lasting constitutional de mocracy would only be realized if they  protected the rights embodies in that  document against  the political pas sions that can arise in the body politic  and in the State and National Legisla tures. The Founders clearly recognized  the need, to quote Alexander Hamil ton in Federalist No. 78, to ""guard the  Constitution and the rights of individ uals  from  the  efforts of  those  humors which  the arts of designing  men or the influence of particular con jectures  disseminate  among  the  people .... ""  I submit that the proposal before us  to strip the Federal courts of jurisdic tion over cases involving so-called vol untary school prayer is a perfect ex ample of  just how  foresighted  the  Founders were. For, here we have a  clear instance  in which Members of  this body allow their strong disagree ment with a Supreme Court interpre tation of  the Constitution  to  reach  such a fever pitch that they endorse  an extraordinary and, I submit, uncon stitutional  congressional  response.  ill  For, simply put, what Senator HELMs  proposes is to amend the Constitution  by passage of a mere statute, rather  than  through  the  constitutional  amendment process provided by arti cle V of the U.S. Constitution.  If we follow this route, we will open  up a vast array of civil liberties protec tions embodied in our Constitution to  wholesale  revision  or  nullification  whenever a bare congressional majori ty might  find  it appropriate. This  result is fatally inconsistent with the  scheme of government  intended by  our Founding Fathers,  the  trend of  almost 200 years of constitutional ju risprudence and  the warnings of a  host of legal scholars and experts who  are appalled by the longrun implica tions of amending  the Constitution  through the back door.  A BACK DOOR ATTEMPT TO AMEND THE  CONSTITUTION  It is  important  to  realize at  the  outset  that, however  its proponents  might choose to portray it, this pro posal  is nothing less-or more-than  an attempt to change the legal effect  of the first amendment to the Consti tution through enactment of a mere  statute.  In our constitutional democracy, the  provisions of the Constitution of the  United States are the ""Supreme Law  of  the Land . . . any Thing  in  the  Constitution or Laws of any State to  the Contrary notwithstanding."" <arti cle VI, clause 2). The final interpreter  and expounder of the Constitution's  terms  is  the U.S. Supreme Court.  From these commonplace truths that  have characterized our system since  the early days of  the Constitution,  there flows a straightforward result:  when the Supreme Court ruled in the  1962 case of Engel against Vitale, and  in subsequent cases,  that prayer  in  school violated the clause of the first  amendment which prohibits govern mental  establishment  of  religion,  these decisions became part of the law  of the land binding on the States. The  Court's decision in the school prayer  cases became  inextricably bound  in  the fabric of the Constitution.  Indeed, this is shown by the subse quent actions of those who found the  decision  objectionable.  Recognizing  that the Court's interpretation of the  Establishment of Religion clause of  the first amendment was the law of  the land, various Senators and Repre sentatives have proposed literally hun dreds of amendments to the Constitu tion to remove the judicial gloss on  the first amendment they find so ob jectionable.  Senator IIELMs would reject the ad mittedly time-consuming avenue of a  constitutional amendment, in favor of  a simpler and more  ingenious route.  He and his  followers would  simply  have Congress strip the Federal courts  of jurisdiction to hear cases involving  89-059 0-86-2 <Pt. 18>  ",1982
297,House,97,-0.334,111,18,Mr. EDGAR.," Mr. Speaker,  I  ask  unanimous consent to have my name  removed as a  cosponsor of  the bill  H.R. 6529, the Jobs and Business Op portunities for the Handicapped Act  of 1982.  The SPEAKER pro  tempore <Mr.  MURTHA). Is there objection to the re quest of the gentleman from Pennsyl vania?  There was no objection.  LET US FORGE A NEW FOREIGN  POLICY TOWARD THE PHILIP PINES  <Mr. EDGAR asked and was given  permission to address the House for 1  minute and to revise and extend his  remarks.)  ",1982
298,House,97,-0.345,111,18,Mr. HERTEL.," Mr. Speaker, the un employment rate in Michigan is over  14 percent. The State budget has now  been cut 25 percent in these 2 years.  In 1980, President Reagan campaigned  on Labor Day in Detroit and he prom ised to create 13 million jobs. Instead,  there are 13 million people out of  work. His theories have failed.  Today we can do something for jobs.  Mr. Speaker, C. S. Lewis wrote ""The  road to hell  is a gradual one."" Now  even that road is filled with potholes.  Potholes are caused when the support  structure of the road or bridge is eaten  away. There is  too much decay, and  the overlying pavement buckles and  collapses.  Potholes are a metaphor for our Na tion's economic  ills. The supporting  structure of our economy, our workers,  the industrial base have been under mined by high  interest rates,  reces sion, and unemployment.  Just as we cannot allow our roads to  collapse, we cannot allow our workers  to wallow  in  the hell of unemploy ment. Today's jobs bill will address the  deterioration  of  our  vital  roads,  bridges, and waterways and most im portantly, it will create new jobs par ticularly  for  the most  devastated,  those who have exhausted their unem ployment benefits.  LET US NOT WASTE OUR MOST  PRECIOUS  NATIONAL  RESOURCE-OUR PEOPLE  <Mr. ALBOSTA asked and was given  permission to address the House for 1  minute and to revise and extend this  remarks.)  ",1982
299,House,97,-0.258,111,18,Mr. ALBOSTA.," Mr. Speaker, the un employment line today would reach all  the way from New York City to Los  Angeles and then from Los Angeles up  to Seattle, Wash.  That is the biggest waste of human  resources that this country has today.  No country in this world should allow  that kind of a waste.  We are spending billions of dollars  on the State level and on the Federal  level  to support unemployment and  welfare programs  that are another  waste  of  human  resources,  those  people who are not working, and using  up taxpayers' funds.  Would it not make more sense if we  put our people back to work?  Mr. Speaker,  today  I  am  talking  about a  jobs bill that we will be dis cussing later today. I think it is time  that we make the decision here in the  Congress to get some of these people  back to work.  Mr. Speaker, I urge the people who  may be wobbly on this particular bill  to support it, and stop that waste of  human resources.  D 1050  SPEAKER LAUNCHES ATTACK  AGAINST PRESIDENT REAGAN  <Mr. WALKER asked and was given  permission to address the House for 1  minute and to revise and extend his  remarks.)  ",1982
300,House,97,0.215,137,18,Mr. GRAMM.,"  man for yielding.  I rise in opposition to this bill and in  opposition  to  the Republican substi tute.  Mr. Chairman, we have heard a lot  of people talk about jobs here today  and I would like to know if there is  anybody in the House who is against  jobs. So far as I know I have never met  that person.  What  I  have not heard discussed  here today is why we do not have jobs.  Why do we have a recession? Is this  the 1930's type recession where people  are out of jobs because there has been  a collapse  in spending power where  government can come  in and pump  new  jobs  into  the private sector by  spending money?  I  think the facts fly in the face of  that assertion. We have unemploy ment because in June of last year, 4  months before any budget cut or any  tax cut  took effect,  the cumulative  impact of high interest rates collapsed  the automobile industry, collapsed the  homebuilding  industry and sent  the  economy into a tailspin.  In June of  last year  the average  American family saved only 4.5 cents  out of every dollar of after-tax income.  Why? Because  for  the previous  15  years every  time  they saved money  they found themselves losing ground  because prices were rising and the in terest rates they earned at the bank or  the savings and loan were lower than  the inflation rates.  Government  in June of  last year  borrowed 55 cents out of every dollar  being borrowed, creating massive com petition for savings and causing high  interest rates.  We are called on today to spend $1  billion to create jobs. What a worthy  goal. I wish we had the $1 billion. But  unfortunately we do not have $1 bil lion. We are going to have to go out  and borrow  that $1 billion. We are  going to have to take that $1 billion  away from the private capital market,  from people who want to build new  homes, build new farms, build new fac. tories, create permanent new jobs in  the private sector of the economy.  We are going to destroy a private,  permanent, producing  job  for every  public, nonproductive. make-work job  we create here today.  Mr. Chairman, this is a return to the  very programs that we are trying to  eliminate. This is a great leap back ward to the policies of the 1960's and  the 1970's that have brought us to this  sorry state.  If you want real jobs in the private  sector vote to cut something. When we  vote on the appropriations bill, which  will be voted on after this bill is dis posed of,  if you want to create jobs  vote  against  it because  it  is  over  budget.  If you want to create jobs, try to put  the Federal Government on a budget  so that we can continue to bring infla tion down to encourage people to save,  so money can be borrowed at interest  rates business people can afford  to  pay.  That is  the path to recovery. This  bill is a path to a new inflation, to new  high interest rates and to a new a re cession at higher rates of unemploy ment than in the past.  This is a poor choice. This is a poor  program and I urge my colleagues to  vote no.  Even  the Republican plan which  seeks to take money out of synfuels is  flawed  because  that money  is  not  going to be spent in synfuels.  I urge a no vote on the bill whether  on  not  the Republican  substitute  passes and I  thank my colleague for  yielding.  ",1982
301,House,97,-0.377,137,18,Mr. MOF'F'ETT.," I  thank the chair man for yielding this time and for his  work on this measure.  As I understand it, this is an emer gency bill. Sometimes I wonder if we  in this Chamber any longer have the  ability to judge what an emergency is.  We do have what many Democrats  think is an emergency.  We have 3 million people who have  lost their  jobs since Ronald Reagan  took  office. There  are  11 million  people, nearly, out of work and only  two-fifths of those people are receiv ing any benefits.  We keep hearing from that side of  the aisle about how we are only creat ing 200,000  jobs. Only 200,000  jobs.  What a fantasy land we live in when  we are not prepared  to  take some  action to put people to work, not on  leaf-raking,  unproductive  jobs,  but  building things that we need.  I think that the excuses over there  really do not fly. You say you have  other proposals, you have other bills.  We are not going to pass other bills.  This is your chance. You can call it  partisan, you can call it simplistic. But  it is your only chance to vote for jobs  in this session.  ",1982
302,House,97,0.492,150,18,Mr. SOLOMON.," Mr. Chairman, as I  stated  in my  remarks  during  the  debate, I rise to ask unanimous con sent  to offer my amendment which  would prohibit any of these jobs going  to people who are in violation of the  Draft Registration Act.  The CHAIRMAN. Is there objection  to the request of the gentleman from  New York?  ",1982
303,House,97,-0.3,176,18,Mr. YOUNG of Missouri.," Mr. Speak er,  throughout this Congress I have  been  forecasting  sharp  increases  in  natural gas prices  for  this  fall and  winter. As you know, Mr. Speaker, I  introduced legislation earlier this year  addressing this problem of skyrocket ing gas prices and to provide residen tial consumers protection from unrea sonably high natural gas prices.  Mr. Speaker,  this week articles  in  both U.S. News & World Report and  Business Week confirm my unhappy  predictions. According  to U.S. News  the Energy Department has predicted  residential natural gas prices 20 per cent higher this winter than last. Busi ness Week forecasts gas price increases  of up to 50 percent this winter.  Experts  universally  blame  the  phased-in deregulation of natural gas  prices established by Congress in the  Natural Gas Policy Act of 1978  for  these increases. U.S. News quite accu rately points out that  this act <the  NGPA> forces utilities to pay higher  prices for gas even though currently  there exists a surplus of natural gas  supplies  such  that  some  producers  have shut down wells because  they  cannot sell the output.  Mr. Speaker, I emphasize once again  that unless the Natural Gas Policy Act  is amended, gas prices will continue to  increase faster than the rate of infla tion and many people will be unable to  afford to heat their homes this winter.  My bill provides the means necessary  for Congress  to  protect  residential  consumers from unreasonbly high nat ural gas prices by containing  those  prices at just and reasonable levels.  I urge my colleagues to take a look  at this week's issue of U.S. News and  Business Week relative to the problem  of natural gas and begin work now to  prevent a disaster this winter.  Mr. Speaker, I include copies of the  articles referred to here in the RECORD,  as follows:  [From U.S. News and Business Week, Sept.  20, 1982]  A PRICING PLoY To KEEP INDUSTRY HooKED  ON GAS  With  individual buyers of natural gas  facing rate increases of up to 50 percent this  winter, competition between oil and natural  gas for industrial customers is heating up.  Plagued by soaring natural gas costs, reces sion-crimped demand for energy in industri al markets, and sinking fuel oil prices, the  nation's gas utilities are losing the battle  Now, in a scramble to retain high-volume  industrial customers, a handful of the utili ties are asking state regulatory commissions  to approve price discounts for these custom ers, even  though consumer gas rates are  rising sharply. Favorable rulings from the  commissions are  likely  to send more gas  companies scurrying for similar assistance.  Over the past year, gas prices have bal looned by 20 percent. Under the Natural  Gas Policy Act of 1978 (NGPA>, written in re sponse to supply shortages, price controls  are gradually being lifted from about 40 per cent of the nation's gas supplies from now  to 1985. But with a steady supply of gas now  assured well  into  the 1980s, U.S. utilities  find themselves facing unexpectedly fierce  price competition from residual fuel oil. In  many regions of the country, ""residual"" is  selling at below $5 per million Btu to indus trial customers, while the industrial price of  gas has risen  to $5.18 per million Btu or  more <chart).  Industrial buyers, who  last  year burned 40 percent of the 20.5  trillion  cu. ft. of all gas used, are switching to oil  with alarming frequency.  In response, local gas utilities are seeking  lower rates for their eroding industrial mar kets.  In August  the Pennsylvania Utility  Commission granted Pittsburgh-based Equi table Gas Co. permission  to set a special  ""floating rate"" that will allow the utility to  tie its industrial gas price to the price of  fuel oil-now underselling gas by 14 percent  in the area-without holding public hear ings. People's Gas, Light & Coke Co., a Chi cago distributor, is hoping for approval of a  similar plan by the Illinois Commerce Com mission by December. ""We're hurting right  now,"" says John A. Lawrisuk, a vice-presi dent at People's. ""Gas prices are going to be  higher than residual straight through 1983,  and we  expect  sizable  [industrial]  load  losses if the new rate is not approved.""  Up in a1""771.3  Utilities contend that unless lower prices  to industrial users are approved, gas rates  will be forced up for all customers. If signifi cant industrial fuel-switching occurs, utili ties would have to increase rates to their re maining customers to earn an allowed rate  of return on assets now ranging from 10 per cent to 15 percent. But consumer groups are  already up in arms over price increases that  analysts expect will average 20 percent over  the next year. In California, Michigan, and  Illinois, some consumers may see stunning  increases of up to 50 percent in their gas  bills, which will make price breaks to indus trial users a bitter political pill. ""We're be tween a rock and a hard place on this one,""  says Charles Pavalko, a staff analyst at the  Ohio Public Utility Commission.  Over the past few years, however, indus trial customers have carried much of the  burden of rising gas prices. The incremental  pricing provision of the NGPA charged in dustrial customers up to 50 percent more  than other users for increased gas consump tion. With the supply uncertainties of the  1970s, such burdens drove  industry away  from gas. Industrial consumption fell from  10.4 trillion cu. ft. in 1973 to 8.4 trillion cu.  ft. in 1980. Now, with gas supplies in excess,  utilities  are  struggling  to prevent more  losses.  Interstate  gas  transmission  companies,  which supply gas utilities, also are worried  about the industrial market <BW-Aug. 2).  In late August, Columbia Gas Transmission  Corp., which wholesales gas in eight North eastern states and is locked into expensive  long-term contracts with producers, asked  the Federal Energy Regulatory Commission  to allow a price cut of $1 per thousand cu.  ft. on 88 billion cu. ft. of gas slated for in dustrial use. Not surprisingly, distribution  companies that buy gas from Columbia are  applauding the move. ""It's a very interest ing proposal,"" says one executive at an Ohio  gas utility. ""Residential rates are going up,  but they'll go up even more if we don't hang  on to the industrial market. If we don't save  those customers, everyone loses.""  [From U.S. News & World Report, Sept. 13,  1982]  SAY GOODBYE TO CHEAP GAS HEAT  Even  as  air conditioners  continued  to  hum, grim news came in early September  for many Americans  about  the winter  ahead: Costs of heating and cooking with  natural gas will shoot up sharply.  Gas  utilities  throughout  the  country  warned customers to prepare for the same  kind of shock experienced in recent winters  by owners of homes heated by oil or elec tricity.  Utility officials blamed phased deregula tion of natural-gas prices, approved by Con gress  in 1978. The  law,  executives com plained, forces  them to pay higher prices  for gas even though the fuel  is in such a  surplus  that  some  producers  have  shut  down wells because  they cannot sell  the  output.  Nationwide, the Energy Department pre dicted, residential natural-gas prices will be  20 percent higher this winter than last. But  costs will differ widely from place to place.  Southern California Gas Company said  residential customers will find their heating  bills 70 percent higher. Residents in Massa chusetts and New Jersey face 20 percent in creases.  Lone Star Gas Company requested a rate  increase that could raise residential gas bills  by 13 percent in Texas and up to 67 percent  in Oklahoma. In Cleveland, East Ohio Gas  plans to boost prices 15 percent in Novem ber on top of a 15 percent rise in May and a  4 percent hike in August. Gas costs in Cin cinnati will increase 33 percent.  In Maryland, home-gas rates are going up  30 percent, and costs to commercial and in dustrial users are jumping 50 to 60 percent.  Baltimore Gas &  Electric Company  ran  newspaper ads putting the blame for  the  rises solely on  its gas supplier, Columbia  Gas Transmission Corporation.  ",1982
304,House,97,0.336,189,18,Mr. GOODLING.,  Mr. LENT in two instances.  Mr. GREEN in three instances.  Mr. PoRTER in two instances.  Mr. McKINNEY.  ,1982
305,House,97,0.702,189,18,Mrs. ASHBROOK.,  Mrs. FENwiCK.  ,1982
306,House,97,0.346,189,18,Mr. LEE.,  Mr. NELLIGAN in two instances.  Mr. FINDLEY in two instances.  ,1982
307,House,97,0.207,189,18,Mr. WORTLEY.,  ,1982
308,House,97,0.679,189,18,Mr. COLLINS of Texas.,  Mr. CouGHLIN.  ,1982
309,House,97,-0.247,189,18,Mr. WALGREN.,  ,1982
310,House,97,-0.564,189,18,Mr. WEISS.,  Mr. MoAKLEY in two instances.  Mr. AuCoiN.  Mr. LUNDINE in two instances.  ,1982
311,House,97,-0.547,189,18,Mr. BONIOR of Michigan.,  ,1982
312,House,97,-0.351,189,18,Mr. HARKIN.,  ,1982
313,House,97,-0.599,189,18,Mr. EDWARDS of California.,  Mr. EcKART.  ,1982
314,House,97,-0.631,189,18,Mr. STARK.,  Mr. STOKES in three instances.  Mr. MARKEY in three instances.  Mr. MoFFETT in two instances.  ,1982
315,House,97,-0.318,189,18,Mr. WYDEN.,  ,1982
316,House,97,-0.172,189,18,Mr. SKELTON.,  ,1982
317,House,97,-0.175,189,18,Mr. FLIPPO.,  ,1982
318,House,97,-0.402,189,18,Mr. ADDABBO.,  ,1982
319,House,97,-0.514,189,18,Mr. KASTENMEIER.,"  SENATE BILLS, JOINT AND CON CURRENT  RESOLUTIONS  RE FERRED  Bills,  joint and concurrent  resolu tions of the Senate of the following  titles were taken from the Speaker's  table and, under the rule, referred as  follows:  S. 349. An act to amend title 38, United  States Code, to establish certain procedures  for the adjudication of claims for benefits  under laws administered by the Veterans'  Administration; to apply the provisions of  section 553 of title 5, United States Code, to  rulemaking procedures of the Veterans' Ad ministration; to provide for judicial review  of certain final decisions of the Administra tor of Veterans' Affairs; to provide for the  payment of reasonable fees to attorneys for  rendering legal representation to individuals  claiming benefits under laws administered  by  the Veterans' Administration; and for  other purposes; to the Committee on Veter ans' Affairs;  S. 2420. An act to protect victims of crime;  to the Committee on the Judiciary;  S.J. Res. 241. Joint resolution to provide  for the designation of the week of December  12, 1982,  through December 18, 1982, as  ""National Drunk  and Drugged Driving  Awareness Week"";  to  the Committee on  Post Office and Civil Service;  S.J. Res. 243. Joint resolution authorizing  and requesting the President to designate  October 15, 1982, as ""National Poetry Day"";  to the Committee on Post Office and Civil  Service.  S. Con. Res. 120. Concurrent resolution to  commemorate the seventy-fifth anniversary  of the Washington Cathedral; to the Com mittee on Post Office and Civil Service.  SENATE ENROLLED BILL SIGNED  The SPEAKER announced his sig nature  to  an  enrolled  bill  of  the  Senate of the following title:  S. 923. An act to amend chapter 207 of  title 18, United States Code, relating to pre trial services.  BILLS PRESENTED TO THE  PRESIDENT  Mr. HAWKINS, from the Commit tee on House Administration, reported  that that committee did on this day  present to the President, for his ap proval, bills of the House of the fol lowing title:  H.R. 1710. An act to authorize the use of  the frank for official mail sent by the Law  Revision Counsel of the House of Repre sentatives;  H.R. 3620. An act  transferring certain  Federal property to the city of Hoboken,  N.J.;  H.R. 3835. An act for the relief of Ruther ford K. Clarke and his wife Ida T. Clarke;  and  H.R. 6068. An act to authorize appropria tions for fiscal year 1983 for intelligence and  intelligence-related  activities of  the U.S.  Government, for the Intelligence Communi ty Staff, for the Central Intelligence Agency  Retirement and Disability System,  to au thorize  supplemental  appropriations  for  fiscal year 1982 for the intelligence and in telligence-related activities of the U.S. Gov ernment, and for other purposes.  ADJOURNMENT  ",1982
