,branch,congressID,ideology_score,page,part,speaker,speech,year
273,,109,-0.33,183,2005-07-11,Mr. INSLEE.," Mr. Speaker, today I pay tribute to an outstanding representative from the  1st District of the great State of Washington,  Frank Maziarski, CRNA, MS, CLNC. Mr.  Maziarski will soon complete his year as national president of the American Association of  Nurse Anesthetists (AANA). I am very pleased  that this son of Washington was tapped as the  2004–2005 president of  this prestigious national organization, and I am honored to count  him as one of my constituents.  The AANA is the professional organization  that represents more  than 33,000 practicing  Certified  Registered  Nurse  Anesthetists  (CRNAs). Founded in 1931, the AANA is the  professional association representing CRNAs  nationwide. As you may know, CRNAs are anesthesia professionals who administer approximately 65 percent of all anesthetics given to  patients each year in the United States. They  work in every setting in which anesthesia is  delivered including hospital surgical suites and  obstetrical delivery rooms, ambulatory surgical  centers, and the offices of dentists, podiatrists,  and plastic surgeons.  CRNAs provide anesthesia for all types of  surgical cases and,  in some states, are  the  sole anesthesia providers in approximately 70  percent of all rural hospitals, affording these  medical facilities obstetrical, surgical and trauma stabilization services.  Mr. Maziarski earned his Master of Science  (MS) degree and his Bachelors of Science degree in nursing (BSN) from the University of  Nebraska at Omaha. He was educated in the  art and science of Nurse Anesthesia at the Albany Medical Center, School of Nurse Anesthesia, Albany, NY. He spent 21 years as an  officer in the U.S. Army Nurse Corps, first as  an anesthesia provider and then as an educator  in  the  Academy  of Health  Sciences  Schools of Nurse Anesthesia and was a Director of the Phase I (clinical) and also a Director  of Phase II (academic) portions of the Nurse  Anesthesia programs. He retired as a Lieutenant Colonel at Beaumont Army Medical Center, El Paso, Texas. He also spent one year  as Chief Nurse Anesthetist of the 93rd Evac.  Hospital, in Long Binh, Viet Nam during July,  1968–July, 1969. He is currently a practicing  nurse anesthetist and owner of Allied Anesthesia Associates, which provides anesthesia  services in and around the Shoreline, Washington area, in my congressional district.  Mr. Maziarski has held various  leadership  positions  in  the AANA as President-Elect,  Vice-President, and Regional Director before  becoming the National President of the AANA  in 2004. In addition, Frank has served terms  as President, President-Elect, Vice-President,  Treasurer, and as a Member of the Board of  Directors  for  the Washington Association of  Nurse Anesthetists (WANA). He was also appointed by Governor Gary Locke to the Washington State Nursing Care Quality Assurance  Commission from 1997–2004 and was elected  as its chair twice during his tenure.  Adding to his professional accomplishments,  Mr. Maziarski has been recognized  for both  publishing and speaking on anesthesia-related  topics over the years. He has taken his experience and knowledge from the workplace and  AANA leadership roles to lecture on political  and academic anesthesia related topics before  different professional groups. During his AANA  Presidency, Mr. Maziarski has played important  roles  in advocating  for  the practice of  nurse anesthesia and its patients before Medicare and other Federal agencies, promoted  anesthesia patient  safety  through  vigorous  participation  in  the  interdisciplinary National  Quality Forum (NQF), and advanced principles  of wellness among practitioners in this highstress profession. In addition, Mr. Maziarski directed that the AANA be represented before  three key subcommittees of this Congress, in  which members of  this organization  testified  about the importance of nurse anesthesia education, the roles and contributions of CRNAs  in the Veterans’ Affairs health system, and the  dedication with which CRNAs have provided  safe anesthesia care to members of the U.S.  Armed Forces at home and abroad.  It  is my  understanding  that  under Mr.  Maziarski’s leadership, the AANA continued to  foster an important line of communication with  the American Society  of Anesthesiologists  (ASA). While  these organizations of anesthesia professionals have not always seen  eye-to-eye, both the AANA and ASA are working to ensure the safe administration of powerful anesthesia drugs, and have shared interest  in patients’ safe access  to anesthesia care  with respect to Medicare regulations governing  locked anesthesia carts. These two societies’  professional working  relationship may  not  have been possible without the continued initiative of AANA President Maziarski and his  ASA counterpart.  Mr. Speaker, I ask my colleagues to join me  today  in  recognizing Mr. Frank Maziarski,  CRNA, MS, CLNC, for his notable career and  outstanding achievements. f  TRIBUTE TO ELISSA  GIAMBASTIANI  HON. LYNN C. WOOLSEY  OFCALIFORNIA  INTHEHOUSEOFREPRESENTATIVES  Monday, July 11, 2005 ",2005
274,,109,-0.556,183,2005-07-11,Ms. WOOLSEY.," Mr. Speaker, I rise today to  honor Elissa Giambastiani who is retiring after  18 years as President and CEO of the San  Rafael, California, Chamber of Commerce.  Under Elissa’s dynamic leadership, the Chamber has successfully promoted not only the immediate needs of  local businesses but also  the long-term economic interests of the community.  As an advocate for workforce housing and  transportation  infrastructure  improvements,  Elissa has been in the forefront of efforts to  establish a housing trust and to pass a transportation sales  tax. Her expertise  is widely  recognized, and she was recently  invited  to  speak at a National Workforce Housing summit in Arlington, Virginia, on ‘‘Fostering Community Acceptance of Affordable and Workforce Housing.’’  Born  and  raised  in Minnesota,  Elissa  worked there as a teacher before taking a job  with the Army teaching in Europe. After her return, she moved to San Francisco where she  worked  in an architect’s office and met her  husband Ron Giambastiani who worked in the  same office and lived in San Rafael. She also  worked as public relations consultant before  joining the Chamber in 1987.  As President, Elissa developed and implemented the overall program for an organization with over 950 members. She also took the  lead in tracking and advocating the business  viewpoint on  legislation,  including an  instrumental role in the formation of the Alliance of  North Bay Chambers to increase clout. This  function  lead  to  the San Rafael Chamber  earning an Advocacy Chamber of  the Year  Award, one of the first winners in this category  which was created by the California Chamber  of Commerce in 2003.  Elissa has also won an award from Western  Association of Chamber Executives for management excellence and an Accredited Chamber  Executive  designation  from  the U.S.  Chamber of Commerce. Locally, she  is a  member of the League of Women Voters, the  Ecumenical Association for Housing, and the  San Rafael Rotary.  Mr. Speaker, ‘‘tenacious’’ and ‘‘tireless’’ are  appropriate words frequently used to describe  Elissa Giambastiani. I would add ‘‘clear-sighted, passionate, and  caring,’’ all adjectives  which do  justice  to her effectiveness as a  leader in of the San Rafael community. I wish  her luck in her new pursuits of piano playing,  Japanese flower arranging, Italian study, public  relations  consulting  as  well  as  grandmothering. VerDate jul 14 2003  04:12 Jul 12, 2005 Jkt 039060 PO 00000 Frm 00005 Fmt 0626 Sfmt 0634 E:\CR\FM\A11JY8.017 E11PT1 ",2005
275,,109,0.348,190,2005-07-11,Mr. CALVERT.," Mr. Speaker, I rise today to  honor and pay tribute to Linda Graham Ward,  who retired on June 17,2005 after thirty three  years as a teacher in the Ocean View School  District of Huntington Beach, California.  Linda G. Ward  is a  fantastic  teacher who  truly cares  for her students. She has dedicated her 33 years of teaching to improving  the quality of life of her students by teaching  them Fitness  for Life. Her greatest career  achievements include not only saving the lives  of several students, but teaching students how  to live healthier lives through physical fitness.  She inspired her students to go on to become  Olympians, professional athletes, and  teachers.  Linda was born and  raised  in EI Centro,  California. Her love of learning lead her to the  University of Southern California where she  earned her teaching credential in 1972. That  fall she began her long career with the Ocean  View School District  teaching Physical Education and Science. Her. campus assignments  took her to the Rancho View School, the Vista  View Middle School and the Spring View Middle School. She kept  learning as well and  earned a master’s degree  in kinesiology  in  1973.  At each campus she served as a teacher,  coach  and mentor  to  her  students. She  coached  volleyball, basketball,  track,  cross  country, softball and soccer. She was  the  Mentor Teacher for Ocean View School District Physical Education Program and Developed  and  implemented  the Ocean  View  School District’s Physical Fitness Program for  Grades 6, 7 and 8. Linda went above and beyond the normal teaching role to inspire her  students to live a fit and healthy lifestyle. She  created  the Ocean View School District’s  Physical Fitness Awards Program based on  Olympic Games model to recognize students’  achievements and implemented the California  Fitness  Testing  Program  in Ocean  View  School District.  She made remarkable strides in improving  the health of her students by becoming a CPR  Instructor for the Ocean View School District  and teaching students and employees how to  save lives. Linda also served as Physical Education expert and advisor to Orange County  Grand Jury  investigation regarding childhood  obesity. She also wrote, obtained and expended PEP grant  funds  in  the amount of  $472,000 to implement the SPARK Program  for physical fitness in her district. For her efforts Linda was named the Most Inspirational  Teacher in the Ocean View School District, an  award she certainly deserves.  For over three decades Linda G. Ward has  been educating and motivating the young people of Southern California. She has  indeed  made a positive difference  in  thousands of  lives and earned my many thanks. I wish her  all the best in her future endeavors. f  PERSONAL EXPLANATION  HON. TOM COLE  OFOKLAHOMA  INTHEHOUSEOFREPRESENTATIVES  Monday, July 11, 2005 ",2005
276,,109,-0.404,190,2005-07-11,Mr. BUTTERFIELD.," Mr. Speaker,  I  rise  today  to  remember U.S. Army CPL Phillip  Charles Edmundson, of my hometown of Wilson, NC, for serving our country during Operation  Iraqi Freedom. Corporal Edmundson  made  the ultimate sacrifice  for our country  when he died on June 1, 2005 when an improvised explosive device detonated near his  Bradley Fighting Vehicle during combat operations. He was assigned to the 1st Battalion,  9th  Infantry Regiment, 2nd  Infantry Division,  Fort Carson, CO. He was just 22 years old.  Corporal Edmundson was  the  first person  from my community  to die  in combat since  Vietnam. While we are saddened at this great  loss, we are so honored  to claim Corporal  Edmundson as the product of our community.  Corporal Edmundson had re-enlisted while  in Iraq and was scheduled to be promoted to  sergeant. During his funeral service, Corporal  Edmundson was awarded a Bronze Star and  Purple Heart posthumously for his bravery and  dedicated service.  It was my honor  to  represent U.S. Army  CPL Phillip Charles Edmundson and to have  a  friendship  with  his  parents,  Robert  Edmundson and Anne Edmundson. I extend  my deepest  sympathies  to his  family and  friends. He will be deeply missed and his service was greatly appreciated.  Mr. Speaker, I would like to submit for the  a  poem  by CPL Phillip Charles  Edmundson. RECORD A SOLDIER’SREFLECTIONS  I was that which others did not want to be.  I went where others feared to go  and did what others failed to do.  I asked nothing from those who gave nothing  and reluctantly accepted the thought of eternal loneliness . . .  Should I fail, I have seen the face of terror;  Felt the stinging cold of fear;  and enjoyed the sweet taste of a moment’s  love.  I have cried, pained, and hoped . . .  but most of all, I have lived times others  would say  were best forgotten. At least someday  I will be able to say that I was proud of what  I was . . .  ‘‘A Soldier’’.  —CPL Phillip Charles Edmundson VerDate jul 14 2003  04:12 Jul 12, 2005 Jkt 039060 PO 00000 Frm 00012 Fmt 0626 Sfmt 0634 E:\CR\FM\A11JY8.043 E11PT1 ",2005
277,,109,0.171,66,2005-07-15,Mr. SIMMONS.," Mr. Speaker, I rise today to  praise  the service and sacrifice of a brave  young soldier  from my district, SPC Christopher Lee Hoskins, who gave his life in the  cause of  freedom and democracy  in  Iraq.  I  also pay tribute to SPC Hoskins’ family, who  raised this fine young man in an environment  of loving care and who supported his decision  to serve his country in uniform in Iraq.  On June 21, Army SPC Christopher Hoskins, of Killingly, Connecticut, was killed  in  Ramadi, Iraq, after his unit came under small  arms fire west of Baghdad. The death of SPC  Hoskins, who was a member of the Army’s 1st  Battalion, 9th Infantry Regiment, 2nd Brigade  Combat Team, 2nd Infantry Division, marked  the 25th death of a Connecticut soldier in the  war in Afghanistan and the Middle East.  SPC Hoskins was 21 years old. He, along  with  so many other  fine  young men and  women from across our Nation, was serving  America and the cause of freedom by fighting  terrorism and helping to bring stability to a part  of the world that for far too long has known  mainly violence and misery.  SPC Hoskins graduated from Killingly High  School  in 2001. He enlisted  in  the Army  in  2003. He had recently re-enlisted for another  four years.  In many ways, SPC Hoskins was typical of  most American youths. His  friends  recalled  that he was generous and polite; he enjoyed  listening  to Metallica; he played chess and  was a member of his high school wrestling  team; he enjoyed painting and he worked the  cameras at school plays.  And  in many ways he was  typical of  the  men and women who preceded him as members of our Nation’s armed forces. This was a  young man who wanted to serve a cause larger than himself.  This was a young man who did not have to  place himself in harm’s way but volunteered to  do so in service to our Nation, our people and  the way of life that we treasure. America is a  better place because of young men like Army  SPC Christopher Hoskins.  We cannot repay the debt we owe Christopher Hoskins; we can only honor him and  his family. And we do.  Memorial Day was set aside as  the day  when Americans  remember  those who  left  their homes, families and jobs to defend our  Nation—and never returned. But our men and  women in uniform defend freedom every day,  and every day there are those who pay the ultimate price for their selflessness. It would be  highly appropriate if we took a moment out of  every day  to honor and remember  the men  and women who stand between America and  those who would do her harm.  Today, July 14, 2005 SPC Hoskins was interred at Arlington National Cemetery overlooking Washington, D.C. with full military honors. He will posthumously  receive a Purple  Heart for his wounds and a Bronze Star for his  valor. SPC Hoskins will rest in good company,  among others who answered the call to duty,  honor and country.  We pray  that  the service and sacrifice of  SPC Hoskins will remind us of the high cost  which is paid by those who love our freedom,  who believe in our democracy and who give  their best to defend the best Nation on Earth.  May God rest his soul. f  FREEDOM FOR ALEJANDRO  GONZA´LEZ RAGA  HON. LINCOLN DIAZ-BALART  OFFLORIDA  INTHEHOUSEOFREPRESENTATIVES  Thursday, July 14, 2005 Mr. LINCOLN DIAZ-BALART of Florida. Mr.  Speaker, I rise today to speak about Alejandro  Gonza´lez Raga, a political prisoner  in  totalitarian Cuba.  Mr. Gonza´lez Raga is an independent journalist and a  contributor  to  the Camagu¨ey  Press Agency. As an independent journalist in  a totalitarian Cuba, Mr. Gonza´lez Raga’s truthful articles have helped the world to learn the  facts about the nightmare that is the Castro  regime. Because of his belief in factual reporting, Mr. Gonza´lez Raga relentlessly chronicled  the atrocities committed by Castro’s machinery  of  repression.  I  remind my colleagues  that,  under Castro’s  totalitarian  regime, any  freedom of  the press, any effort  to display  the  atrocities of the regime under the spotlight of  truth, is met with swift and violent repression.  In March, 2003, Mr. Gonza´lez Raga was arrested as part of  the dictatorship’s heinous  crackdown on peaceful pro-democracy activists. According to Reporters Without Borders,  as part of his sham trial, Mr. Gonza´lez Raga  was accused of ‘‘cooperating with the foreign  press,’’ and of  ‘‘systematically endangering  territorial integrity’’ by writing reports on subjects considered ‘‘very sensitive’’ by the dictatorship such as  ‘‘shortages due  to  the economic crisis, relations with other countries, TV  programs, the education budget.’’ He was sentenced to 14 years in Castro’s dungeons for  these ‘‘crimes.’’  Let me be very clear, Mr. Gonza´lez Raga is  currently  languishing  in  the depraved conditions of the totalitarian gulag for his truthful articles. The U.S. State Department describes  the conditions in the gulag as, ‘‘harsh and life  threatening.’’ The State Department also reports that police and prison officials beat, neglect, isolate, and deny medical treatment to  detainees and prisoners. It is a crime of the  highest order  that people are  imprisoned  in  these nightmarish conditions simply for reporting the facts.  Mr. Speaker, it is as inconceivable as it is  unacceptable that, while the world stands by  in  silence  and  acquiescence,  independent  journalists who write the truth about totalitarian  regimes are systematically  tortured. My Colleagues, we must demand the immediate and  unconditional  release of Alejandro Gonza´lez  Raga and every political prisoner in totalitarian  Cuba. f  MONMOUTH  DANSKIN  BIRTHDAY  COUNTY’S  CELEBRATES  BEN  80TH  HON. CHRISTOPHER H. SMITH  OFNEWJERSEY  INTHEHOUSEOFREPRESENTATIVES  Thursday, July 14, 2005 ",2005
278,,109,0.16,66,2005-07-15,Mr. SMITH of New Jersey.," Mr. Speaker, I  rise today to offer my best and warmest wishes to a good friend and constituent, Mr. Benjamin H. Danskin, who  today celebrates his  80th birthday.  Ben Danskin has been a key figure in government service, public advocacy and business development in Monmouth County, New  Jersey  for more  than 50 years. He  is  respected, admired and well-liked by colleagues,  associates and former political rivals. His family and close friends are inspired by his wit,  good nature, character, charisma and kindness.  Born and raised in Spring Lake, New Jersey, Ben and his older brother, Clyde, learned  the importance of public service through their  father’s example. Their  father, Benjamin S.  Danskin, was a realtor with Horatio Clayton  Real Estate and  Insurance, which he  later  bought and named the Danskin Agency. Successful in business, Benjamin S. Danskin also  succeeded in the public arena. He served as  the Secretary of the State Division of Tax Appeals, President of the New Jersey Association of Tax Commissioners, and Deputy Director of Taxation, assisting in the creation of the  state  tax equalization program. Government  service would become a family trait.  In September 1943, young Ben Danskin  joined the Army as a Lieutenant and began  training to become a B–25 bomber pilot. When  World War II ended, Ben enrolled in the Dickinson College to pursue a degree in political  VerDate jul 14 2003  00:39 Jul 16, 2005 Jkt 039060 PO 00000 Frm 00004 Fmt 0626 Sfmt 9920 E:\CR\FM\A14JY8.035 E15PT1 ",2005
279,House,109,0.202,2,2005-07-25,Mr. FITZPATRICK.," Mr. Speaker, I  rise  today  to address  the  issue of  health care insurance in America, its  rising costs and a solution that will  help to reduce the cost for many Americans. Our Nation is in the midst of a  health care crisis. This crisis affects  Pennsylvania’s  health  care  professionals, their patients and the doctor-  patient relationship. This crisis is especially acute in my district in Southeastern Pennsylvania.  Last week I held a small business  committee forum in my district. The  health care crisis and how it affects  small businesses was the topic of the  forum. The gentleman  from  Illinois  (Mr. MANZULLO) was kind enough to  come to the forum and to apply his  many years of experience to the issue,  and I thank the gentleman for his contribution and for his insights.  Pennsylvania’s health care problems  are among the worst in the Nation.  Doctors in Pennsylvania are faced with  some  of  the  highest medical malpractice insurance rates in the country. Because they cannot afford to pay  for malpractice insurance, many Pennsylvania physicians are practicing defensive medicine or simply shutting  their doors, moving to other states or  retiring. Young doctors establishing a  new practice are reluctant to consider  Pennsylvania because of malpractice  insurance problems.  Over 50 percent of Pennsylvanians  say their family has had difficulty in  paying the cost of health care or obtaining  health  insurance  coverage.  Since 2001, the cost of health insurance  has risen 59 percent, and employers  who offer health care benefits are paying an average of 11 percent more for  health insurance premiums than they  did in 2004. This is the fourth year in a  row of double digit increases with no  end in sight.  From a national perspective, the statistics are staggering. The Labor Department has recently reported that 3.7  million new  jobs were created since  May of 2003, marking 25 consecutive  months of positive job growth for the  U.S. economy. Unfortunately, there are  41 million Americans who are without  health care insurance. Nearly 60 percent of the 41 million uninsured Americans are employed by small businesses  or are dependent on someone who is  employed  by  a  small  business. As  health care costs continue to increase,  fewer employers and working families  will be able to obtain coverage, and the  number of uninsured will  inevitably  rise. For a Nation of the 21st Century,  and  in  a  country  that  boasts  the  world’s  largest and most productive  economy, this is simply unacceptable.  The skyrocketing cost of health care  is making employer-sponsored health  coverage harder and harder for businesses, especially small businesses, to  provide to their employees. This fact  makes it nearly impossible for many  hard working  families to receive affordable care that they need and deserve.  VerDate Aug 04 2004  02:00 Jul 26, 2005 Jkt 039060 PO 00000 Frm 00002 Fmt 7634 Sfmt 0634 E:\CR\FM\A25JY7.001 H25JYPT1 ",2005
280,,109,0.505,16,2005-07-25,Mr. ISSA.," Mr. Speaker, I ask unanimous consent that all Members may  have 5 legislative days within which to  revise and extend their remarks and include extraneous material on H.J. Res.  59, H. Con. Res. 181, H. Res. 329, H. Res.  289, H. Res. 294, H.R. 2977, H.R. 2894, S.  775, S. 571, and H.R. 3339.  ",2005
281,House,109,0.339,23,2005-07-25,Mr. UPTON.," Mr. Speaker, on that I  demand the yeas and nays.  The yeas and nays were ordered.  ",2005
