,branch,congressID,ideology_score,page,part,speaker,speech,year
81,,100,0.635,946,2,Mr. ARMEY.," Mr. Speaker, whether we rec ognize it or not, our economy is becoming an  increasingly global one. It's not enough to be  competitive at home, economic survival today  is measured by a  firm's ability  to compete  against domestic and  foreign manufacturers  and service providers.  Who benefits from this global competition?  We all do, though at times we have to wade  through some persuasive and pervasive myths  to get the whole picture. For instance, you'll  rarely  find an advocate of  restrictive  trade  policies argue  that  international  trade hurts  consumers. Adopt  that approach and you'll  find yourself arguing that American consumers  don't know how to spend  their own money.  More often than not, though, you'll hear that  America's manufacturing base is eroding and  that American  jobs are threatened by global  competition.  The  facts  just don't support  the charge.  Manufacturing as a percentage of GNP has  remained  relatively constant at 20 percent  over the last 25 years. And while manufactur ing employment has dropped  from approxi mately 25 percent of the workforce to 18 per cent,  it's pretty clear that the productivity of  manufacturing employees has increased and it  now takes less people to make more goods.  That's responding to international challenges,  not putting up barriers to inhibit global com petitiveness.  And what about the charge that American  jobs are being  lost. Today, we have more  people working  than ever before.  In  relative  terms-comparing America with other econo mies-the  results are even more  startling.  Since 1975, the American economy has cre ated 25 million net new  jobs.  In  the same  period, all of Europe combined created zero.  Unfortunately, there are some who are ar guing  that  protectionist  trade  policies  are  needed to protect jobs and American consum ers  from  foreign competition. But as Arshad  M. Khan points out  in  ""Import Restrictions  Just Intensify Trade War,"" it's American busi ness and consumers who'll pay the bill for the  folly of protectionism.  America has nothing  to gain  from beggar  thy neighbor trade policies and a lot to lose.  Trade restrictions deny consumers the oppor tunity and the freedom to buy the best goods  or service available at the  lowest price. Just  as importantly, they artificially relieve the com petitive pressures which force firms to adapt  and change and respond to the discipline of  the marketplace.  As a professional economist, I, too, am con cerned with  the subject of competitiveness.  Yet, before we embark on some willy nilly  Government policy designed  to address and  correct every economic malady we  faceJanuary 29, 1987  something which  the  Federal Government  can't and shouldn't do-we need  to define  competitiveness, or why America isn't as com petitive as it once was.  To my understanding, competitiveness  in  economic terms means declining productivity  growth,  rising  labor costs, a deplorably  low  savings  rate, stagnant or declining R&D ex penditures and, most visibly, a large trade im balance. To say  the  least,  these are symp toms of an economy in adjustment. A more  alarming  indictment, but perhaps more de served, these economic ills are characteristics  of an overregulated economy or a product of  incoherent and  irrational Government  fiscal  and monetary policies.  We all want increased productivity, a strong  industrial  base,  growing  employment,  in creased exports  (as opposed  to  limited  im ports) or, more simply, a higher standard of  living which presents Americans with more op portunity, and more choices. But the answer  does not  lie  in protectionist  trade policies.  These are counterproductive and can only ex acerbate our current problems.  But  before  embarking  on  trade  policies  which penalize consumers and actually hurt  the very firms they seek to protect, I'd would  commend  to my colleagues Arshad Kahn's  thoughts on shortsighted and counterproduc tive protectionist trade barriers.  We can't ignore the fact that to be competi tive today means responding  to international  economic challenges. But protectionist trade  policies are not  the answer. With sensible  Government policies-designed  to create a  fertile field for economic growth and not build  a fence around fortress America-1 have no  doubt that American firms are more than ca pable of meeting international challenges and  prospering in a global economy.  IMPORT RESTRICTIONS JUST INTENSIFY TRADE  WAR  <By Arshad M. Khan)  The U.S. trade deficit is likely to be $170  billion this year. And both the new speaker  of  the House, Jim Wright, and  the new  chairman of the Senate Finance Committee,  Lloyd Bentsen, have given high priority to a  trade bill. Just in case there is any doubt, a  trade bill means less, not more,  trade;  it  means import restrictions; and it means that  trading partners will retaliate with counter  restrictions.  Trade restrictions cost you and me, the  general consumer, and benefit just the few  they are designed to protect. It is variously  estimated,  for example,  that the ""volun tary"" quotas forced on the Japanese five  years ago cost the consumer about $400 per  car.  The argument for the quotas-that they  would provide time for our auto industry to  shape up-has not been sustained. Yes, the  industry has been profitable-domestic car  prices rose soon after the quotas were an nounced-but, according to industry analyst  J.D. Power Associates, the quality of most  of our cars has not improved. As for oper ations, one need go no further than indus try leader GM, which has announced 9,000  planned layoffs and 11 plant closings in four  states. As in autos, so in steel, so in textiles,  so in ...  Import restrictions are much like squeez ing a balloon-the bulge appears elsewhere.  We restrict Korean steel, and it starts to  come in as Korean toasters, irons and cars,  ",1987
82,,100,-0.1,959,2,Mr. TALLON.," Mr. Speaker, since my elec tion to Congress, one of the most heartbreak ing problems I have had is trying to help con stituents and  their families who are facing a  catastrophic  illness-illness requiring prohibi tively expensive or long-term treatment. I have  seen  the spirit of many  families broken not  only by the anguish of a disease, but also by  its overwhelming financial burden.  EXTENSIONS OF REMARKS  The  threat of catastrophic  illness  is very  real to all of us. Skyrocketing health care ex penses in addition to nursing home and home  care costs are draining the life savings of both  young and old. The President has recognized  the severity of the catastrophic health  insur ance gap and has issued a report on it.  What is clear is that no one is immune from  the devastating effects of catastrophic illness  because almost no one  is protected from  it.  Contrary to popular belief, Medicare does not  cover the extensive costs of catastrophic care  and  insurance  from  catastrophic  illness  is  simply beyond the financial means of individ uals and families.  Take  the case of a retired schoolteacher  whose 70-year-old husband became  ill with  cancer. They had Medicare coverage. They  had also bought supplemental coverage which  they assumed would pay any expenses not  covered by Medicare. His illness necessitated  three operations,  long-hospital stays, numer ous doctors' visit, and, finally, a nursing home  stay that  lasted until his death. The school teacher discovered that Medicare left substan tial costs uncovered. She also discovered that  their  supplementary  policy  covered  little  except  the Medicare deductible and copay ment charges  for  the hospital stays. They  were finally forced to sell their home and turn,  practically penniless, to the Medicaid Program  for assistance.  Or take the case of a divorced mother of  two who was self-supporting until she became  chronically ill at 33 years of age. She is now  39, exists on  intranvenous  feeding, and  is  hospitalized most of every  year. Her only  source of  income  is a disability check. For  reasons she does not understand she is not  eligible for her State's Medicaid Program, and  her health care bills far exceed her Medicare  coverage and private insurance benefits. The  pays what she can and is steadily increasing  her debt with hospitals and physicians. Her re curring nightmare is that she will die and leave  her children with her mountain of unpaid medi cal bills.  America has  the  finest medical system  in  the world. However, when  it comes to cata strophic care it is clear that we face a huge  health  insurance coverage gap. Catastrophic  costs will wipe a family out. Yet, today 30 mil lion Americans  lack health insurance and 1 0  million more lack adequate insurance to pro tect them from the risk of catastrophic illness.  More difficult, however, than the question of  whether the problem of catastrophic and long term health care should be addressed, is the  question of how. A number of options are cur rently  under  consideration  by  Congress.  These  recommendations differ according  to  the degree of Government  involvement and  cost.  One proposal,  titled  ""U.S. Health,"" would  provide comprehensive Federal public health  insurance for all Americans. This Federal pro gram would cover all patients and services, in cluding  basic  health,  long-term  and  cata strophic care.  A second option recommended by the Sec retary of Health and Human Services would  expand Medicare  to cover all health  care  costs for the elderly beyond $2,000 a year, in cluding catastrophic care. This proposal would  2377  require a $4.92 a month increase in Medicare  premiums.  A frequent argument against both of these  proposals is the substantial increase in public  spending they would require. A third alterna tive, however, would reduce excessive Feder al expenses by providing expanded Medicare  coverage while maintaining compulsory cost sharing for those who can afford it. The elder ly would still be protected  from catastrophic  costs although the upper limit for cost sharing  would vary with the income of the patient.  A  final  ""private sector"" plan calls  for  tax  and other incentives to induce health insurers  and businesses to cover nursing home care.  Savings would be put aside in tax-exempt indi vidual medical accounts, similar in principle to  an IRA.  These and other ways of coping with  the  catastrophic health care crisis will be a priority  for the 1 OOth session of Congress. Any ap proach must address the preservation of indi vidual choice and responsibility while also pro viding for the affordable financing of needed  health services.  Catastrophic health care  is not a problem  that will go away. Until we decide how cata strophic and  long-term care can best be  fi nanced-through public programs,  insurance  and other private means, or a combination an increasing number of young and older per sons in need of such care will expend all of  their  financial  resources and eventually be  forced to rely on Medicaid.  Private  sector  initiatives and  responsible  Government action can  lead  to a strength ened health care system and the ultimate res olution of this  important problem. Failure  to  act now will not make the problem disappear.  Indeed, delay may make it harder to solve as  the population ages.  MARTIN LUTHER KING, JR.  NATIONAL HOLIDAY  HON.ROMANOL.~OU  OF KENTUCKY  IN THE HOUSE OF REPRESENTATIVES  Wednesday, January 21, 1987  ",1987
83,,100,-0.186,959,2,Mr. MAZZOLI.," Mr. Speaker, I am particularly  proud, once again,  to  join all Americans  in  honoring Dr. Martin Luther King, Jr. on the oc casion of the second national holiday, com memorating his birthdate.  Dr. King's life and work  inspire and uplift.  His commitment to equality and justice is an  example  each  of us-whatever our back ground or state in life-should emulate.  As recent incidents in areas as far apart as  New York City and Forsyth County, GA have  shown, we as a nation still have not entirely  erased bigotry, hatred, and distrust. And eco nomic analyses show sharp differentials in the  earnings and employment outlook between  the races. Yet, as Dr. King once said:  ""We  must learn to live together as brothers or we  shall all perish together as fools.""  It behooves Americans to pull together, and  one mechanism toward that laudable goal  is  the national holiday we celebrate in Dr. King's  honor. We are afforded on  this holiday a  chance collectively to  look back  in  time  for  advice and counsel on how to look forward to",1987
84,House,100,-0.479,972,2,Mr. MINETA.," I thank our very fine  chair of the California delegation, Mr.  EDWARDS, for having taken the leader ship to get the time for all of us to  speak.  I  also wish  to  join all  the other  Members who have been touched in  many ways by both Phillip and SALA  over the years.  So as with the others, I extend our  deep  sympathy  to  the  immediate  family, Joy and her husband, to the  in-laws, John Burton, Bob Burton, and  all the others.  Frankly, I think all of us are part of  that family because I think SALA and  Phil thought of it in that way.  There is no question that she in her  own right was a strong person, consid ered a helpmate and partner to Phil lip.  In my thinking, her seniority began  when Phillip was sworn in here in the  House, but she really blossomed here  in her own right and continued in her  service as a Member of the House as a  loving, caring, strong person.  In 1983, I went through a cancer op eration but I was fortunate enough to  have, through surgical skills, have the  cancer  removed. Unfortunately,  the  ravages of cancer have taken a very  fine colleague from us. But we can all .  look back to various ways in which we  worked with her, whether it was the  redress issue impacting on Americans  of  Japanese ancestry,  to  something  that we will be doing tomorrow which  is overriding  the veto of  the Clean  Water Act by the President.  There is a provision in that Clean  Water Act tomorrow in which there is  a call for a study of the toxics and pol lutants in the San Francisco Bay that  SALA BURTON  loved SO much. I knOW  she is working with all of us in trying  to make sure that we get the necessary  votes on the override of that veto. But  everything she has been involved  in  has, as everyone has indicated here,  been laced with  love. Her caring of  things, her caring for people,  things  that were inanimate or animate, she  considered the same and she treated  respectfully in that same manner.  So she leaves a  legacy not only in  terms of public service, but a legacy of  legislation to whom all of us are very  much indebted.  Mr. Speaker, I yield to our colleague,  the gentleman from Minnesota [Mr.  SIKORSKI].  ",1987
85,House,100,-0.217,972,2,Mr. SIKORSKI.," I thank the gentle man from California.  SALA BuRTON was a very real gentle woman and a  true representative of  the United States. She was  fiercely  proud of her Polish origin, her Jewish  religion, her husband and partner, her  family, her city, her State, and her  country.  She cared deeply and worked hard  on her convictions. She hated intoler ance, but never displayed intolerance.  I think that is best exemplified in an  old prayer: Where there is hatred she  sowed  love, where  there was  injury,  pardon; where there was doubt, faith;  despair,  hope;  darkness,  light;  and  where there is sadness she sowed joy.  She sought not so much to be con soled as to console, not so much to be  understood as to understand, and most  importantly she sought not so much  to be loved as to love.  ",1987
86,House,100,-0.265,972,2,Mr. MURTHA.," Mr. Speaker, I want to take a  couple of moments to comment on  the very  sad passing of my friend and colleague, SALA  BURTON.  In her all  too brief career in  the House of  Representatives, she established herself as  someone who could be  trusted and as a  power for the people she represented. SALA  saw the national problems and tried to shape  solutions that would help the people.  I well remember talking with her about the  Synthetic Fuels Program,  the national impor tance I saw to it, and how dramatically a prob lem could potentially affect the economic and  jobs picture in  the area I represent. She  lis tened. She evaluated. She disagreed with the  overall program, but  recognized  the  impor tance  it could have  in  the  lives of so many  people in Pennsylvania. And  in the end, she  voted with us. She voted for people. That was  the kind of commitment SALA brought to Con gress-to make  the  institution work  to help  people throughout America.  Some of that can probably be traced to her  own childhood  in Poland. She fled ahead of  the Nazis. She later remarked it started her in terest  in politics because  ""when  the Nazis  were moving, you learn that politics is every body's business.""  SALA BURTON  left her mark on Congress  and the Nation. And she will long be remem bered by  those of us who were her friends  and colleagues. We are all better for knowing  her, and the institution and America suffer for  her death.  Mr. AuCOIN. Mr. Speaker, I heard the news  this morning  that SALA BURTON had passed  away, and, like a loss of any close relative or  friend, it is hard for me to accept the reality of  this loss.  The papers  talk about  the  ""public"" SALA:  The Congresswoman who worked  for  those  whose voices are often ignored-the poor and  minorities; who believed that our responsibility  as lawmakers was to help those less fortunate  in this Nation and who believed that it was our  responsibility to assure future generations that  they would live in a safe world.  But what about the woman who we knew as  a colleague and a  friend-the woman who  shared our frustrations and our victories? The  SALA  I knew believed that politics was not a  business or power trip. SALA believed that pol itics is everybody's business and that to earn  your place  in  these halls you have to go to  every constituent and ask for that right.  It  is hard  for me  to believe  that SALA  is  gone now, but when I'm on the floor or when  we're debating the issues that she fought so  hard  for-arms control, education,  the envi ronment-the loss will be all too real and all  too apparent.  I would also like to extend my condolences  to my  friend  and  former  colleague,  John  Burton. He should know that we all share in  this human  loss. The grief and void  that we  feel now, will be soothed by the memories of  how  full a  life SALA  lived,  the victories she  achieved, and  the  joy  that she brought  to  others, simply  through her words,  thoughts,  and actions.  ",1987
87,House,100,-0.644,972,2,Mr. DELLUMS.," Mr. Speaker, words cannot  express the ache in my heart and soul today.  On Sunday, February 1, our colleague and my  dear friend, SALA BURTON, was taken from us  at the young age of 61 by that hideous enemy  of life, cancer.  Less  than 4 years ago,  in April 1983, her  husband, my congressional mentor, and fierce  friend, Phil Burton, was struck down by an an eurysm. To those who knew and loved them,  SALA and Phil were  true partners  in every  aspect of  life-in marriage and  in politics.  They were dual inspirations and loyal friends,  ",1987
88,Senate,100,-0.301,998,2,Mr. MOYNIHAN.," Mr. President, I  thank the distinguished Senator from  Louisiana for his very clear explication  of the matter before us. He is indeed  correct.  The Committee on Environment and  Public Works has kept precisely to the  provisions of  the budget  resolution  adopted in the 99th Congress. This is  the unfinished business of the 99th  Congress that we are about.  He is particularly apt in pointing out  that we have to get this legislation en acted by  the first of March at the  latest.  I do not know why we cannot have it  the end of  this week, perhaps we  cannot,  but  immediately  after  the  recess surely we can.  In absence of  that, we are going to disrupt the or derly business of the Nation in main taining and  in building  its highway  system.  I would like to record that I have  noted the statement of  the Senator  from Louisiana,  that  if  there  are  amendments  to  this  legislation  that  raise the authorizations involved they  are subject to the budget provisions  and should we come back from confer ence with a measure that exceeds our  limits it too will be subject to a point  of order and there will be a general  pileup all around.  Mr. President, I suggest the absence  of a quorum.  The PRESIDENT pro tempore. The  absence of a quorum is suggested.  The clerk will call the roll.  The assistant legislative clerk pro ceeded to call the roll.  ",1987
89,Senate,100,-0.387,998,2,Mr. CRANSTON.,"  I announce that  the  Senator  from Delaware  BIDENl, the Senator from New Jersey  [Mr. BRADLEY], the Senator from Flor ida [Mr. CHILES],  the Senator from  Michigan [Mr. RIEGLE], and the Sena tor from Nebraska [Mr. ZoRINSKY] are  necessarily absent.  Mr. SIMPSON: I announce that the  the Senator from Oregon [Mr. HAT  FIELD], the Senator from Oregon [Mr.  PACKWOOD], and the Senator from In diana  [Mr. QuAYLE]  are necessarily  absent.  The PRESIDENT pro tempore. Are  there any other Senators in the Cham ber desiring to vote?  The result was announced-yeas 91,  nays 1, as follows:  [Mr.  [Rollcall Vote No. 13 Leg.]  YEAS-91  Adams  Armstrong  Baucus  Bentsen  Bingaman  Bond  Boren  Boschwitz  Breaux  Bumpers  Burdick  Byrd  Chafee  Cochran  Cohen  Conrad  Cranston  D'Amato  Danforth  Daschle  DeConcini  Dixon  Dodd  Dole  Domenici  Durenberger  Evans  Ex on  Ford  Fowler  Gam  Glenn  Gore  Graham  Gramm  Grassley  Harkin  Hatch  Hecht  Heflin  Heinz  Hollings  Humphrey  Inouye  Johnston  Kassebaum  Kasten  Kennedy  Kerry  Lauten berg  Leahy  Levin  Lugar  McCain  McClure  McConnell  Matsunaga  Melcher  Metzenbaum  Mikulski  Mitchell  Moynihan  Murkowski  Nickles  Nunn  Pell  Pressler  Proxmire  Pryor  Reid  Rockefeller  Roth  Rudman  Sanford  Sarbanes  Sasser  Shelby  Simon  Simpson  Specter  Stafford  Stennis  Stevens  Symms  Thurmond  Trible  Wallop  Warner  Weicker  Wilson  Wirth  NAY8-1  Helms  NOT VOTING-8  Bid en  Bradley  Chiles  Hatfield  Packwood  Quayle  Riegle  Zorinsky  So the resolution <S. Res. 85) was  agreed to.  ",1987
