,branch,congressID,ideology_score,page,part,speaker,speech,year
180,Senate,97,-0.224,662,7,Mr. CHILES.," Mr. President, today, I  am introducing a resolution to herald  the coming of a very special event to  south Florida. From June 4 to 26 of  this year, Greater Miami and Dade  County will host the New World Festi val of the Arts, an international spec tacle of  the performing and visual  arts. Some of you may already be fa miliar with the festival, as the event  has been publicized and acclaimed by  cultural interests all over the Nation.  In fact,  just in  the past few weeks  there have been advertisements and  feature pieces in principal newspapers  and periodicals  across  the  country.  But for those of you who are not yet  aware of the affair, I am here to tell  you that .it will be an unprecedented  cultural extravaganza. For 23 days and  nights, Miami will be aglow celebrat ing the arts of the Americas. The festi val will feature major productions in  music, dance, opera, theater, and the  visual arts created and performed by  famous artists and performers  from  throughout North America, Central  America, and South America. Included  in this ambitious agenda are over 200  live performances, 27  of which are  world premiers commissioned expressly for the festival. Among the more  notable  artists participating  in  the  celebration are Tennessee Williams,  Cynthia Gregory, Edward Albee, Geof frey  Holder,  Zubin Metha,  Chick  Corea, Lanford Wilson,  and many,  many more. All and all,  the festival  promises to make the Miami area the  place to be this June; for 3 weeks, it  will transform the area into the cul tural  entertainment  center  of  the  Western Hemisphere.  The New World Festival of the Arts  is the creation of Mr. Robert Herman,  who continues  to shape  its develop ment while serving as executive direc tor. Mr. Herman is also general man ager of the Greater Miami Opera, one  of the leading companies in the United  States. Mr. Herman's idea was basic,  yet unique and  tremendously ambi tious:  He wanted  to  organize  an  annual  artistic  event which would  stage major productions in a number  of different artistic media. The event  would draw on the talents of major  artists and performers from all over  the globe, and through this interna tional recipe, would encourage worldly  exchange  in the arts. Essentially,  it  would be a yearly showcase for some  of the world's greatest creative artists.  As a further example of prestigious  bill that has been planned, the follow ing groups will be highlighted:  the  Israel Philharmonic;  the Minnesota  Orchestra; the New World Ballet Com pany; the Paul Taylor Dance Compa ny; the Chamber Music Society of Lin coln Center; and  the Fusion Dance  Company. To convey a sense of the  international flavor  the festival will  offer,  I would cite: The Maracaibo  Symphony of Venezuela, which is ac claimed as South America's finest or chestra;  Camerata  Bariloche,  the  famous Argentine chamber orchestra;  Omar Mejia, the world renowned Sal vadoran pianist; Caio Pagano, Brazil's  most  famous  pianist;  and  the Five  Points of View Exhibit, which will  present the diversity of styles and in fluences  of  five  prominent  Latin  American artists: Botero, Cruz-Diez,  Manzur, Sanchez, and Zuniga.  As for the choice of location, what  better place than Miami could have  been selected as the home for an inter American arts f es ti val. Miami has tra ditionally served as the bridge between  the people and cultures of the Ameri cas. Its tropical climate, its position as  a point of entry for  those entering  from the south, and its thriving com mercial atmosphere have combined to  attract people from other American  countries to settle there. In fact, there  is probably no city  in  the country  which  sustains  as many  different  American cultural groups as Miami; it  is a  true pan-American city. In addi tion to its diversified makeup, it is im portant to note that Miami has also  experienced a tremendous swelling of  artistic interest on the part of its citizens. The people of the Greater Miami  area have in the past few years dem onstrated a support and generosity for  the arts which is much envied by cul tural interests in other cities. In short,  the city is a unique cultural crossroads  which is ripe for a major artistic cele bration, such as the New World Festi val of the Arts.  I am introducing this resolution to  acclaim the New World Festival of the  Arts because I believe it represents an  extraordinary artistic event. I feel that  all those connected with this momen tous undertaking deserve recognition  and praise. In a broader perspective,  however, I am also placing this resolu tion before you  as means  through  which the Senate can express its con tinued support for the arts, and for  cultural exchange in the arts among  the countries of  the Americas. Any  one with a concern about the vitality  of the arts in the United States has, in  my mind, an interest in the success of  the New World Festival of the Arts. In  the future,  the festival could easily  become one of the world's foremost  e..nnual artistic affairs. In light of this  potential, I feel that an expression of  support through a Senate resolution is  warranted. I realize that we have more  pressing matters before us today than  the state of the arts in this country,  but I think it is important that, from  time to time, we turn our attention to  the vital contributions that art makes  to improving the quality and color of  our  lives.  the American  artist,  Robert Motherwell said, ""Art is  less  important than life, but what a poor  life without art.""  In closing, I hope other Senators will  join me in sponsoring this resolution  which aims to promote art and artistic  exchange through acclaiming the New  World Festival of the Arts. In effect,  we will be supporting the cultural en richment of our society through art.e  As  AMENDMENTS SUBMITTED FOR  PRINTING  DEPARTMENT OF DEFENSE  AUTHORIZATION, 1983  AMENDMENT NO. 1441  <Ordered to be printed and to lie on  the table.)  Mr. Hayakawa <for himself and Mr.  MATTINGLY) submitted an amendment  intended to be proposed by them to  the bill <S. 2248) to authorize appro priations for fiscal year 1983 for pro curement, for research, development,  test, and evaluation, and for operation  and maintenance  for  the  Armed  Forces,  to  prescribe  personnel  strengths for the Armed Forces and  for civilian personnel of the Depart ment of Defense, and for other pur poses.  ",1982
181,Senate,97,-0.422,688,7,Mr. HART.," Mr. President, a key fea ture of the voting rights legislation,  which the full Senate will soon consid er,  is extension of the 1975 amend ments requiring bilingual registration  and voting assistance in areas with a  significant percentage of language mi nority citizens. These provisions cover  major  portions  of  the  Southwest  United States, including 34 counties in  the State of Colorado.  The effectiveness of  the bilingual  provisions has been a subject of dis pute throughout hearings and debate  over the Voting Rights Act extension.  This is  largely because the bilingual  provisions have been in effect for so  short a  time that information about  their implementation and usage is still  sketchy.  Last week,  however,  the  Mexican  American  Legal  Defense  Fund released the results of an exten sive study providing new, useful infor mation about the impact of these pro visions on Hispanic political participa tion in the Southwest. The study re veals, among other things, that 1 in 7  American citizens of Mexican descent  do not speak English; and that almost  one-third of the participants  in the  study, including some who speak Eng lish, would be less likely to register to  vote  if Spanish  language assistance  were not available.  This study, funded by the Carnegie  Corp. demonstrates that the bilingual  provisions of the Voting Rights Act  have made political participation a re ality for thousands of American citi zens. I commend it to my colleagues  and request those portions of the exec utive summary describing the major  findings and conclusions of the study  be  reprinted  in  the RECORD at  this  point.  The summary follows:  BILINGUAL ELECTIONS AT Woruc IN THE  SOUTHWEST  <A Mexican American Legal Defense and  Educational Fund Report>  EXECUTIVE SUMMARY  The Voting Rights Act amendments of  1975 expanded the protection of the land mark legislation to language minority citi zens: Hispanics, Asians,  Indians and Eski mos. A key feature of the 1975 amendments  requires bilingual assistance in registration  and voting in areas with a significant per centage of language minority citizens. The  issue of bilingual elections  is once again  before the Congress as it moves to renew  the Voting Rights Act before August 6,  1982, when many of its provisions expire.  A paucity of information on the impact of  bilingual elections and their need and usage  prompted the Mexican American Legal De fense and Educational Fund <MALDEF) to  undertake this study. Bilingual Elections at  Work in the Southwest presents the results  of our research. The findings indicate that  the bilingual  elections provisions of  the  Voting Rights Act have had a positive effect  on Mexican American participation in the  political process. Surveys of 912 U.S. citizens  ",1982
182,,97,-0.163,714,7,Mr. LUKEN.," Mr. Speaker, 166 Mem bers of Congress have sponsored or co sponsored  legislation  to  remedy  the  action of the Federal Government in  cutting off the social security student  benefits program without reasonable  notice.  Through the changes in the Omni bus Reconciliation Act of 1981, high  school seniors who have not enrolled  in postsecondary institutions and at tending classes  full  time by May  l,  1982 will lose their social security stu dent benefits. Obviously,  this unrea sonable deadline has eliminated thou sands of seniors who will not graduate  from high school until June 1982 and  have not been able to attain early en rollment into colleges.  Thousands  of  students  have  ar ranged  their college careers around  these promised social security benefits  with the impression that they would  be forthcoming. In fact, seniors were  given  erroneous notification by  the  Social Security Administration  that  they would be eligible for benefits this  fall. Now, students graduating in 1982  do not have sufficient time to make al ternate financial arrangements.  Although each of my distinguished  colleagues,  Representatives  MOTTL, SOLOMON, VOLKMER,  and PAT  WILLIAMS, has sponsored legislation to  rectify  this outrageous  treatment of  high school seniors across the country,  we have decided to unite our efforts  behind one bill, H.R. 6183, to insure  expeditious passage. The  legislation  that I  introduced on April 28, 1982,  will provide relief for 1982 high school  graduates by extending the college en rollment deadline from May 1, 1982 to  October 1, 1982.  Mr. Speaker, the May 1, 1982 dead line, together with the Social Security  Administration's  erroneous  notifica tion, has created undue hardship and  worries for families with deceased, dis abled,  or  retired  parents who  are  highly dependent upon their social se curity benefits to send their children  to college.  Even though the May 1, 1982, dead line has passed, we must continue to  work toward correcting this injustice.  Therefore,  I  strongly urge my col leagues to  join our bipartisan effort  and cosponsor H.R. 6183.e  LENT,  ",1982
183,,97,-0.631,727,7,Mr. STARK.," Mr. Speaker, much  debate has arisen in recent years over  the United  States  balance-of-trade  status with Japan. The majority of the  rhetoric has portrayed Japan as em ploying  exclusionary  business  prac tices that work to the benefit of the  domestic Japanese industries.  While in some cases it is unfair to  make this statement, it is true in the  EXTENSIONS OF REMARKS  high technology sector. In particular,  the inability of American industry to  penetrate the Japanese market is caus ing  irreversible damage  to American  firms in the development and market ing of semiconductor  technology. A  recent study prepared for  the Joint  Economic  Committee  of  Congress  states:  The loss of leadership in this one industry  would mean the loss of international com petitiveness in many of the advanced tech nology sectors that have been the basis of a  U.S. advantage since the second world war.  The study characterizes  the Japa nese economy as one of ""controlled  competition"" whereby the intensity of  competition is directed and limited by  State actions and by the formal and  informal collaborative efforts of indus trial  and  financial  enterprises. By  acting both as a doorman who restricts  entry, and as a promoter who subsi dizes growth  in particular industrial  sectors, the State places itself in a po sition which wields authority over the  development and  international com petitiveness of these industries.  Historically, the Ministry of Interna tional Trade and Industry <MIT!) has  been the Japanese Government's chief  tool for implementing restrictive poli cies. These  policies,  among  others,  have included: First, requiring Govern ment approval of all applications for  direct  foreign  investment  in Japan;  second, limiting import penetration via  high tariffs and exclusionary customs  procedures; and third, limiting access  by licensing advanced technology and  know-how. The  result  of  this  last  policy has been a controlled diffusion  of  advanced  technology  throughout  the Japanese semiconductor industry.  The  experience  of Texas  Instru ments in the 1960's is a good example  of this last point. Texas Instruments  applied for Japanese patent licenses  for  its  technology, but approval was  held up by the Japanese Government.  In the  interim,  the  timelag allowed  Japanese firms to catch up technologi cally to Texas Instruments. This strat egy thus is one means by which Japa nese  firms  are  able  to mimic  the  timing of technological achievements  in the United States.  Other examples of restrictive poli cies from the joint committee report  and a Ways and Means Trade Subcom mittee report on its Trade Mission to  the Far East include: First, the past  policy of NTI' <Nippon Telephone and  Telegraph)  to  refuse  to  allow  the  equipment supplied to them by Japa nese firms to include imported semi conductors; second, the refusal to li cense to American firms proprietary  production  technology  that  comes  from  Government-funded  research  and development  that  is  otherwise  available to Japanese industries; third,  the denial to American producers of  the same access  to Japanese stand ards-setting procedures  as  Japanese  9125  producers enjoy in the United States.  Also, Japan rarely accepts American  test data to certify compliance with  test standards-a costly and time-con suming problem for importers.  In addition  to  these Government  policies,  the  Japanese  distribution  system is confusing not only because it  is so rooted in old relationships and  obligations, but also by its length and  complexity which combine to become  prohibitively expensive, even for goods  which  start  on  a  cost-competitive  basis.  It is  important  to  remember  that  these  ties created during  the  period of  time when formal market  controls were  in effect do not end  quickly because the Government an nounces the implementation of a more  open market policy. As  the Japan United  States  Economic  Relations  Group <Wisemen's Report) noted:  Other factors, such as administrative pro cedures, regulatory requirements, business  practices, and cultural and social barriers  are very difficult to compare <with the U.S.  system). It is our judgment, however, that  these informal barriers make it especially  difficult  for  foreigners  to  fully penetrate  Japanese business and society.  In a recent issue of the Journal of  Japanese Trade and Industry, MITI  states that it feels the proper role of  the Government was to do no more  than to provide guidance to the pri vate sector. However, the above exam ples clearly do not look like mere guid ance-they  are  unfair  protectionist  policies that harm the United States  to the benefit of Japan. Such a posi tion is clearly not in keeping with the  prevailing Japanese rhetoric about the  openness of  their markets and  the  fairness of their system.  There is a common awareness that  both sides want and need to trade with  one another. However, the present sit uation  is  clearly unacceptable  from  the American viewpoint and the Japa nese can rest assured we will not allow  it to continue. We are not going  to  take it any more.  It takes more than mere words to  make a market be truly open. Tangible  evidence  through sales  in Japan of  American hi-tech products  such  as  semiconductors is what we want. The  Joint Economic Committee report con cludes that ""given the history of dis crimination     the burden rests on  the  Japanese  to  demonstrate  that  their markets are in fact open."" Only  when they have done that can Con gress and the American people rest as sured that we really are on the road to  a more  equitable,  and  acceptable,  trade balance.e  ",1982
184,,97,-0.553,740,7,Mr. OBERSTAR.," Mr. Speaker,  in  the past, we have been blameless in  pollution disasters only through lack  of awareness or full understanding of  the problems our society was creating  for itself and for future generations.  Acid rain  is unlike  these past prob lems; we  can  see  this one coming.  Unlike the past, we have an opportuni ty to act now before it is too late; an  opportunity to act to stop the pollu tion debacle  before  it  is  upon us;  before we become engaged in a mas sive and costly battle to roll back the  damaging effects of acid rain.  My concern is that, unlike water pol lution, the effects of acid rain may be  irreversible.  Some 15,000 lakes in Sweden are al ready dead from  the effects of acid  rain.  In  the  Province  of Ontario,  Canada, 45,000 lakes are showing the  effects of acid rain and many there are  already dead. Lakes in the Adirondack  Mountains  and  in  the  Boundary  Waters canoe  area of northeastern  Minnesota are already the victims of  acid fallout. We ignore these warning  signs only at our own peril. We cannot  def er action on the repeated appeals  of certain special interests for delay in  cleanup because we have not achieved  absolute  scientific  certainty  about  cause and effect, cost and benefits of  acid  rain  and  abatement  actions.  Future generations will hold us ac countable  and  they will  not  ask  whether we spent  too much or  too  little; did we know enough; or was our  knowledge inadequate? They will only  ask, did we act in time to preserve a  decent quality of life for them?  Mr. Speaker, I was one of the very  early supporters of acid rain research,  and was  instrumental  in convincing  the Carter administration to put to gether  a multiagency, multimillion  dollar  task  force  to  research  the  causes and prevention of acid rain.  While I certainly support continued  research, it is clear to me and to the  people  of  northeastern Minnesota  whom I  represent that we must act  now on the basis of what we already  know, to control acid rain to the great est extend possible.  We know that some of the lakes of  the Northeast are severely acidified;  EXTENSIONS OF REMARKS  and  that many  in  the Midwest are  threatened.  Studies  have  indicated  that acid rain has caused damage to 15  percent of  the  lakes  in Minnesota,  with another 2,000 in immediate jeop ardy.  We  know  that  acid  rain  causes  damage and death to aquatic life, to  forests, vegetation, and  farm  crops,  can directly damage human health  through  respiration,  and  indirectly  through  contamination  of  drinking  water.  Another study estimates that acid  rain could cost Minnesota alone up to  $64 million annually in reduced forest  productivity, and another $400 to $600  million in loss of soil fertility.  These costs are, in large part, trans ferred from the sources of acid rain to  the recipients.  Mr. Speaker, this is a grossly unfair  trade.  To refuse to control acid rain on eco nomic grounds is a totally false econo my; such arguments may spare those  who  cause  the  problem,  but  the  burden does not go away; it simply is  passed on to innocent recipients.:._the  farmers,  foresters,  fisherman,  and  resort owners and citizens of Minneso ta and many other parts of the coun try.  Congress must, this year, include a  strong  acid  rain  provision  in  the  amendments to the Clean Air Act. I  pledge my assistance, working with my  colleagues and  the vast majority of  Americans, to bring that provision into  law.e    FAILURE TO ACT ON URGENT  SUPPLEMENTAL  FOR  FISCAL  1982 <H.R. 5922)  HON. JOHN N. ERLENBORN  OF ILLINOIS  IN THE HOUSE OF REPRESENTATIVES  Thursday, May 6, 1982  e ",1982
185,,97,0.315,740,7,Mr. ERLENBORN.," Mr.  Speaker,  one has to wonder why a bill labeled  ""urgent""  is allowed  to  linger for 44  days after committee approval before  being brought to a House vote.  That is what has happened to the  urgent  supplemental  appropriations  bill for fiscal 1982, H.R. 5922; and it is  no easy matter to explain to constitu ents who are calling about funds for  wa.stewater treatment plans, or the 20percent interest they will have to pay  on tax bills being appealed which are a  part of a 47,000-case backlog at the  Tax Court.  It is harder still to explain to Feder al workers whose jobs are on the line  who are wondering whether they will  have full paychecks in June.  H.R. 5922 is called an urgent bill, be cause it is urgent. I may not support  every item in the bill, but we know it  will be acted upon at some point-and  May 6, 1982  it is morally wrong and cruel, as well  as bad management, to delay action.  The Bureau of Alcohol, Tobacco and  Firearms will have to furlough 1,600  employees if it does not get the $15.7  million provided in H.R. 5922 by June  27. Under present plans, 950 of the Bu reau's 1,200 agents will be furloughed,  and law enforcement activities there  will virtually come to a standstill.  The Bureau of Labor Statistics sent  out furlough notices April 13 to 1,900  people. If they are  furloughed, our  monthly reports of the consumer price  index, unemployment, and producer  prices are not going  to be made on  schedule.  The Employment and Training Ad ministration's 30-day furlough notice  went out this week to 2, 700 employees,  and 3, 700 notices are to go out tomor row to employees at the Employment  Standards Administration.  Mr. Speaker, H.R. 5922 is urgent and  it is in your power to move this bill. I  urge you to act with urgency.e  TOWARD A PEACEFUL SETTLE MENT OF THE CONFLICT  IN  CYPRUS  HON.BERNARDJ.DWYER  OF NEW JERSEY  IN THE HOUSE OF REPRESENTATIVES  Thursday, May 6, 1982   ",1982
186,,97,-0.373,740,7,Mr. DWYER.," Mr. Speaker, I would  like to  join my colleagues who have  participated in the recent Cyprus Day  commemoratives here in the Congress  in calling for a peaceful resolution of  the conflict in Cyprus.  The forced occupation of any terri tory is a situation which we, as citizens  of a country dedicated to freedom and  self-determination, must do what we  can to help resolve through peaceful,  diplomatic initiatives.  This July will mark the eighth anni versary of the invasion and occupation  of Cyprus. The time for an easing of  the tension in that country, and like wise, an easing of the hardship and  suffering of the 200,000 Cypriot refu gees, is long overdue.  The United States has a vital inter est in fostering a peaceful settlement  in Cyprus, first as humanitarians dedi cated to international human rights.  We must also recognize the emerging  Soviet presence in the Mediterranean  and the consequences of allowing that  presence  to  thrive unchecked  in the  type of environment the Soviets know  best: conflict and discontent.  It is everyone's best interest, then, to  resolve the Cyprus tragedy peacefully  and soon.e  ",1982
187,House,97,-0.4,753,7,Mr. FASCELL.," Mr. Speaker, to con clude  the debate on  this matter on  this side, I yield such time as he may  consume to the distinguished gentle man  from California <Mr.  who is one of the original sponsors of  the resolution, which was ref erred to  the Committee on Foreign Affairs.  ",1982
188,House,97,-0.376,753,7,Mr. LANTOS.," Mr. Speaker, this is a  significant bipartisan decision we are  making this afternoon. We are serving  notice on the totalitarian majority of  the United Nations that we will not  allow  the  application  of  a  double  standard of morality.  As my colleagues on both sides of  the aisle have pointed out, the United  Nations was silent time after time in  the face of the most outrageous viola tions of human rights. But the United  Nations has  singled out one  small  democratic nation for discrimination  and possible expulsion. I think it is a  significant moment in the history of  LANTOS),  this body that both Republicans and  ",1982
189,Senate,97,-0.145,779,7,Mr. NUNN.," No, Mr. President,  I  shall probably not take any more than  my time.  ",1982
190,,97,0.078,857,7,Mr. HEINZ.,  I yield without  losing  my right to the floor to the Senator  from Kansas.  ,1982
